0,"Und ich gebe es gern zu, dass ich den Ort ausgesucht habe, damit du mir nicht so ohne Weiteres davonkommst."
0,"Du kannst dich nicht zurückziehen, zum Beispiel, weil du im Krankenhaus noch schnell nach einem Patienten sehen musst."
0,Hier gibt es nur dich und mich.
0,Kommen wir zur Sache!
0,"Ich möchte jetzt wissen, wer mein Vater ist."
0,"Ich bin vierzehn Jahre alt geworden und denke, du solltest es mir endlich sagen."
0,Außerdem sind Mädchen in der Entwicklung Jungs gegenüber immer weiter entwickelt.
0,"Ich kann es verkraften, was immer auch war, wer es auch ist, selbst wenn du nicht genau wissen solltest, wer es ist."
0,Ich habe dich lieb.
0,Nur das zählt für mich.
0,"Ich verstehe, dass du damit hast warten wollen, bis ich älter bin."
0,"Aber ich bin in einem Alter, in dem ich mich selbst verlieben könnte."
0,Deshalb will ich etwas über meine Wurzeln wissen.
0,Du musst mich in diesem Punkt nicht mehr beschützen.
0,Ich will alles wissen.
0,Wer er ist?
0,Wie hast du ihn kennengelernt?
0,Warum seid ihr nicht zusammengeblieben?
0,"Warum wolltest du erst darüber reden, wenn ich älter bin.«"
0,Caroline gefror das Blut in den Adern.
0,"Sie spürte, dass sie sich dieses Mal nicht herauswinden konnte."
0,"In Amelies Stimme lag eine Entschlossenheit, die sie bisher nie gezeigt hatte."
0,Caroline umklammerte den Emailbecher mit beiden Händen.
0,"»Wir haben noch so viel Zeit, darüber zu reden.«"
0,»Haben wir nicht!
0,"Das hast du immer gesagt, wenn ich gefragt habe."
0,Dieses Mal will ich es wissen!«
0,"»Amelie, ich dachte, ich sage es dir, wenn du volljährig bist.«"
0,"»Nein, das dauert mir entschieden zu lange."
0,Das sind noch fast vier Jahre!«
0,"Caroline dachte nach, dann sagte sie: »Amelie, wir reden darüber."
0,Ich verspreche es.
0,Aber ich kann nicht so spontan darüber sprechen.
0,Wir reden morgen darüber.
0,"Ich muss mir Gedanken machen, wie ich es dir sage."
0,"Ich habe es immer hinausgeschoben und mir nie Gedanken gemacht, was ich dir genau sage und wie.«"
0,"»Mama, dann mache ich den Anfang."
0,Ich stelle Fragen.
0,Ist Mark Steiner mein Vater?«
0,Caroline zuckte zusammen.
0,"»Wie kommst du darauf?«, stieß sie hervor."
0,"»Weil ich gestern mit ihm geplaudert habe, als ich ihn traf."
0,"Ich weiß, dass du rot geworden bist, als du ihn gesehen hast."
0,"Du hast so getan, als würdest du ihn nicht kennen."
0,"Aber alle, die dabei waren, haben gesehen, wie es dich getroffen hat."
0,Außerdem habe ich ihn heute noch einmal gesehen.
0,Er hat mir von eurem Gespräch erzählt.
0,"Nämlich, dass du ihn hast abblitzen lassen."
0,"Mama, kennst du ihn?"
0,Ist er mein Vater?«
0,"»Nein, da kann ich dich beruhigen."
0,Er ist es nicht.«
0,»Das dachte ich mir.«
0,»Wieso?
0,Warum fragst du mich dann?«
0,»Weil es einen Max Steiner gibt.
0,"Ich denke, der Familienname hat dich an ihn erinnert.«"
0,Caroline wurde tief dunkelrot.
0,"»Woher weißt du, dass es einen Mann mit dem Namen Max Steiner gibt?«"
0,"»Weil ich Großmutter geholfen habe, den Dachboden aufzuräumen."
0,Das war in den letzten Sommerferien.
0,"Großmutter und ich wurden aber dabei unterbrochen, weil eine Nachbarin kam."
0,So war ich eine Weile allein auf dem Dachboden.
0,"Da stöberte ich etwas und fand Sachen von dir, von deinem Studium und andere Dinge."
0,"Darunter auch einen Packen mit Briefen, die dir Edeltraud aus Kanada geschrieben hatte."
0,Darin erwähnte sie den Namen Max Steiner.«
0,Caroline trank einen Schluck Tee.
0,"Sie hatte nicht die Kraft, Amelie anzusehen."
0,"»Das Datum auf dem Brief, der Name Max Steiner, die Tatsache, dass eine Schwangerschaft neun Monate dauert, der Inhalt des Briefs und mein Geburtsdatum, wenn ich das alles in Beziehung setze, dann gibt es nur ein Ergebnis.«"
0,"»Ja, es stimmt."
0,Dein Vater heißt Max Steiner.«
0,»Bravo!
0,Danke!
0,Weiter!
0,Und was ist damals geschehen?
0,Wollte er nichts von mir wissen?
0,Warum hat er mir nie geschrieben und sich gemeldet?
0,"Es gibt Geburtstage, es gibt Weihnachtsfeste und Namenstage."
0,Wolltest du es nicht?
0,Hast du den Kontakt unterbunden?
0,Hast du ihn mir vorenthalten?«
0,Caroline schaute ihre Tochter an.
0,Ihre Augen füllten sich mit Tränen.
0,"»Amelie, ja, du bist alt genug."
0,Ich will dir alles erzählen.
0,"Ich verstehe, dass du ärgerlich bist."
0,"Vielleicht war es falsch von mir, so lange zu schweigen."
0,Ich wollte nicht mehr an ihn denken.
0,"Und ich wollte dir nicht sagen, dass du von ihm nicht gewollt gewesen bist."
0,"Es ist doch das Schlimmste, was man einem Kind sagen muss, dass es nicht gewollt war."
0,"Besonders, wenn es so heftig von seinem Vater abgelehnt wurde."
0,Du solltest dich nicht ungeliebt fühlen.«
0,Amelie nahm ihre Mutter in den Arm und streichelte ihr die Wange.
0,"»Mama, du hast mich geliebt und gewollt."
0,Du warst immer für mich da.
0,Du warst eine wunderbare Mutter und wirst es immer sein.«
0,Jetzt fing Caroline richtig an zu weinen.
0,Sie schluchzte.
0,Amelie war zutiefst erschrocken.
0,"Sie hatte damit gerechnet, das sie mit ihrer Mutter streiten würde, nicht damit, dass sie einen Nervenzusammenbruch erleidet."
0,"»Mama, höre bitte auf zu weinen!"
0,Es tut mir leid.
0,Ich wollte das nicht.
0,"Bitte, weine nicht mehr!"
0,Du musst mir auch nichts mehr erzählen.
0,Ich kann warten.
0,"Höre nur ­bitte auf zu weinen!«, flehte Amelie."
0,Caroline schnäuzte sich die Nase.
0,"»Das bringt nichts, Amelie."
0,Reden wir!
0,Ich muss auch mein Gewissen erleichtern.
0,"Dann weißt du Bescheid, und ich muss keine Angst mehr haben, dass jemand herausfindet, dass ich nach deiner Geburt ein Doppelleben geführt habe.«"
0,"»Wie ein Doppelleben?«, staunte Amelie."
0,"Caroline bat Amelie, ihr einen kleinen Augenblick des Nachdenkens zu geben."
0,Sie musste sich sammeln und ruhig werden.
0,In ihrem Innern brauste ein Orkan und riss alles mit sich.
0,Sie stand auf und ging vor der Schutzhütte auf und ab.
0,Dabei hielt sie den Kopf leicht gesenkt und sah nicht zu Amelie hinüber.
0,Dann setzte sie sich wieder.
0,»Dein Vater hieß Max Steiner.
0,"Ich hatte gerade mein Abitur gemacht, etwas früher, weil ich eine Klasse übersprungen hatte."
0,Das Gymnasium schlug mich für ein Stipendium vor.
0,"Um das zu bekommen, musste ich mich bei dem Vergabegremium persönlich vorstellen."
0,Ich fuhr dorthin.
0,Ich hatte noch etwas Zeit bis zu meinem Termin und ging in ein Straßencafé.
0,Dort sprach mich Max an.
0,Wir verstanden uns auf Anhieb.
0,Er war sehr lustig.
0,"Er begleitete mich und wartete auf der Straße, bis ich wieder herauskam."
0,Dann zeigte er mir die Stadt.
0,Wir gingen zusammen Pizza essen und danach ins Kino.
0,Dort haben wir uns zum ersten Mal geküsst.«
0,Caroline trank einen Schluck Tee.
0,"»Wie du weißt, bekam ich das Stipendium."
0,"Es war viel Geld, und deine Großeltern gaben mir auch Geld."
0,"Sie wollten, dass ich mich auf mein Studium konzentrieren konnte."
0,Ich mietete eine kleine Wohnung und fing an zu studieren.
0,Max besuchte mich oft.
0,"Es war immer sehr lustig, wenn er da war."
0,"Er war ein fröhlicher, übermütiger junger Mann."
0,Wir wurden ein Liebespaar.
0,"Dass es zu einer Schwangerschaft kam, war nicht beabsichtigt."
0,Aber manchmal schlägt einem das Schicksal ein Schnippchen.
0,"Am Ende des ersten Semesters stellte ich fest, dass ich schwanger war."
0,Ich sprach mit ihm.
0,Max erschrak.
0,"Er warf mir vor, ich hätte ihn hereingelegt, deshalb sollte ich selber sehen, wie ich klarkomme."
0,Außerdem könnte ich neben ihm noch andere Liebhaber gehabt haben.
0,Er habe von Anfang an nie eine feste Beziehung angestrebt.
0,"Frau, Familie, Kind, das seien Hemmschuhe, die er sich nicht anziehen ließe."
0,Ich weinte mir mehrere Tage die Augen aus.
0,"Dann gestand ich meinen Eltern, dass sie Großeltern würden."
0,"Sie waren die Einzigen, denen ich es sagte."
0,Und ich schrieb an Edeltraud.
0,"Du weißt, dass ich die Erste und Einzige in der ganzen Verwandtschaft war, die zur höheren Schule ging und dann studierte."
0,Alle waren dagegen gewesen.
0,"Jetzt kam dazu, dass ich schwanger war."
0,"Vater hörte schon die spöttischen Bemerkungen, dass das ja habe so kommen müssen."
0,Deine Großmutter war da praktischer veranlagt.
0,"Sie half mir, nicht weil sie sich schämte, sondern weil sie sich auf das Enkelkind freute und dich und mich beschützen wollte."
0,Sie dachte sich einen Plan aus.
0,"Ich stand noch so unter Schock, dass mir alles recht war."
0,Dein Großvater ließ sich weit weg versetzen.
0,"Sie kratzten Geld zusammen, und ich konnte mich verstecken."
0,"Offiziell sagten sie, ich sei im Ausland."
0,"Dann erzählten sie, ich hätte geheiratet und sei danach Witwe geworden."
0,Nach deiner Geburt kam ich in Trauerkleidung nach Hause und spielte die junge Witwe.
0,Ich ließ dich bei meinen Eltern und ging wieder an die Universität.«
0,Amelie machte große Augen.
0,"»Ist niemand aufgefallen, dass du noch immer den Familiennamen ›Busch‹ trugst?«"
0,"»Nein, wer von den Verwandten will schon den Trauschein sehen?"
0,"Außerdem waren wir beide polizeilich an meinem Studienort gemeldet, nicht bei den Großeltern.«"
0,Amelie schüttelte den Kopf.
0,"»Was für eine Schmierenkomödie!«, sagte Amelie."
0,"»Es ist doch nichts dabei, unverheiratet zu sein und ein Kind zu haben.«"
0,Caroline schaute Amelie ernst an.
0,"»Amelie, das sagt sich so leicht."
0,"Es gab damals, obwohl es noch nicht lange her ist, noch viele Vorurteile."
0,In der Stadt ist es etwas anders als auf dem Land.
0,Du solltest ohne Anfeindungen aufwachsen.«
0,»Das ist dir gelungen.«
0,"»Noch etwas, Amelie, an der Universität wusste niemand, dass ich ein Kind hatte."
0,Ich ging danach an das kleine Kreiskrankenhaus.
0,"Es lag so abseits, dass sie schwer Personal bekamen."
0,"Du weißt, ich bin heute noch dort, und ich werde jetzt Oberärztin."
0,Ich habe mir auch dort eine Fassade aufgebaut.
0,Ich hatte den Vater meiner Tochter kurz vor der geplanten Hochzeit verloren.
0,Ich baute eine Mauer um mich herum und sprach niemals darüber.«
0,Amelie stand auf und ging in die Schutzhütte.
0,Inzwischen war es dunkel geworden.
0,Sie holte eine Stablampe.
0,Sie setzte sich wieder zu ihrer Mutter.
0,"»Mama, du musst dir keine Vorwürfe machen."
0,Du hast alles richtig gemacht.
0,Dieses Doppelleben muss sehr anstrengend für dich gewesen sein.«
0,"»Das war es, Amelie."
0,"Ich wollte Karriere machen und erfolgreich sein, damit ich dir später etwas bieten konnte."
0,Du solltest nichts entbehren.
0,Deshalb habe ich neben dem Studium in Krankenhäusern gearbeitet.«
0,"»Mama, mache dir keine Sorgen!"
0,Es war eine gute Strategie.
0,Ich bin dir nicht böse.«
0,»Du verurteilst mich und deine Großeltern nicht?«
0,"»Nein, keinesfalls!"
0,Ihr wolltet mich beschützen.
0,"Mama, ich habe dich so lieb!«"
0,Caroline streichelte Amelie über das Haar.
0,"Amelie sah in den Augen ihrer Mutter, wie dankbar und erleichtert sie war."
0,Sie blinzelte ihr zu.
0,»Und noch jemand hat dich lieb.
0,"Das weißt du, Mama, oder?«"
0,»Du sprichst von Mark Steiner?«
0,"»Ja, und ich kann verstehen, dass er dich an Max erinnert, Mama."
0,Er sieht ihm wirklich sehr ähnlich.«
0,"»Amelie, als ich Mark sah, und er sich mit vollem Namen vorstellte, da dachte ich, ich verliere das Bewusstsein."
0,"Ich erinnerte mich, dass Max ein paarmal von seinem Bruder gesprochen hatte."
0,"Mein Herz krampfte zusammen, bei der Vorstellungen, dass Mark der Bruder von Max sein könnte.«"
0,Amelie griff nach der Hand ihrer Mutter und hielt sie fest.
0,"»Was soll daran so schlimm sein, Mama?"
0,Außerdem ist es so.
0,Mark war kein Einzelkind.
0,"Sein jüngerer Zwillingsbruder ist Max, somit ist Mark mein Onkel."
0,"Wenn du Max geheiratet hättest, wäre er dein Schwager.«"
0,Amelie zog das Foto aus der Tasche ihrer Wanderjacke und reichte es ihrer Mutter.
0,Im Kegel der Stablampe hielt Caroline das Foto mit zitternden Händen fest.
0,Dann schaute sie Amelie an.
0,"»Was hat du mit Mark gesprochen, Amelie?«, fragte Caroline ängstlich."
0,Amelie seufzte tief.
0,"»Gut, dann bin ich jetzt damit dran, zu beichten."
0,Das Wichtigste zuerst.
0,"Du wirst Max nie mehr begegnen, es sei denn im Himmel."
0,Und dort gelten andere Regeln.
0,Max ist vor ein paar Jahren vom Pferd gestürzt und nach einer kurzen Zeit im Koma verstorben.«
0,Caroline saß ganz ruhig da.
0,Nach einer Weile schaute sie Amelie an.
0,"»Das tut mir leid für dich, Amelie."
0,"So wurde dir die Chance genommen, deinen Vater kennenzulernen."
0,"Ich dachte immer, dass du ihn eines Tages aufsuchen und ihn zur Rede stellen würdest.«"
0,"»Es ist vorbei, Mama!"
0,Aber es gibt Mark.
0,Und er liebt dich!
0,"Du, wir sollten ihn gemeinsam aufsuchen."
0,"Wenn du Beistand brauchst, dann komme ich gern mit.«"
0,"»Wusste er, dass du seine Nichte bist?"
0,"Wusste er, dass sein Bruder ein uneheliches Kind hat?«"
0,"»Nein, er wusste es nicht."
0,"Er war nur sehr traurig, dass du seine Liebe zurückgewiesen hast."
0,Er hat so gelitten.
0,"Ich hatte Mitleid und erzählte ihm von dem Brief, den ich gefunden hatte."
0,"Wir sprachen es nicht offen aus, aber wir dachten es uns."
0,"Mama, du musst mit Mark sprechen."
0,Er ist ein wunderbarer Mann.
0,Er liebt dich.
0,Er hat dir in München ein Geschenk gekauft.
0,Das brachte er in die Praxis.
0,"Er bat mich, es dir zu geben."
0,Aber ich lehnte ab.
0,Wir redeten.
0,Zuerst bei Beate in der Küche und dann später auf dem Reiterhof.
0,Wir gingen an den Koppeln entlang und saßen unter einem Baum.
0,"Mama, bitte sprich mit Mark!"
0,"Sage ihm, dass ich seine Nichte bin und rede mit ihm über meinen Vater."
0,Mark ist nicht Max.«
0,Caroline streichelte Amelies Haar.
0,»Ich werde mit ihm sprechen.
0,"Er ist wichtig für dich, Amelie."
0,"Er kann dir von deinem Vater erzählen, und du lernst deine Verwandten väterlicherseits kennen."
0,Ich habe nichts dagegen.«
0,»Das freut mich.
0,"Aber rede auch über die Gefühle, die er für dich hat."
0,Klärt das!
0,"Denke bitte daran, dass ich Onkel Mark öfter sehen werde und auch mal zu meinen Großeltern will."
0,"Ich möchte nicht, dass es da Spannungen gibt zwischen Mark und dir."
0,"Wenn du ihn nicht lieben kannst, dann muss er sich damit abfinden."
0,Aber vielleicht könnt ihr Freunde werden?«
0,Caroline schaute Amelie tief in die Augen.
0,"»Amelie, so unsympathisch finde ich ihn nicht«, sagte sie leise."
0,Amelie strahlte.
0,"»Mama, ich werde ihn anrufen und ihm sagen, dass du bereit bist, dich morgen mit ihm zu treffen.«"
0,"»Gib mir noch einige Tage, Amelie!«"
0,"»Nein, Mama!"
0,"Was du heute kannst besorgen, das verschiebe nicht auf morgen, das war ein Teil deiner Erziehung."
0,Wie hast du mich damit genervt!
0,Jetzt kommt die Retourkutsche.«
0,»Wo ist er jetzt?«
0,»Er wollte zum Waldschlösschen.
0,"Thomas, das ist der junge Graf, ist aus dem Urlaub zurück."
0,Die beiden sind Jugendfreunde.«
0,"»Dann müsste der junge Graf Max auch gekannt haben«, sagte Caroline."
0,"»Genau, das stimmt!"
0,Daran habe ich noch gar nicht gedacht.
0,"Er muss Max gekannt haben, Marks Zwillingsbruder."
0,"Dann ist es beschlossene Sache, Mama."
0,Nach dem Frühstück steht ein Besuch auf dem Schloss an.
0,Versprich es mir in die Hand!«
0,Caroline lachte und versprach es.
0,Inzwischen war es kurz nach Mitternacht.
0,"Zu spät um Mark anzurufen, fand Caroline."
0,Amelie wollte aber Nägel mit Köpfen machen und schrieb Mark eine kurze SMS.
0,Sie lautete: Lieber Onkel Mark!
0,Ich habe mit Mama gesprochen.
0,"Sie ist bereit, sich mit Dir zu treffen."
0,"Liebe Grüße Deine glückliche Nichte Amelie »So, jetzt gehen wir schlafen, Mama."
0,Das war ein sehr aufregender Tag.«
0,"Sie zogen sich in die Schutzhütte zurück, kuschelten sich in die Schlafsäcke und rückten auf dem Lager eng zusammen."
0,"Amelie schlief im Arm ihrer Mutter ein, wie sie es als kleines Mädchen getan hatte."
0,Caroline lächelte stumm im Halbdunkel der Schutzhütte.
0,Sie war so erleichtert.
0,"An Mark und wie das mit ihnen werden sollte, daran wollte sie jetzt nicht denken."
0,"Aber sie spürte, wie ihr Herz schneller schlug, wenn sie an ihn dachte."
0,Sie lag noch lange wach und schlief erst gegen Morgen für ein paar Stunden ein.
1,"* Caroline wachte auf, als ein Sonnenstrahl durch das kleine Fenster der Schutzhütte drang und ihr ins Gesicht leuchtete."
0,"Sie schaute nach Amelie, die noch fest schlief."
0,Vorsichtig schlüpfte sie aus dem Schlafsack.
0,Sie zog sich an und griff nach Amelies Handy.
0,Sie trank den Rest kalten Tee und setzte sich auf die Bank neben der Tür.
0,Leichte Frühnebelschleier hingen über dem Tal.
0,Carolines Herz klopfte.
0,"Sie schaltete Amelies Handy ein und las die Mail, die angekommen war."
0,"Sie lautete: Mein liebe Nichte Amelie, ich freue mich sehr darüber, dass es wahr ist und Du meine Nichte bist."
0,"Sage Deiner Mama, dass ich es kaum erwarten kann, mit ihr zu sprechen."
0,Ich liebe Deine Mama sehr.
0,"Sage ihr, dass ich auf dem Schloss bin und frage sie, wo sie mich treffen will."
0,Liebe Grüße Dein Onkel Mark Caroline las die Nachricht mehrmals.
0,"Sie legte das Handy zur Seite, lehnte den Kopf an die Wand und schloss die Augen."
0,Ihr Herz klopfte.
0,"War es die Liebe zu Mark oder war es, weil jetzt der Augenblick bevorstand, an dem sie mehr über Max erfahren würde?"
0,In ihrem Innern tobte ein Sturm.
0,Viele Gedanken schossen ihr durch den Kopf.
0,"Es dauerte eine ganze Weile, bis sie ruhiger wurde."
0,Langsam fand sie ihre Form wieder.
0,In ihrem Leben hatte sie immer alles nach Plan gemacht und war damit gut gefahren.
0,"Sie überlegte, was als Erstes zu tun war und wie sie sich verhalten sollte."
0,"Ihr war klar, dass sich der Horizont für Amelie erweitern würde."
0,Das Mädchen würde sich von ihrem Vater erzählen lassen.
0,Sie würde alte Fotos betrachten und würde neue Verwandte kennenlernen.
0,"Caroline fragte sich, wie Amelie aufgenommen werden würde und natürlich sie selbst auch."
0,"Was ihre Gefühle zu Mark anging, diese Frage stellte sie ganz hinten an."
0,Caroline seufzte erneut.
0,Sie nahm ihr Handy aus der Jackentasche und schickte Amelie eine Nachricht auf ihr Handy.
0,"Sie war sich sicher, dass ihre Tochter sofort nachsehen würde, ob neue Nachrichten eingegangen sind."
0,Die SMS lautete: Liebe Amelie!
0,Guten Morgen!
0,Ich bin schon früh los ins Tal.
0,Ich will ins Waldschlösschen und mich mit Mark treffen.
0,Komm später auch ins Tal und warte im Café Jakob auf mich!
0,Ich liebe Dich!
0,Du bist der wichtigste Mensch für mich!
0,"Mama »Gut, das ist jetzt auch geklärt.«"
0,Caroline schlich leise in die Schutzhütte und legte das Handy auf den Schemel neben das Lager.
0,Amelie schlief noch tief und fest.
0,"Sie lächelte im Schlaf, wahrscheinlich träumte sie schön."
1,Dann machte sich Caroline auf den Weg ins Tal.
0,"Sie lief ein Stück den ›Pilgerpfad‹ hinab und bog dann links in den Weg ein, der am Forsthaus vorbei nach Waldkogel führte."
0,Vor dem Forsthaus standen Waldarbeiter und Förster Hofer.
0,Sie grüßte und ging weiter.
0,Die Ladentür der Konditorei des Café Jakob stand offen.
0,"Caroline fragte, ob sie trotz der frühen Stunde einen Kaffee bekommen könnte."
0,Das war möglich.
0,Caroline trank den Kaffee im Stehen.
0,Dann ging sie weiter in Richtung Bergsee.
0,Der Uferweg führte zum Waldschlösschen.
0,Unentschlossen blieb sie vor dem offenen Tor stehen.
0,Außer dem Rauschen der Bäume war nichts zu hören.
0,Einige Fensterläden in der oberen Etage waren geschlossen.
0,Caroline schaute auf die Uhr.
0,Es war noch sehr früh.
0,"Ich kann ja am Ufer warten, dachte sie und schlug den Weg zum See ein."
1,Dann sah sie Mark.
0,Er saß auf einer Bank am Seeufer und schaute auf das Wasser.
0,Carolines Herz klopfte.
0,Sie spürte jeden Schlag.
0,Sie nahm all ihre Kraft zusammen und ging zu ihm.
0,"»Guten Morgen, Mark!«, sagte sie."
0,Mark sprang von der Bank auf und drehte sich um.
0,Er hielt noch sein Handy in den Händen.
0,»Guten Morgen!
0,Du bist schnell.
0,Bist du hergeflogen?
0,Es ist doch ein Stück Weg von der Berghütte herunter.
0,"Ich habe gerade Amelie geschrieben und den Vorschlag gemacht, dass wir uns hier sehen können.«"
0,Er schaute sie verlegen an.
0,»Dieses Mal will ich mich an die ärztlichen Anweisungen halten und nicht in den Bergen herumkraxeln.«
0,Caroline lächelte.
0,»Wie geht es deinem Knie?«
0,"»Danke, es tut nicht mehr weh."
0,Ich reibe es noch mit Salbe ein.
0,Aber ich habe keinen Verband mehr darum.
0,"Ich dachte, es ist empfehlenswert, wenn ich vorläufig ebenes Gelände vorziehe.«"
0,"»Das ist eine sehr kluge Entscheidung, Mark.«"
0,»Willst du das Knie sehen?«
0,»Das ist nicht nötig.
0,"Ich bin nicht als Ärztin hier, sondern als Amelies Mutter.«"
0,»Setz dich!«
0,"»Danke«, sagte Caroline."
0,"Sie setzte sich auf die Bank, aber mit einem Sitzplatz Abstand zu Mark."
0,"»Vielen Dank, dass du gekommen bist.«"
0,»Gern geschehen!
0,"Das Foto, auf dem du und Max zu sehen sind, habe ich in der Schutzhütte gelassen."
0,Du hast es Amelie ausgeliehen und sie wird es dir zurückgeben.«
0,Caroline schaute auf den See.
0,Ein leichter Wind kräuselte die Wellen.
0,"»Soll ich anfangen, Caroline?«"
0,"»Nein, ich möchte dir einiges sagen."
0,"Lass mich bitte, ich möchte mir alles von der Seele reden.«"
0,"»Gut, ich höre zu!«"
0,Caroline ballte die Fäuste in ihrer Jacke.
0,"Er sah, wie angespannt sie war."
0,"»Gleich, als ich dich sah und deinen Familiennamen hörte, dachte ich, dass du Max’ Bruder sein könntest."
0,Es traf mich wie ein Schlag.
0,"Ich erinnerte mich, dass Max dich erwähnt hat."
0,Viel hat er nicht erzählt.
0,"Doch als ich dann deine Patientendaten aufnahm, wurde mein Verdacht immer mehr bestätigt."
0,Deshalb habe ich mich so gewehrt.
0,"Ich war in Sorge, dass jetzt etwas über mich und natürlich vor allem über Amelie hereinbrechen könnte, etwas, das ich nicht mehr kontrollieren kann."
0,Ich hatte solche Angst um Amelie.
0,"Ich habe immer alles getan, sie von allem fernzuhalten, was nicht gut für sie war oder sein könnte."
0,Deshalb habe ich ihr nie etwas von ihrem Vater erzählt.«
0,"»Wusste Max, dass er ein Kind hat?«, fragte Mark dazwischen."
0,"»Ich hatte ihm gesagt, dass ich schwanger sei."
0,Es kam zu einer sehr unschönen Szene.
0,Er ging und ich habe nie wieder etwas von ihm gehört und gesehen.
0,"Ich bekam Amelie und zog sie auf, mit der Hilfe meiner Eltern."
0,Sie haben für mich und Amelie ihr ganzes Leben geändert.
0,"Wie, das werde ich dir ein anderes Mal erzählen."
0,"Ich habe mich immer davor gefürchtet, ich könnte Max einmal zufällig begegnen.«"
0,Caroline sah Mark an.
0,"»Dann bin ich dir begegnet, Mark.«"
0,Er lächelte sie an.
0,"»Ich habe Max einmal zu deiner Studentenwohnung gefahren, weil sein Auto kaputt war."
0,"Da habe ich dich kurz an der Haustür gesehen, aber nur von Weitem."
0,"Erinnerst du dich, Caroline?«"
0,"»Nein, damals hatte ich wohl nur Augen für Max.«"
0,»Das kann ich verstehen.
0,Alle jungen Frauen flogen auf ihn.
0,Er war der Begehrtere von uns beiden.
0,"Er war lebenslustig und wusste zu flirten, im Gegensatz zu mir."
0,"Meine Eltern und ich machten uns Hoffnungen, als er immer öfter von einer jungen Frau erzählte, mit der er sich regelmäßig traf."
0,Andere Madln schienen ihn plötzlich weniger zu interessieren.
0,"Vielleicht wird er jetzt ruhiger, dachten wir."
0,"Doch dann kam eine Zeit, da sprach er nicht mehr von dir."
0,Max trat eine Weltreise an.
0,"Er bummelte viele Jahre über die Kontinente, arbeitete auf Schafbetrieben in Australien und Neuseeland."
0,Er verdiente sein Geld als Viehtreiber in Texas und ritt dann Rodeos.
0,Er war schon als Kind ein unerschrockener Reiter.
0,Dann kam er zurück.
0,Er hatte viel Geld verdient und steckte es in die Pferdezucht und einen Reiterhof von Verwandten unseres Vaters.
0,"Er veränderte sich, wurde ruhiger."
0,"Gelegentlich hatte er immer noch Temperamentsausbrüche, wenn es nicht so lief, wie er es sich vorstellte."
0,Das wurde ihm zum Verhängnis.
0,Er verlor die Geduld mit einem jungen Hengst.
0,Der warf ihn ab.
0,Er starb an den Folgen des Unfalls.«
0,»Amelie hat es mir schon erzählt.
0,"Es ist schade, dass sie so nicht mehr die Chance hat, ihn kennenzulernen."
0,"Ich wollte ihr erst von ihm erzählen, wenn sie volljährig ist."
0,"Dann hätte sie selbst entscheiden können, ob sie Kontakt zu ihm will.«"
0,»Ich verstehe.
0,Du hättest es weder erlauben noch verbieten können.«
0,»Genau!
0,Ich wollte ihn nicht sehen.
0,"Dass er vorher sterben könnte, daran habe ich nie gedacht."
0,Hatte er Familie?«
0,Mark schüttelte den Kopf.
0,"»Er hatte immer irgendwelche Frauen, aber nichts war von Dauer.«"
0,"»Mark, kannst du mir sagen, warum er so entsetzt über meine Schwangerschaft war und verschwand?«"
0,»Max hatte einen großen Freiheitsdrang.
0,Er ordnete sich nie unter.
0,Er sah Regeln selten ein.
0,Er war lebenslustig.
0,Er mied Bindungen und dauerhafte Verpflichtungen.
0,"Unsere Eltern hatten viel Mühe mit ihm, dass er überhaupt die Schule abschloss und das Abitur machte."
0,Ich studierte Architektur.
0,Max war volljährig und wollte frei sein.
0,Vater ließ es ihm durchgehen.
0,"Er dachte, nach einer Weile würde er sich finden und wissen, was er im Leben machen wollte.«"
0,»Und jetzt mussten wir uns begegnen.«
0,»Das war Schicksal.
0,"Mir kam es im ersten Augenblick so vor, als hätte ich dich schon einmal gesehen."
