1,* Auf dem Weg zum Waldschlösschen las Mark im Vorbeifahren das Praxisschild der Tierarztpraxis Doktor Beate Brand.
0,"Er trat auf die Bremse, setzte einige Meter zurück und parkte."
0,Es war noch früh am Morgen.
0,Die Sprechstunde begann erst später.
0,Mark stand nachdenklich auf dem Hof und rieb sich das Kinn.
0,Eine junge Frau trat ans Fenster.
0,"»Grüß Gott!«, rief sie."
0,»Die Praxis ist noch geschlossen.
0,Bestimmt ist es ein Notfall.
0,Ich komme gleich.«
0,"Noch bevor Mark antworten konnte, war die junge Frau verschwunden."
0,"Es dauerte nicht lange, dann öffnete sie die Haustür."
0,Sie trug Jeans und ein längeres Hemd.
0,"»Ich bin Beate, die Viehdoktorin«, lachte sie."
0,»Wo ist das kranke Tier?
0,Hund?
0,Katze?«
0,»Ich bin Mark und ganz sicher ein Hornochse.
0,Ich muss dringend Amelie sprechen.
0,Sie macht doch ein Praktikum hier?
0,Das hat sie mir gestern erzählt.
0,"Ich muss wirklich dringend mit ihr sprechen und möchte ihr etwas mitgeben, für ihre Mutter.«"
0,Dabei errötete Mark tief.
0,»Das scheint wirklich ein ernster Notfall zu sein.
0,Amelie ist noch nicht da.
0,Ich bin am Frühstücken.
0,Wie wäre es mit einer Tasse Kaffee?
0,"Zweibeinige Hornochsen sind mein ganz privates, wissenschaftliches Forschungsobjekt.«"
0,Beate trat zur Seite und bat Mark ins Haus.
0,Sie ging voraus in die Küche und bot ihm einen Platz an.
0,Sie beobachtete ihn.
0,Er sah wirklich unglücklich aus.
0,"»Also, wo drückt der Schuh?«, fragte Beate und schenkte ihm einen Becher Kaffee ein."
0,Mark bedankte sich und nippte daran.
0,Er griff in die Tasche und stellte eine kleine rote Schachtel auf den Tisch.
0,»Ich möchte das hier Amelie mitgeben.
0,"Mir ist gestern nicht gelungen, es ihrer Mutter zu geben."
0,Vielleicht habe ich so noch eine Chance.«
0,Beate griff danach.
0,»Darf ich es mir ansehen?«
0,Mark nickte.
0,Beate klappte den Deckel zurück.
0,"»Ein Ring, das habe ich mir schon gedacht."
0,"Ein Verlobungsring, vermute ich?«"
0,»Ja!
0,"Es ist sehr schwer, Caroline zu erobern."
0,Den Ring trage ich schon fast zwei Wochen mit mir herum.«
0,Er seufzte.
0,"»Nun ja, zumindest habe ich Caroline gefunden, und ich habe Amelie kennengelernt."
0,"Vielleicht kann sie ihre Mutter überreden, meine Liebe zu erwidern."
0,Ich setze große Hoffnung darauf.«
0,"»Ah, deshalb Hornochse?«"
0,"Beate bewunderte den schmalen Goldring, mit dem schönen Stein."
0,Es war ein Diamant.
0,"»Wie wäre es mit der ganzen Geschichte?«, fragte Beate."
0,»Ich liebe Liebesgeschichten.«
0,Zuerst zierte sich Mark etwas.
0,Er fing langsam an und erzählte stockend.
0,Doch dann rissen ihn die Gefühle mit.
0,"Er schwärmte von Caroline und beschrieb immer und immer wieder, wie es um ihn geschehen war, als er aus dem Auto stieg und sie sah."
0,"»Es war wie …, wie der Urknall."
0,"Eine neue Welt tat sich vor mir auf, eine Welt voller Liebe."
0,"Da war Caroline, und ich wusste, dass sie die Frau ist, nach der ich mich gesehnt habe."
0,Logisch ist das nicht zu erklären.
0,"Es war die große Liebe, so wie sie in der Literatur beschrieben wird."
0,"Ich hätte nicht für möglich gehalten, dass es sie wirklich gibt."
0,Männer sind eher nüchtern und nicht so romantisch wie Frauen.
0,Oder wir verbergen es besser.«
0,Beate lächelte und schwieg.
0,"»Ja, so war es."
0,"Nach einer schlaflosen Nacht in München stand ich am nächsten Morgen vor dem Schmuckgeschäft und wartete, bis es öffnete."
0,Anschließend fuhr ich nach Waldkogel und begab mich auf die Suche.«
0,"»Ja, das ist eine romantische Geschichte«, sagte Beate."
0,Sie wünschte ihm alles Glück auf Erden.
1,Beate griff zum Handy.
0,Sie rief Amelie an.
0,"»Grüß Gott, Amelie, und Guten Morgen!«, sagte sie."
0,»Wann kommst du?«
0,"Amelie bat Beate, sich einen Augenblick zu gedulden."
0,Dann meldete sie sich wieder.
0,Sie ging mitten auf das Geröllfeld.
0,"»So, jetzt kann ich reden."
0,Ich saß bei meiner Mutter auf der Terrasse.
0,"Sie muss nicht hören, dass ich mit dir rede."
0,"Beate, es ist seit gestern viel geschehen."
0,"Entschuldige, dass ich dich noch nicht angerufen habe."
0,Ich war die halbe Nacht wach.
0,"Mama half einem verletzten Wanderer am Pilgerpfad, den ich vorher kennengelernt hatte."
0,Der Typ hatte Mama tagelang gesucht.
0,Er ist total verliebt in sie.
0,"Ich hatte gehofft, die beiden verstehen sich, und er kommt mit ihr auf die Berghütte."
0,Der Typ ist supernett.
0,"Er hat mir erzählt, dass er sich in Mama verliebt hat."
0,Da wollten Martin und ich ein wenig Schicksal spielen.
0,Aber sie kam allein zurück.
0,Ich habe Mama belogen.
0,"Ich habe gesagt, du bräuchtest mich nicht."
0,"Bitte, Beate, verstehe, Mamas Glück ist mir wichtig«, sprudelte Amelie in Höchstgeschwindigkeit hervor."
0,Beate lachte.
0,"»Amelie, nun mal ganz ruhig!"
0,Ich verstehe dich.
0,"Ich bin gerade dabei, auch etwas Schicksal zu spielen."
0,Kannst du kommen und mir dabei helfen?
0,Ich habe diesen Mark Steiner kennengelernt.
0,"Er ist bei mir in der Praxis aufgetaucht, weil er weiß, dass du hier jobbst."
0,Er hat ein Geschenk für deine Mama und will es dir mitgeben.
0,Sage ihr aber bitte noch nichts!
0,"Kannst du so tun, als würde ich dich jetzt doch brauchen?«"
0,»Ich bin gleich bei dir.
0,Grüße mir Mark!
0,Ich beeile mich.«
0,Amelie legte auf und ging zurück auf die Terrasse.
0,»Das war Beate.
0,"Sie fragt, ob ich doch kommen kann."
0,Dann will ich mal gleich los.«
0,»Warum bist du zum Telefonieren auf das Geröllfeld gegangen?«
0,»Es sind zu viele Leute auf der Terrasse.
0,"Pfüat di, Mama, bis später!"
0,Ich werde zum Mittag wieder hier sein.
0,Beate muss weg und ich soll nur in der Praxis Telefondienst machen.
0,"Sie sagte, es dauere nicht lange."
0,"Sie wartet auf Laborergebnisse, die durchgefaxt werden sollen.«"
0,Amelie drückte ihrer Mutter einen Kuss auf die Wange und rannte los.
0,"Auf der Oberländer Alm lieh sie sich das alte Fahrrad aus, mit dem Sebastian und Franziska oft auf dem Parkplatz herumfuhren."
0,Damit radelte sie hinunter nach Waldkogel.
1,Vor Beates Praxis sprang sie vom Fahrrad und warf es gegen die Hauswand.
0,Sie stürmte ins Haus.
0,"»Beate, wo bist du?«, schrie sie."
0,»Hier in der Küche!«
0,Amelie rannte in die Küche und ließ sich auf einen Stuhl fallen.
0,Sie war außer Atem.
0,"»Hallo, Mark!"
0,"Es ist nicht so gelaufen mit Mama …, wie?"
0,Sie war heute Morgen ziemlich ernst und verschlossen.
0,Das bin ich nicht von ihr gewohnt.«
0,Mark seufzte.
0,Er sah nicht sehr glücklich aus.
0,Er schob ihr die kleine rote Schachtel hin.
0,»Das wollte ich Caroline letzte Nacht geben.
0,"Damit sie weiß, ich meine es wirklich ernst."
0,Aber ich hatte keine Gelegenheit dazu.«
0,Amelie klappte den Deckel auf.
0,"»Wow, das ist ein Verlobungsring, richtig?"
0,Und so ein großer Klunker!
0,Du hast es dir wirklich was kosten lassen.«
0,»Ja!
0,Kannst du ihr ihn bitte von mir geben?
0,"Sie soll ihn behalten, auch wenn sie nicht bereit ist, mich zu lieben."
0,"Er soll sie immer daran erinnern, dass sie meine große Liebe ist und ich auf sie warte.«"
0,"»Himmel, ist das romantisch!«, seufzte Amelie."
0,Sie strahlte Mark an.
0,»Ich werde ein gutes Wort für dich einlegen.
0,Zumindest sollte sie dich näher kennenlernen.
0,Mama denkt sehr sachlich und tiefgründig.
0,Sie muss immer alles genau wissen.
0,"Dann wägt sie sehr sorgfältig ab, bevor sie sich entscheidet."
0,So ist sie nun einmal.«
0,Amelie seufzte.
0,"»Ich kann nichts versprechen, Mark."
0,"Aber ich werde alles tun, damit du eine Chance bekommst.«"
0,Beate stand auf.
0,»Ich muss zum Reiterhof und die jungen Fohlen impfen.
0,Auf mich müsst ihr verzichten.
0,Macht doch einen Spaziergang!
0,"Mark, du könntest Amelie bei der Gelegenheit etwas mehr von dir erzählen.«"
0,"»Ich wollte doch mit zum Reiterhof«, sagte Amelie."
0,»Du kannst das nächste Mal mitkommen.«
0,"»Geh ruhig, Amelie!«, sagte Mark."
0,"»Ich komme auch mit und warte, bis die Fohlen geimpft sind.«"
0,So fuhren sie gemeinsam zum Reiterhof.
1,Zwei Stunden später schlenderten Mark und Amelie zwischen den Koppeln hindurch.
0,"»Dir gefallen Pferde?«, fragte Mark."
0,»Deine Augen leuchten.«
0,»Eines Tages werde ich ein eigenes Pferd haben.
0,"Zuerst mache ich mein Abitur, dann studiere ich Tiermedizin, anschließend eröffne ich eine Tierarztpraxis und kaufe mir ein Pferd."
0,"Am besten mehrere, denn Pferde sind Herdentiere.«"
0,»Das stimmt.
0,Sie entwickeln sich besser in der Gruppe.
0,Die Haltung ist artgerechter.«
0,»Du kennst dich mit Pferden aus?«
0,"»Nur indirekt, mein Bruder war der Pferdeexperte.«"
0,»War?
0,"Übrigens, du hast noch nichts von deiner Familie erzählt."
0,Ist dein Bruder älter oder jünger?
0,Ich bin ein Einzelkind.
0,"Es wäre toll gewesen, Geschwister zu haben.«"
0,Sie setzten sich unter einen Baum am Rande einer Weide.
0,"»Ich sagte ›war‹, weil er nicht mehr lebt."
0,Max war mein Zwillingsbruder.
0,Er wollte mit Gewalt ein Pferd zähmen.
0,Es warf ihn ab.
0,Er wurde schwerverletzt ins Krankenhaus eingeliefert.
0,Er hat es nicht überlebt.«
0,Amelie schrie auf.
0,Sie schlug die Hände vor das Gesicht.
0,Mark erschrak.
0,"»Entschuldige, Amelie!«, sagte er."
0,"»Tut mir leid, wenn ich dich damit erschreckt habe.«"
0,"Es dauerte etwas, bis Amelies Herzklopfen nachgelassen hatten."
0,"Ohne ihn anzusehen, fragte sie ihn weiter über seinen Zwillingsbruder aus."
0,Er holte seine Brieftasche heraus und zeigte ihr ein Foto.
0,"Darauf standen er und Max am Gatter einer Weide, auf der Pferde zu sehen waren."
0,Amelie nahm das Bild in die Hand.
0,»War Max genauso wie du?
0,Zwillinge sollen sich in allem sehr ähnlich sein.«
0,"»Nein, Max war nicht wie ich."
0,Wir waren zweieiige Zwillinge.
0,"Wir ähnelten uns zwar im Aussehen, hatten aber einen sehr unterschiedlichen Charakter und unterschiedliche Begabungen."
0,Ich war mehr der ruhige Typ.
0,Ich las gern und spielte Klavier.
0,Max war sehr lebhaft.
0,Er war stets unterwegs und hatte einen großen Freundes- und Bekanntenkreis.
0,Er war ein unruhiger Typ.
0,Max blieb selten an einer Sache lange dran.
0,Immer musste etwas Neues kommen.
0,Er hetzte durch das Leben.
0,Nach dem Abitur reiste er durch die ganze Welt.
0,"Als er nach Jahren wieder zurückkam, hatte er viel erlebt und viel Geld verdient als Rodeoreiter in Übersee."
0,"Er kaufte sich bei einem entfernten Verwandten meines Vaters ein, der Pferde züchtete."
0,"Onkel Emil und Tante Ida waren kinderlos und sehr glücklich, dass Max zu ihnen kam."
0,"Das ging drei Jahre gut, dann geschah der Unfall.«"
0,Mark seufzte.
0,»Max und ich haben uns nicht immer gut verstanden.
0,Dazu waren wir zu unterschiedlich.
0,Trotzdem vermisse ich ihn sehr.
0,Vielleicht wäre er mit dem Alter ruhiger und sesshafter geworden?«
0,Nach und nach entlockte ihm Amelie noch viele Einzelheiten über Max Steiner.
0,"»Du hast einen ganz roten Kopf, Amelie«, sagte Mark."
0,"»Das ist eine aufregende Geschichte, sehr aufregend."
0,Sie ging mir sehr nahe.
0,Das ist ein rührendes Bild von euch.
0,"Obwohl ihr charakterlich so verschieden gewesen seid und ihr auch wohl öfter Streit hattet, seht ihr hier ganz harmonisch aus.«"
0,»Es wurde an unserem Geburtstag aufgenommen.
0,Das war immer ein sehr harmonischer Tag.
0,Welches Jahr war das?«
0,Das Datum stand auf der Rückseite.
0,»Darf ich mir das Bild ausleihen?
0,Du bekommst es wieder zurück.
0,Das verspreche ich dir.
0,Ehrenwort!«
0,»Willst du es Caroline zeigen?«
0,"»Mm, das will ich!«"
0,"»Deine Mutter sagte, ich würde sie an jemanden erinnern«, sagte Mark."
0,»Meinst du …« »Psst!
0,Nicht aussprechen!
0,Es ist nur ein Versuch.«
0,"»Du bist ein kluges Mädchen, Amelie.«"
0,"»Klar bin ich das, ich bin seit Jahren Klassenbeste«, lachte sie."
0,"Dann bat sie Mark, sie auf die Oberländer Alm zu fahren."
0,Minuten später parkte Mark auf der Wiese hinter der Oberländer Alm.
0,»Wie geht es jetzt weiter?
0,"Rufst du mich an, wenn du Caroline den Ring gegeben hast?«"
0,Amelie schüttelte den Kopf.
0,»Das ist viel zu unromantisch.
0,Sie muss sich noch einmal mit dir treffen.
0,Ich werde sie schon dazu bringen.
0,"Wenn mir etwas wirklich wichtig ist, dann gibt Mama irgendwann nach.«"
0,"»Irgendwann, das heißt, es kann dauern.«"
0,Amelie zuckte mit den Schultern.
0,»Ich werde Druck machen.
0,Mama wird sich bald mit dir treffen.
0,Wo willst du dich mit ihr treffen?«
0,"»Vielleicht beim ›Erkerchen‹, das ist nicht weit von der Berghütte entfernt.«"
0,"»Das ist eine sehr gute Idee, Mark."
0,Außerdem ist das ›Erkerchen‹ der Platz aller Verliebten in Waldkogel.
0,Das hat mir Alois erzählt.
0,Dort würden die Herzen der Liebenden einander zufliegen.
0,Es sei ein magischer Ort der Liebe.«
0,Mark lachte laut.
0,»Ich will dir deine romantischen Träume nicht zerstören.
0,"Aber heute Nacht war es keinesfalls so, dass deine Mutter mir ihr Herz öffnete.«"
0,"»Sie wird schon, wenn sie dich besser kennt, Mark."
0,"Sie wird hinkommen und wenn ich sie hintragen muss«, lachte Amelie."
0,"»Du bist sehr zielstrebig, Amelie.«"
0,"»Ich will nur, dass Mama glücklich ist."
0,Sie ist immer allein und schottet sich ab.
0,Ich werde in ein paar Jahren studieren.
0,Dann ist sie noch nicht einmal vierzig und ganz allein.«
0,Amelie griff in ihre Jackentasche und holte die kleine rote Schachtel heraus.
0,Sie nahm Marks Hand und legte die Schachtel in seine offene Handfläche.
0,Sie schloss seine Finger darüber und hielt seine Hand einen Augenblick in ihren beiden Händen fest.
0,Sie sahen sich an.
0,Mark zog seine Hand zurück und steckte den Ring ein.
0,Er gab Amelie seine Handy­nummer.
0,Dann stieg sie aus und eilte davon.
1,Mark wendete und fuhr zurück ins Tal.
0,Er fuhr zum Waldschlösschen.
0,Thomas von Teufen-Thurmann war mit seiner Familie von der kurzen Urlaubsreise zurück.
0,"Er freute sich sehr, Mark zu sehen."
0,Bald saßen die Freunde im Park unter den Bäumen am Bergsee bei einem Bier und redeten.
1,* Amelie lief von der Oberländer Alm hinauf auf die Berghütte.
0,"Als sie die Terrasse erreichte, ließ sie sich auf den nächsten freien Stuhl fallen."
0,Sie presste ihre Hände in die Seite und keuchte.
0,Sie hatte Seitenstechen.
0,"»Mei, bist du überhitzt, Amelie!«, sagt Toni."
0,Er eilte in die Küche und holte ein großes Glas frisches Quellwasser.
0,Sie trank es in einem Zug aus und wischte sich mit dem Handrücken über die Lippen.
0,"»Danke, das tat gut!«"
0,Sie schaute sich um.
0,"»Toni, ist Mama drin bei Anna in der Küche?"
0,Kannst du sie bitte zu mir schicken?«
0,»Sie hat sich noch einmal schlafen gelegt.
0,"Es sei eine kurze Nacht gewesen für sie, sagte sie."
0,Wecke sie nicht!
0,"Sie sah nicht gut aus«, bemerkte Toni."
0,»Vielleicht ist es so auch besser.
0,Ich bin zu aufgeregt.«
0,»Und was gibt es so Aufregendes?«
0,"Amelie musterte Toni, als wäre er ihr unbekannt, und sie wollte prüfen, ob sie ihm vertrauen könnte."
0,"»Toni, es ist eine sehr persönliche Angelegenheit."
0,"Ich bin hin und her gerissen, ob ich es so oder so machen soll.«"
0,»Magst du reden?
0,Ich habe ein bisserl Zeit.
0,Die meisten Hüttengäste sind abgereist.
0,Die angemeldete Gruppe kommt erst am späten Nachmittag.
0,Anna ist mit Franziska und Sebastian und den Gastkindern nach Kirchwalden gefahren.
0,"Weißt du, die Meinung eines Außenstehenden hilft oft, Ordnung in eine Sache zu bringen."
0,"Wenn einen etwas bedrückt, dann schwirren einem immer mehr Gedanken durch den Kopf, und am Ende ist man weniger klug als am Anfang.«"
0,"»Richtig, Toni, genauso ist es!"
0,"Als ich das Foto sah, hatte ich sofort einen Plan."
0,Jetzt bin ich mir nicht mehr sicher.«
0,»Ich hole dir einen Saft.
0,Dann setzten wir uns zusammen hin und reden.
0,Du erzählst mir alles.
0,Vielleicht kann ich dir einen Rat geben.
0,"Weißt du, als Hüttenwirt höre ich mir oft Geschichten an, die noch niemandem zuvor anvertraut worden waren."
0,Die Stille der Berge lässt oft verdrängte Sachen im Herzen aufsteigen.
0,Ich bin ein guter Zuhörer.«
0,Amelie nickte.
0,Toni holte Saft.
0,Sie setzten sich an einen Tisch.
0,"»Toni, du weißt, dass meine Mutter nicht verheiratet ist und es nie war?«"
0,»Sie hat so etwas angedeutet.
0,Viele Frauen leben heute allein und haben Kinder.«
0,»Darum geht es nicht.
0,"Mama hat mir bisher verschwiegen, wer mein Vater ist."
0,Ich habe sie oft danach gefragt.
0,"Sie sagte jedes Mal, dass sie mir das später erklären werde, wenn ich älter bin."
0,Außerdem kämen wir doch ganz gut durch.
0,Sie bräuchte keinen Mann.
0,"Wenn ich wüsste, wer mein Vater ist, würde das auch nichts ändern."
0,Es sei besser so.«
0,Amelie trank einen Schluck Saft.
0,"»Aber der Zufall wollte es, dass ich bei meinen Großeltern auf dem Dachboden einen Koffer mit alten Sachen entdeckte."
0,"Darin fand ich einen Brief an meine Mutter, der war von ihrer Freundin, die damals als Aupairmädchen in Kanada arbeitete."
0,Edeltraud hieß sie.
0,"In dem Brief schrieb sie von einem Mann, in den meine Mutter wohl verliebt war."
0,Er hieß Max Steiner.
0,"Was sie schrieb, bezog sich auf einen Brief, den ihr Mama wohl vorher geschickt hatte."
0,Natürlich konnte ich nur Rückschlüsse ziehen.
0,"Ich hatte Herzklopfen, als ich das Datum sah."
0,Vier Monate später bin ich zur Welt gekommen.«
0,"»Du nimmst also an, dass dieser Max Steiner dein Vater ist?«"
0,"»Das habe ich gleich angenommen, als ich den Brief las.«"
0,»Hast du deine Mutter darauf angesprochen?«
0,"»Nein, das habe ich nicht."
0,"Ich hatte ihr doch versprochen, damit zu warten, bis sie es mir von sich aus sagt."
0,Aber der Brief ging mir nicht mehr aus den Kopf.«
0,»Das kann ich verstehen.
0,Und weiter?«
0,"»Toni, weißt du, dass Martin einen Notfallpatienten hatte, der Mark Steiner heißt?«"
0,»Das weiß ich.
0,"Und ich weiß auch, dass Caroline ihm aus dem Weg geht.«"
0,"»Klar, weil dieser Mark sie vom Aussehen her und vom Namen her an diesen Max erinnert."
0,"Sie hat zugegeben, dass Mark sie an jemanden erinnert, an den sie nicht erinnert werden will."
0,Es kann nur Max sein.
0,"Er ist es bestimmt, Toni.«"
0,"»Was macht dich so sicher?«, fragte Toni."
0,»Weil ich mit Mark geredet habe.
0,"Er hat Mama gesagt, dass er sie liebt."
0,"Aber Mama liebt ihn entweder wirklich nicht oder sie will ihn nicht lieben, weil sie ahnt, dass Mark einen Bruder hatte, der Max hieß."
0,Vielleicht sind sie sich damals sogar kurz begegnet.
0,"Jedenfalls denke ich, dass dieser Max, der Max ist, von dem in dem Brief die Rede war und dass er mein Vater ist.«"
0,Amelie holte das Foto aus der Handtasche und zeigte es Toni.
0,»Ich muss das Bild wieder zurückgeben.
0,"Ich dachte, ich zeige es Mama und frage sie, ob sie einen Max Steiner gekannt hatte, diesen Max, der hier auf dem Foto ist."
0,Verstehst du?«
0,Amelie seufzte.
0,»Aber ich bin unsicher.
0,Was soll ich nur machen?«
0,»Was ist mit Max?«
0,»Er ist vor einigen Jahren an den Folgen eines tragischen Reitunfalls gestorben.
0,"Wenn er mein Vater ist, kann ich ihn nie kennenlernen.«"
0,"»Amelie, ob er dein Vater war, kann dir nur deine Mutter sagen.«"
0,"»Ich weiß, Toni."
0,Es ist so schrecklich.
0,Ich möchte Mama nicht verletzen.
0,"Aber sie verschließt sich gegen die Gefühle, die Mark für sie empfindet.«"
0,"»Amelie, es kann sein, dass nur einer verliebt ist.«"
0,»Ich weiß.
0,"Es wäre schade, wenn Mama Mark nur ablehnt, weil er der Bruder von Max ist.«"
0,Toni rieb sich das Kinn.
0,"Er verstand, dass Amelie einen Weg suchte, um endlich zu erfahren, wer ihr Vater ist."
0,"Und wenn es dieser Max war, der Bruder von Mark, dann sollte Caroline mit offenen Karten spielen."
0,"»Amelie, die Berge wühlen die Menschen in ihrem Innern gewaltig auf."
0,Man sieht dann oft nicht den Wald vor lauter Bäumen.
0,Nimm den einfachen Weg!
0,"Geh zu deiner Mutter und bitte sie, dir endlich zu sagen, wer dein Vater ist."
0,"Du sagst, du bist alt genug und willst es wissen.«"
0,"»Wenn sie es mir nicht sagen will, was dann?«"
0,"»Wenn sie dir dann immer noch deinen Vater verschweigen will, dann zeig ihr das Foto."
0,"Gib ihr auf jeden Fall die Chance, sich dir anzuvertrauen.«"
0,Amelie dachte einen Augenblick nach.
0,"»Ja, so mache ich es."
0,Ich habe Mama lieb.
0,Ich will sie nicht verletzen.
0,"Doch ich denke, es könnte auch befreiend für sie sein, mit mir darüber zu sprechen.«"
0,Amelie erzählte ausführlich von Mark und wie er Caroline gesucht hatte.
0,"»Der ist wirklich verliebt in deine Mutter«, sagte Toni."
0,»Sie sollte offen mit ihm sprechen.
0,Das wäre fair.
0,Zwingen kannst du deine Mutter dazu nicht.
0,Aber du kannst sie ermutigen.
0,Doch sei dabei behutsam.
0,"Wenn dein Vater Max ist, Marks Zwillingsbruder, dann ist das schwer für sie.«"
0,Toni überlegte.
0,»Jetzt lässt du deine Mutter ausschlafen.
0,"Heute Abend gebe ich euch Proviant, und ihr zieht euch an einen stillen Ort zurück."
0,"Geht nicht zum ›Erkerchen‹, dort hat Caroline heute Nacht Mark getroffen, geht in eine Schutzhütte am Pilgerpfad!"
0,"Dort seid ihr ungestört, und ihr könnt reden."
0,Ich gebe euch alles für eine Übernachtung mit.
0,"Du wünscht dir einfach, einmal in einer Schutzhütte in den Bergen zu übernachten.«"
0,"»Gute Idee, Toni!«, strahlte Amelie."
1,* Die Sonne stand schon tief über den Bergen im Westen.
0,Der untere Rand berührte die Bergspitzen.
1,Amelie und Caroline saßen auf der Terrasse.
0,"»Mama, es ist soweit!«"
0,"»Ich bin gespannt, welche Überraschung du für mich hast«, lachte Caroline."
0,»Den ganzen Nachmittag machst du schon ein geheimnisvolles Gesicht und sehr seltsame Andeutungen.
0,So kenne ich dich gar nicht.«
0,In diesem Augenblick kam Toni dazu.
0,Er stellte zwei große Rucksäcke hin.
0,"»So, Amelie, da ist alles drin, was ihr für ein paar ungestörte Tage in den Bergen braucht."
0,Ich wünsche euch eine schöne Zeit!«
0,"»Amelie, was hat das zu bedeuten?«, fragte Caroline erstaunt."
0,"»Mama, das bedeutet, dass wir beide jetzt losgehen."
0,Wir übernachten in einer Schutzhütte am Pilgerpfad.
0,"Ich habe das Bedürfnis, mit dir allein zu sein."
0,"Daheim bist du in der Klinik, und ich bin in der Ganztagesschule."
0,Abends bleibt uns wenig Zeit.
0,Hier auf der Berghütte sind mir auch zu viele Leute.
0,"Gerade diese Gruppe, die vorhin kam, ist sehr laut."
0,"Hörst du nicht, was für einen Lärm sie machen?"
0,Da kann man sich nicht in Ruhe unterhalten.«
0,Toni schmunzelte.
0,"»Es kommt schon vor, dass ein Kegelclub seinen Jahresausflug auf die Berghütte macht."
0,Dann wird es immer laut.«
0,"»Gut, wenn es dein Wunsch ist, dann gehen wir, Amelie.«"
0,Amelie strahlte und gab ihrer Mutter einen Kuss.
0,Die beiden schulterten die Rucksäcke und gingen los.
1,"Toni, Anna und der alte Alois sahen ihnen nach, wie sie über das Geröllfeld hinaufgingen und in den kleinen Pfad abbogen, der am ›Erkerchen‹ vorbei zum ›Pilgerpfad‹ führte."
0,Toni hatte ihnen von seinem Gespräch mit Amelie erzählt.
0,"»Mögen die Engel vom ›Engelssteig‹ sie begleiten!«, sagte der alte Alois."
0,"Sie blickten alle hinauf zum Gipfel des ›Engelssteigs‹, dessen Gipfelkreuz in der Abendsonne golden leuchtete."
1,"Nach einer gemütlichen Wanderung erreichten Amelie und Caroline eine etwas abseits vom ›Pilgerpfad‹ gelegene Schutzhütte, die Toni empfohlen hatte."
0,"»Dort werdet ihr ungestört sein«, hatte er gesagt."
0,»Diese Schutzhütte kennen nur die Einheimischen.
0,Eine wunderbare Aussicht habt ihr von dort.«
0,Amelie und Caroline packten die Rucksäcke aus.
0,Sie feuerten den Ofen an und holten Wasser aus einer nah gelegenen Quelle.
0,Amelie bereitete Tee.
0,Bald saßen Mutter und Tochter auf der Bank neben der Tür und tranken Tee.
0,"»Es ist wirklich schön hier, Amelie."
0,Das war eine gute Idee von dir.«
0,"»Ich dachte mir, dass es dir gefällt, Mama."
0,"Aber der eigentliche Grund dafür war, dass ich mit dir allein sein wollte."
0,Ich will nämlich etwas mit dir bereden.«
0,"»Also, wenn es um deinen Berufswunsch geht, dann hast du meine Unterstützung."
0,Du kamst jeden Abend so glücklich aus der Tierarztpraxis.
0,Deine Augen haben gestrahlt.
0,Du hast mich an mich selbst erinnert.
0,Damals mussten wir ein Schulpraktikum machen.
0,"Ich entschied mich für das Krankenhaus, weil deine Großmutter Krankenschwester war."
0,Doch bald stand mein Entschluss fest.
0,"Ich wollte Ärztin werden, um noch besser helfen zu können.«"
0,"»Ich weiß, Mama, du hast es mir oft erzählt.«"
0,Caroline lachte.
0,"»Ich wiederhole mich, das weiß ich."
0,Aber dir wird es später nicht anders gehen.
0,Das ist normal.«
0,"»Mama, mich stört es nicht, wenn du dich wiederholst."
0,"Du hast die große Gabe, wunderschön erzählen zu können."
0,"Dabei entsteht ein Film im Kopf, bei jedem, der dir zuhört."
0,"Du kannst eine Sache so großartig beschreiben, dass es einem wirklich packt.«"
0,Caroline kannte Amelie.
0,Sie schmunzelte über ihre Tochter.
0,"Immer wenn Amelie Widerstände aufweichen und Verbote lockern wollte, überschüttete sie ihre Mutter mit Schmeicheleien."
0,"»Amelie, ich kenne dich."
0,Du hast doch etwas auf dem Herzen.
0,Willst du es mir nicht endlich sagen?
0,"Du hast einen ziemlichen Aufwand betrieben, um mit mir allein zu sein."
0,Das machst du doch nicht ohne Grund.«
0,"»Mama, du bist mal wieder sehr direkt."
0,Aber du kannst auch ziemlich ausweichend sein.
0,Ich kenne dich gut.
