0,"„Wir können sie net finden und befürchten, dass sie gestohlen wurde.“"
0,„Gestohlen?
0,Aber wer sollte denn …“ Tobias stockte.
0,„Moment mal!
0,"Ihr glaubt doch net etwa, dass ich sie fortgeholt habe?"
0,"Himmel, Hanni, das kann net dein Ernst sein.“"
0,Sie schüttelte den Kopf.
0,"„Nein, das glaube ich net.“"
0,„Ich schon.“
0,Ihr Mann fasste den Nachbarn in den Blick.
0,„Ich hab dich gestern Abend um den Hof streichen sehen.“
0,„Gestern Abend?
0,Da war ich spazieren.“
0,"„Womöglich hast du auch die Lage inspiziert und dir überlegt, wie du Samira ungesehen fortholen kannst.“"
0,„Das hab ich bestimmt net getan.
0,Warum sollte ich auch?
0,Ich mache mir nichts aus Hunden.“
0,„Samira ist ein sehr wertvolles Tier.“
0,"„Mag sein, aber ich bin net auf einen Raub angewiesen."
0,Mein Hof steht ausgesprochen gut da und versorgt mich.
0,"Kannst du das von dir auch sagen, Korbinian?“"
0,Tobias zog vielsagend die Brauen hoch.
0,"„Mir ist zu Ohren gekommen, dass dir ein Batzen Geld durchaus gelegen kommen würde."
0,"Immerhin hast du hochfliegende Pläne, oder etwa net?“"
0,„Ich soll Samira gestohlen haben?“
0,Korbinian sah den Nachbarn verblüfft an.
0,"„Nun ja, du hättest ein Motiv und die Gelegenheit gehabt.“"
0,„Herrschaftszeiten!
0,Das ist ausgemachter Unsinn.“
0,„Für mich passt das ziemlich gut zusammen.
0,"Oder, Hanni?“"
0,Hanni blickte zwischen den beiden Männern hin und her.
0,In ihrem Kopf drehte sich alles.
0,Tobias ein Dieb?
0,Oder ihr Mann?
0,Beides undenkbar!
0,"Und doch war Samira verschwunden, und es gab nicht viele Menschen, die dafür verantwortlich sein konnten."
0,"Hanni wusste nicht mehr, was sie denken sollte."
0,"„Ich werde in die Berge gehen und nach Samira suchen“, murmelte sie."
0,"„Ich begleite dich“, boten die beiden Männer wie aus einem Munde an und tauschten einen grimmigen Blick."
0,„Nein.
0,"Ich werde allein gehen“, entschied sie."
0,"„Wenn ihr mir helfen wollt, sucht ihr woanders."
0,"Je weiter wir das Suchgebiet ausdehnen, umso größer ist unsere Chance, Samira zu finden.“"
1,Sie teilten sich auf.
0,Dann machte sich Hanni auf den Weg.
0,Sie lief die Dorfstraße hinunter zum Wiesenrand und hielt dabei die Augen und Ohren nach Samira offen.
0,Kein Lebenszeichen von der Hündin.
0,"Hanni beschloss, weiter bergab zu gehen."
0,Vielleicht war Samira nach Mayrhofen gelaufen?
0,"Das war der einzige Weg, um nach Schwaz und in das Krankenhaus zu gelangen, in dem Samiras Besitzerin behandelt wurde."
0,Womöglich hatte die Hündin das gespürt und sich auf den Weg zu ihr gemacht?
0,Kurz entschlossen eilte die Neunundzwanzigjährige den gewundenen Weg zwischen den Wiesen hindurch talwärts.
0,Über ihr trieben wenige Wolken über den frühlingshaft blauen Himmel.
0,Die Sonne schien angenehm warm.
0,"Und bunte Schmetterlinge gaukelten über das Gras, als würde der Herrgott selbst sie als fröhliche bunte Farbtupfer verteilen."
0,"Was mache ich bloß, wenn wir die Hündin net wiederfinden?"
0,Hanni blieb stehen und atmete keuchend ein.
0,Die Sorgen schnürten ihr die Brust zusammen.
0,Sie atmete schnell und stoßweise.
0,Trotzdem wurde ihr die Luft knapp.
0,"Hanni beugte sich vor und sog den Sauerstoff in ihre Lunge ein, aber diese schien sich trotzdem nicht genügend zu füllen."
0,Eine unangenehme Enge breitete sich in ihrer Brust aus.
0,Um sie herum drehte sich mit einem Mal alles.
0,Das Summen der Insekten schien aus weiter Ferne zu kommen.
0,Sie konnte nicht atmen.
0,Nicht atmen!
0,"Hanni schwankte und suchte nach einem Halt, aber ihre Hand fuhr durch die Luft, ohne etwas zu greifen."
0,"Weiße Schlieren waberten vor ihren Augen, und eine jähe Furcht überfiel sie."
0,Was geschah hier nur mit ihr?
0,Starb sie gerade?
1,*** Benommen blinzelte Hanni an die weiße Zimmerdecke.
0,"Verschwommen erinnerte sie sich, dass ein Traktor neben ihr gestoppt und ein weißhaariger Bauer sich über sie gebeugt und nach ihrem Befinden gefragt hatte."
0,"Sie war nicht imstande gewesen, ihm zu antworten."
0,Da hatte er sie hochgehoben und ins Dorf gefahren.
0,Vorsichtig richtete sich Hanni nun auf.
0,Sie war in der Praxis des Bergdoktors.
0,Er saß in seinem weißen Kittel auf einem Hocker vor ihr und sah sie prüfend an.
0,"„Geht es wieder?“, fragte er ernst."
0,„Ja.“
0,Hannis Stimme klang fremd und kratzig.
0,"„Erinnerst du dich noch, was passiert ist?“"
0,„Ich war auf dem Weg nach Mayrhofen und konnte plötzlich nimmer weiter.
0,"Es war, als müsste ich sterben."
0,Ich hab keine Luft mehr bekommen und konnte nimmer denken.“
0,„Du hattest eine Panikattacke.“
0,„Eine Panikattacke war das?“
0,„Der Anselm hat dich gefunden und zu mir gebracht.
0,Ich hab dir eine Spritze zur Beruhigung gegeben.
0,"Es kann sein, dass sie dich ein bisserl müde macht, aber sie sollte helfen.“"
0,„Das hat sie schon.
0,Ich fühle mich besser.“
0,Hanni strich sich über die Stirn.
0,„Hattest du schon früher solche Attacken?“
0,"„Ja, aber so schlimm wie heute war es noch nie."
0,"Ich dachte wirklich, mein letztes Stündlein hätte geschlagen.“"
0,„Und hattest du in letzter Zeit noch andere Beschwerden?“
0,"Hanni nickte, und dann brach alles aus ihr heraus."
0,"Ihre Schlaflosigkeit, ihre ungewöhnliche Reizbarkeit, die Schweißausbrüche und die Zweifel an sich selbst und ihrer Ehe, die Migräneattacken und das Gefühl völliger innerer Leere."
0,"Wie eine Quelle, die nicht aufzuhalten war, sobald sie erst einen Weg ans Licht gefunden hatte, sprudelten die Sorgen aus ihr heraus."
0,Dr. Burger ließ sie reden und hörte aufmerksam zu.
0,"Hanni vertraute ihm an, dass sie bei ihrer Hausärztin und einem Psychiater gewesen sei und dass die Antidepressiva ihr aber kein bisschen halfen."
0,"„Ich fühle mich“, schloss sie erschöpft, „als wäre mein ganzes Leben auf den Kopf gestellt.“"
0,"„Dann sollten wir schauen, warum das so ist und was wir dagegen tun können.“"
0,"„Glauben Sie wirklich, dass es dagegen ein Mittel gibt?“"
0,„Davon bin ich sogar fest überzeugt.
0,"Ich hab einen Verdacht, dem ich nachgehen möchte."
0,Dazu muss ich dich untersuchen und einige Bluttests vornehmen.
0,Bist du damit einverstanden?“
0,„Natürlich.“
0,"„Gut, dann sollten wir gleich damit beginnen.“"
0,"Dr. Burger sprach so ruhig und zuversichtlich, dass sich Hanni etwas besser fühlte."
0,"Bei ihm war sie in guten Händen, das spürte sie."
0,Und so überließ sie sich seinen Untersuchungen und Tests.
0,Der Bergdoktor ging gründlich vor.
0,"Er machte einen Ultraschall von ihrem Bauch, nahm ihr Blut ab, hörte Herz und Lunge ab und fertigte ein EKG an."
0,Er fragte sie auch nach Schilddrüsenbeschwerden und Vorerkrankungen.
0,Beides konnte sie verneinen.
0,"Hanni musste eine Weile warten, bis die Ergebnisse aus dem Labor vorlagen."
0,"Schwester Bärbel versorgte sie inzwischen mit einem Glas Wasser, Lektüre und aufmunternden Worten."
1,Schließlich wurde Hanni wieder in das Sprechzimmer gerufen.
0,Nervös nahm sie auf dem Stuhl Platz.
0,Dr. Burger faltete die Hände vor sich auf der Schreibtischplatte.
0,"„Also, Hanni, mein Verdacht hat sich bestätigt."
0,Du bist in den Wechseljahren.“
0,„Was sagen Sie da?“
0,Ungläubig sah sie den Arzt an.
0,„Aber das ist völlig unmöglich.“
0,„Dein Blutbild ist eindeutig.
0,Die Hormonspiegel von Östrogen und Progesteron sind deutlich zu niedrig.
0,Zugleich ist der Wert des FSH erhöht.
0,Beides zeigt die Wechseljahre an.“
0,„Aber das kann net stimmen.
0,Ich bin erst neunundzwanzig.
0,Die Wechseljahre betreffen doch wesentlich ältere Frauen.“
0,„Net immer.
0,Statistisch gesehen setzen bei einer von zehn Frauen die Wechseljahre vorzeitig ein.
0,Mit Mitte dreißig oder sogar noch früher.“
0,„Wechseljahre?“
0,Hanni war wie erschlagen.
0,Sekundenlang brachte sie kein Wort hervor.
0,„Sind Sie sich ganz sicher?“
0,"„Absolut, ja."
0,Deine Hormone versiegen.
0,Und das verursacht all diese Veränderungen in deinem Körper.“
0,„Also ist es gar keine Depression?
0,"Ja, aber wie ist das möglich?"
0,Warum denn jetzt schon?
0,Mit noch net mal dreißig?“
0,"„Wir werden das noch abklären müssen, aber net immer kann die Ursache für eine vorzeitige Menopause geklärt werden."
0,"Manchmal ist es ein Tumorleiden oder eine Autoimmunerkrankung, bei manchen Frauen gibt es eine familiäre Veranlagung."
0,"Weißt du, wann das Klimakterium bei anderen Frauen in deiner Familie begonnen hat?“"
0,"„Nun …“ Hanni musste sich erst einmal sammeln, ehe sie halbwegs klar denken und antworten konnte."
0,"„Meine Oma hat mir erzählt, dass sie ihre Regel hätte bekommen sollen, an dem Tag, an dem mein Opa starb."
0,Ihre Periode blieb aus und kam net wieder.
0,Da war sie gerade vierzig Jahre alt.
0,Und meine Mutter hat nie über solche Dinge gesprochen.
0,Ich weiß es net.“
0,"„Wir werden weitere Untersuchungen machen, aber es ist möglich, dass wir den Grund für deinen frühen Wechsel net herausfinden.“"
0,„Lässt er sich denn rückgängig machen?“
0,Mit einem Mal traf Hanni die volle Wucht dieser Diagnose wie ein Schlag mit einem Dampfhammer.
0,„Korbinian und ich … wir möchten doch noch Kinder haben!“
0,Der Bergdoktor blickte sie ernst an.
0,„Leider lässt sich der Prozess net umkehren.
0,"Wenn sich die Eizellen im Körper erschöpfen, ist das endgültig.“"
0,„Was sagen Sie da?“
0,Entsetzt riss sie die Augen auf.
0,„Aber … nein!
0,"Bitte, es muss doch eine Möglichkeit geben."
0,Irgendeine!“
0,"„Ich werde dich zu einer Gynäkologin überweisen, Hanni."
0,"Dort sollen weitere Tests gemacht werden, um auszuschließen, dass eine Erkrankung der Auslöser für deinen Wechsel ist."
0,"Allerdings fürchte ich, dass sich dein Kinderwunsch net erfüllen wird."
0,"Es tut mir unendlich leid, Hanni.“"
0,"Benommen starrte sie ihn an und weigerte sich zu glauben, was sie gehört hatte."
0,"„Muss ich wirklich zu einer fremden Ärztin?“, fragte sie schließlich."
0,„Können Sie mich net behandeln?“
0,Flehend sah sie ihn an.
0,„Ich vertraue Ihnen.“
0,„Ich kann dich behandeln.
0,"Die weiteren Untersuchungen kann ich jedoch net vornehmen, dafür fehlt mir die Ausstattung.“"
0,„Und mit dieser Behandlung … kann ich damit net doch noch schwanger werden?“
0,"„Wir müssen abwarten, was die Tests zeigen, aber wenn der Wechsel schon fortgeschritten ist, nein, dann ist eine Schwangerschaft nimmer möglich."
0,"Es tut mir leid, Hanni, ich wünschte wirklich, ich könnte dir etwas anderes sagen.“"
0,Tränen verschleierten ihren Blick.
0,"Wie aus weiter Ferne hörte sie, dass Dr. Burger ihr eine Hormonersatztherapie nahelegte."
0,Nicht nur gegen ihre Symptome.
0,"Nein, die Hormone waren ein wichtiger Schutz vor einem Herzinfarkt und Knochenschwund."
0,"Bei einer Menopause in so jungen Jahren sollten die fehlenden Hormone ausgeglichen werden, um schweren Erkrankungen vorzubeugen."
0,"Der Arzt erklärte ihr die Risiken der Therapie, aber Hanni hörte nur mit einem Ohr hin."
0,Niemals ein Baby.
0,Niemals.
0,"Das war alles, was sie denken konnte."
0,"Wegen der Therapie würde sie regelmäßig zur Früherkennung gehen müssen, weil die Gefahr von Brustkrebs durch die Behandlung leicht anstieg."
0,Hanni sollte sich das Für und Wider gut überlegen und dann entscheiden.
0,"Der Rat des Bergdoktors war jedoch eindeutig: Er riet ihr zu der Therapie, einer Kombination aus Tabletten und Hormonpflastern."
0,"Hanni nahm die Überweisung entgegen, verabschiedete sich und wankte wie eine Schlafwandlerin aus der Praxis."
0,Wechseljahre.
0,Für Hanni bedeuteten sie das Ende ihrer Welt.
1,*** Eine weitere schlaflose Nacht.
0,Hanni saß auf der Gartenbank vor dem Haus ihrer Tante und sah zu dem glitzernden Sternenhimmel hinauf.
0,Die Lichter eines Flugzeuges blinkten in der Höhe wie ein Gruß aus der Ferne.
0,"Die Mondsichel verriet, dass es auf den Neumond zuging."
0,Eine Zeit der Veränderungen.
0,Wie bei mir.
0,Sie legte eine Hand auf ihren Bauch.
0,Er war ihr plötzlich fremd geworden.
0,"Ein Feind, den sie nicht mehr verstand."
0,Stundenlang hatte sie abends vor dem Computer ihrer Tante gesessen und nach Wechseljahren und Behandlungen gesucht.
0,"Wie sie es befürchtet hatte, ließen sich einige Symptome lindern, aber ein Zurück gab es nicht mehr."
0,Ihr Körper würde sich verändern.
0,"Die fehlenden Hormone machten sich auf vielerlei Weise bemerkbar: trockene Haut, brüchiges Haar, Stimmungsschwankungen … Die Liste ließ sich endlos fortsetzen."
0,Ihre Augen brannten.
0,"Sie hatte stundenlang geweint, aber den reißenden Schmerz in ihrem Inneren hatte es nicht gelindert."
0,Zu ihren Füßen hatten sich die beiden Hunde ihrer Tante zusammengerollt.
0,Sie hatten den Kopf auf jeweils einem ihrer Schuhe gebettet und dösten.
0,Zeno schnarchte.
0,"Neros Pfoten zuckten im Schlaf, als würde er im Traum hinter einem Eichkatzerl herjagen."
0,Träumten Hunde eigentlich?
0,Hanni strich sich über die Stirn.
0,Sie wusste es nicht und wusste überhaupt nichts mehr.
0,"Nur, dass ihr Leben nie wieder so sein würde wie früher."
0,Die Diagnose stellte alles auf den Kopf.
0,Von nun an teilte sich ihr Dasein in ein Vorher und ein Danach.
0,Samira war noch immer verschwunden.
0,Der Gendarm hatte versprochen weiterforschen.
0,Hanni hatte keine Hoffnung mehr.
0,Die Hündin war fort.
0,Dafür würde sie geradestehen müssen.
1,„Hanni?“
0,Schritte näherten sich.
0,Korbinian kam zu ihr und legte ihr eine Decke um die Schultern.
0,„Was machst du denn hier draußen?
0,Es ist eiskalt!“
0,Sie machte eine abwehrende Bewegung mit dem Kinn.
0,„Hanni …“ Ihr Mann setzte sich neben sie und berührte sie an der Schulter.
0,"„Wir müssen reden, meinst du net auch?“"
0,„Ich will aber net reden.“
0,„Aber das sollten wir.“
0,„Was würde das ändern?
0,Gar nix!“
0,"„Hanni, das ist doch net das Ende.“"
0,"„Doch, Korbinian, genau das ist es.“"
0,"Hanni hatte ihrem Mann bei ihrer Heimkehr erzählt, was der Bergdoktor herausgefunden hatte."
0,"Korbinian wollte sie in die Arme nehmen, aber sie war ihm ausgewichen, hatte sich ins Bett geflüchtet und nichts sehen oder hören wollen."
0,„Hast du es denn net verstanden?“
0,Sie funkelte ihn an.
0,„Mit unseren Zielen und Träumen ist es vorbei.“
0,„Warum glaubst du das?“
0,„Weil ich keine Kinder mehr bekommen kann.
0,"Sobald die letzte Eizelle produziert ist, wird das Werk geschlossen."
0,Aus und vorbei.
0,Verstehst du das net?“
0,„Dann finden wir eben eine andere Möglichkeit.“
0,„Welche denn?“
0,„Wir könnten ein Baby adoptieren.
0,Oder wir bleiben zu zweit.
0,"Wie auch immer wir uns entscheiden, wir werden zurechtkommen."
0,"Nur bitte, schließ mich nimmer aus, Hanni.“"
0,"„Du verstehst es wirklich net“, wisperte sie."
0,„Es ist vorbei.
0,Es gibt kein ‚wir‘ mehr.
0,"Du wolltest immer Kinder haben, das weiß ich."
0,"Undenkbar, dass du diesen Plan meinetwegen aufgibst.“"
0,„Lieber gebe ich diesen Plan auf als dich!“
0,"„Das sagst du jetzt, aber was ist in ein paar Jahren, wenn dir klar wird, dass es nie einen Buben mit deinen Augen und deiner Liebe zu den Bergen geben wird?"
0,"Nie ein Madel, das so schön singt wie deine Mutter?"
0,"Nein, Korbinian, früher oder später würdest du mich dafür hassen."
0,Oder todunglücklich werden.
0,Vielleicht beides.
0,Das würde ich net ertragen.
0,"Du solltest dir eine Frau suchen, die dir Kinder schenken kann.“"
0,„Was redest du da nur?“
0,"„Ich rede von Scheidung, Korbinian.“"
0,„Das kommt überhaupt net infrage.
0,"Ich liebe dich, Hanni."
0,Für mich gibt es keine andere als dich.
0,"Ich kann auf ein eigenes Kind verzichten, auf alles, wenn wir nur zusammen sind."
0,Wir sind doch eine Familie.
0,Und daran wird sich nie etwas ändern.“
0,"„Sag das net“, stöhnte sie."
0,"Sie wünschte sich verzweifelt, ihm zu glauben, aber sie wusste, wie viel er für sie aufgeben musste."
0,Wie konnte sie das von ihm verlangen?
0,"„Mein Liebling, du zitterst ja!“"
0,Korbinian schlang einen Arm um sie und blickte sie liebevoll an.
0,"„Ich weiß net, was die Zukunft für uns bereithalten wird."
0,Bestimmt wird es noch viele Veränderungen geben.
0,Die gehören nun mal zum Leben dazu.
0,Einer Sache kannst du dir jedoch gewiss sein: Ich liebe dich und werde immer zu dir stehen.“
0,"„Mei, Korbinian …“ Hanni barg den Kopf an seiner Schulter und überließ sich seiner tröstenden Nähe."
0,"Er strich über ihren Rücken und murmelte leise, beruhigende Worte."
0,Allmählich legte sich der Sturm aus Verzweiflung in ihrem Inneren und wich Resignation.
1,*** „Die Wechseljahre?“
0,Verblüfft zog Tante Franzi den Atem ein.
0,„Bist du sicher?“
0,„Ja.
0,Doktor Burger hat mich gründlich untersucht.
0,Ich stecke mitten im Wechsel.
0,"Er kann nur noch net sagen, warum."
0,Es könnte eine familiäre Veranlagung sein.“
0,„Weiß Korbinian es schon?“
0,"„Ja, und er ist unglaublich gefasst."
0,"Ich könnte abwechselnd weinen und schreien und mich verkriechen, aber er ist so ruhig."
0,Dabei bringt diese Veränderung unsere gesamte Lebensplanung durcheinander.
0,"Ich kann keine Kinder mehr bekommen, und das tut so weh, Tante Franzi!“"
0,Tränen rollten ihr über das Gesicht.
0,"„Ach, Liebes, das tut mir so leid.“"
0,Ihre Tante setzte sich in ihrem Krankenhausbett auf und zog sie in ihre Arme.
0,"„Nein, mir tut es leid“, sagte Hanni."
0,„Ich sollte dich net aufregen.
0,Ich hätte es net erzählen sollen.“
0,„Natürlich hättest du das.
0,Du kannst mir alles sagen.“
0,„Aber du hattest einen schweren Unfall und brauchst Ruhe.“
0,„Es geht mir schon besser.
0,Mach dir um mich keine Sorgen.“
0,Tante Franziska nickte ihr beruhigend zu.
0,"Sie trug einen roten Sportanzug, war jedoch noch immer mit einer Infusion verbunden."
0,"Sanft zog sie Hanni neben sich auf das Bett und fragte: „Wie fühlst du dich denn nun, Liebes?“"
0,„Das alles macht mir Angst.
0,Ich kenne mich selbst nimmer.
0,"Es ist, als wäre ich im Körper einer Fremden gefangen.“"
0,"„Du darfst net zulassen, dass dein Körper dein Feind wird."
0,Mach ihn lieber zu deinem Verbündeten.“
0,„Wie soll ich das denn anstellen?“
0,„Der wichtigste Schritt ist der aktive Umgang mit der Veränderung in deinem Leben.
0,Nimm sie an und mach etwas Gutes daraus.“
0,„Etwas Gutes?
0,"Ich sehe momentan nichts Gutes an dem Umstand, nie ein Baby haben zu können“, murmelte Hanni bitter."
0,„Für mich ist das eine einzige Katastrophe!“
0,"„Ich weiß, es ist hart, und ich wünschte, es gäbe ein Mittel, um den Prozess umzukehren, aber das gibt es leider net."
0,"Du musst loslassen und nach vorn schauen, denn es gibt kein Zurück.“"
0,„Ich kann das aber net.
0,Ich kann einfach net.“
0,"Hanni presste die Lippen so fest aufeinander, dass es wehtat."
0,„Wie hast du die Wechseljahre erlebt?“
0,„Bei mir kamen sie schleichend.
0,Ich hab es anfangs gar net bemerkt.
0,"Irgendwann ist mir aufgefallen, dass meine Periode nur noch sporadisch kam und kürzer wurde."
0,Bis sie schließlich ganz ausblieb.
0,Von unliebsamen Nebenwirkungen wurde ich aber net verschont.
0,Eine Zeit lang litt ich unter Panikattacken.
0,Sie traten aus heiterem Himmel auf und verschwanden wenige Monate nach meiner letzten Periode.“
0,„Die habe ich auch.“
0,Hanni schluckte.
0,"„Ich hab das Gefühl, mich von meinem ganzen bisherigen Leben verabschieden zu müssen.“"
0,"„Es wird anders, aber das bedeutet net, dass es schlechter wird."
0,"Eine Freundin von mir zum Beispiel erzählte mir, dass sie den besten Sex ihres Lebens hat, seitdem sie den Wechsel hinter sich hat."
0,Sie lebt bewusster und freier als früher.
0,"Keine Blutung mehr, kein monatliches Unwohlsein.“"
0,„Jedenfalls werde ich eine Menge Geld für Tampons sparen.“
0,Hanni lächelte matt.
0,„Siehst du.“
0,Ihre Tante strich ihr über die Wange.
0,"„Ich weiß, im Augenblick kommt es dir noch net so vor, aber du wirst damit zurechtkommen und daran wachsen.“"
0,„Das glaube ich net.
0,"Mei, Tante Franzi, ich weiß wirklich net, was ich machen soll.“"
0,"„Nutze die Chance, um dein Leben neu zu sortieren.“"
0,„Ich möchte mein Leben aber gar net neu sortieren.
0,"Ich möchte es zurück, wie es war!“"
0,Mit einem Mal überwältigte die Verzweiflung Hanni erneut.
0,Wie eine Woge Meerwasser spülte sie über sie hinweg und ließ ihre Tränen fließen.
0,"„Gibt es etwas Neues von Samira?“, wechselte ihre Tante das Thema."
0,„Leider net.
0,"Der Gendarm hält die Augen offen, ob sie irgendwo zum Verkauf angeboten wird, aber genauso gut kann es sein, dass der Dieb mit ihr schon über alle Berge ist.“"
0,„Das wäre freilich schlimm.
0,Iris hängt sehr an ihrem Hund.“
0,„Ich weiß.
0,"Es tut mir so leid, dass ich net besser auf sie aufgepasst habe.“"
0,„Schmarrn.
0,Du konntest nix dafür.
0,"Jemand hat sie gestohlen, davon bin ich fest überzeugt.“"
0,"„Oder sie ist weggelaufen, weil sie ihr Frauchen vermisst hat."
0,Ich werde nachher weiter nach ihr suchen und auch in den Nachbarweilern herumfragen.
0,Ein Windhund ist im Zillertal net so häufig.
0,Vielleicht hat sie doch jemand gesehen.“
0,„Das ist eine gute Idee.
0,"Ich drücke dir die Daumen, dass du sie findest."
0,"Sag mir Bescheid, sobald du etwas erfährst, ja?“"
0,"„Natürlich“, versicherte Hanni."
0,Ihre Tante war noch sehr matt und angegriffen.
0,Der Unfall und die Operation zehrten an ihr.
0,"Sie brauchte Ruhe, deshalb verabschiedete sich Hanni mit dem Versprechen, morgen wiederzukommen."
0,Sie schloss leise die Tür des Krankenzimmers hinter sich und schluckte trocken.
1,"Leicht fiel es ihr nicht, aber sie fragte sich zum Zimmer von Iris Rothecker durch."
0,"Sie musste der Freundin ihrer Tante berichten, dass es noch nichts Neues von ihrer Hündin gab."
0,"Als sie das Zimmer betrat, war nur ihre Bettnachbarin da."
0,Die Mittsiebzigerin blickte von ihrem Kreuzworträtsel auf.
0,„Iris?
0,"Tut mir leid, die ist schon wieder weg.“"
0,„Aber sie wurde gerade erst operiert.
0,Darf sie überhaupt schon wieder aufstehen?“
0,„Freilich.
0,"Eigentlich net so lange, aber ein paar Schritte auf dem Flur sind ihr erlaubt."
0,"Sie hat wohl Hummeln im Hintern, denn sie schleicht sich immer mal davon.“"
0,"„Wissen Sie, wo sie hingeht?“"
0,„Vielleicht raucht sie draußen eine.
0,Oder sie hat ein Gspusi mit einem der Ärzte.
0,Das weiß ich leider net.“
0,"„Haben Sie etwas dagegen, wenn ich hier auf sie warte?“"
0,„Ganz und gar net.
0,Über Gesellschaft freue ich mich immer.
0,Vielleicht können Sie mir bei meinem Rätsel helfen?
0,Wissen Sie eine seltene Hunderasse mit sechs Buchstaben?“
0,„Eine seltene Hunderasse?“
0,"Hanni dachte an die vermisste Hündin, und das Herz wurde ihr schwer."
0,In wessen Hände war Samira wohl gefallen?
0,Und was machte derjenige mit ihr?
0,Hoffentlich ging es ihr gut!
1,*** „Aufpassen!“
0,"Geistesgegenwärtig packte Ludwig Sirch den jungen Burschen am Kragen, der soeben konzentriert auf sein Handy starrend vom Fußweg auf die Straße treten wollte – bei roter Ampel und geradewegs vor den rollenden Verkehr!"
0,„Herrje!“
0,Der Bursche riss die Augen auf.
0,Er konnte noch keine zwanzig Jahre alt sein und hatte lockige braune Haare.
0,"„Das wäre beinahe schiefgegangen, was?“"
0,„In der Tat.
0,In Zukunft solltest du besser achtgeben!“
0,"„War gerade in mein Spiel vertieft, wissen Sie.“"
0,"„Net im Straßenverkehr, würde ich raten.“"
0,„Da haben Sie wohl recht.
0,Danke jedenfalls.“
0,Vor ihnen sprang die Ampel auf Grün.
0,"Die Passanten strebten über die Straße, auch der junge Bursche stapfte los."
0,"Ludwig Sirch blickte ihm nach und bemerkte, wie dieser wieder den Kopf über sein Mobiltelefon senkte."
0,"Wie von einer anderen Welt, dachte der Gendarm."
0,Heutzutage schien jeder so ein Handy an der Hand festgetackert zu haben.
0,"Er war froh, dass es diese Dinger noch net gegeben hatte, als er jung gewesen war."
0,Sie hatten damals unbeschwert draußen gespielt und mussten net auf so ein teures Gerät aufpassen.
0,Er würde nicht mit den jungen Leuten von heute tauschen wollen.
0,"Der Gendarm knöpfte seine Lederjacke auf, weil ihm die Sonne warm auf die Schultern brannte."
0,"Als er in St. Christoph auf sein Motorrad gestiegen war, hatte es genieselt."
0,Hier in Schwaz verhüllte keine einzige Wolke den blauen Himmel.
0,Sein Motorrad hatte er auf dem Parkplatz des Bezirkskrankenhauses abgestellt.
0,Vor dem Klinikgebäude blühte ein Meer aus leuchtend gelben Tulpen.
1,Ludwig Sirch fragte sich am Empfang nach dem Zimmer von Iris Rothecker durch.
0,"Es dauerte ihn, dass er ihre Hündin noch nicht gefunden hatte."
0,Er wollte sie um eine Fotografie ihres Lieblings bitten.
0,Damit konnte er einen Suchaufruf starten und in der Bevölkerung gezielt nach der Windhündin suchen lassen.
0,Vielleicht brachte ihn das weiter.
0,Er hoffte es sehr!
0,"Mit dem Fahrstuhl fuhr er in die dritte Etage und klopfte am Zimmer der Patientin an, die er besuchen wollte."
0,"Von drinnen kam ein leiser Hereinruf, aber als er eintrat, traf er nicht Iris Rothecker an, sondern ihre Bettnachbarin."
0,Er stellte sich vor und fragte nach Frau Rothecker.
0,"„Tut mir leid“, bedauerte die Seniorin im Bett."
0,„Sie ist schon wieder abwesend.“
0,"„Schon wieder?“, hakte er nach."
