1,"„Endlich, er kommt!“"
0,"Jetzt würde er sie auf Händen tragen, weil sie ein Kind von ihm bekam, und dann würde er sie als Mutter lieben und respektieren, und sie würden eine Familie sein."
0,Aber wo blieben da Leonie und Paul?
0,So wie es einst Leonie und Julien gegeben hatte?
1,"„Du musst dich vorsehen“, ermahnte Fürstin Paola ihre Tochter ein paar Tage später."
0,„Bist du sicher?“
0,„Ja.
0,Ich war bei Doktor Gebhardt.
0,Und warum sollte ich mich vorsehen?“
0,„Weil es dir ergehen könnte wie mir.
0,"Was glaubst du, wie gerne ich dem Fürsten den ersehnten Sohn geschenkt hätte!"
0,Aber ich habe das Kind verloren.
0,"Also, achte auf dich."
0,"Keine Eskapaden, schon gar nicht in den ersten drei Monaten der Schwangerschaft."
0,Soll ich zu dir kommen?“
0,„Aber nein!
0,Martha sorgt für mich.
0,"Sie stopft mich, als wäre ich eine Weihnachtsgans, und Paul überwacht jeden meiner Schritte."
0,Und dabei möchte ich so gern meinem neuen Beruf nachgehen.
0,"Ich … Weißt du, ich werde es auch tun."
0,"Was soll das denn für ein Kind werden, wenn man die Mutter sechs Monate vor der Geburt in Watte packt und im Haus einsperrt?"
0,Das arme Kleine kommt auf die Welt und schreit nach Freiheit.“
0,"„Wohl eher nach Bewegungsfreiheit“, korrigierte die Fürstin."
0,„Wollen wir Alessandra von der neuen Entwicklung erzählen?“
0,„Alessandra?“
0,Leonie zögerte.
0,"Sie erinnerte sich daran, dass Paul keine Verbindung zwischen ihnen beiden gewünscht hatte."
0,„Wie geht es Alessandra?“
0,„Sie ist seit drei Monaten auf Sablemer.
0,"Anschließend wollen die beiden zu uns kommen, und ich gestehe dir, dass mich die Aussicht nicht erfreut."
0,"Nachdem Paul segensreich eingegriffen hat, ist bei Julien und Alessandra das große Sparen ausgebrochen."
0,"Du kannst dir vorstellen, wie gereizt Miss Universum darauf reagiert."
0,Wie immer sind bei ihr die anderen schuld.
0,"Sie macht nicht nur Julien, sondern auch Paul für ihre finanzielle Misere verantwortlich … Ich bin neugierig, was sie sagt, wenn sie erfährt, dass du ein Baby bekommst.“"
0,"„Sag es ihr lieber nicht“, meinte Leonie aus einem unbestimmten Gefühl heraus."
0,„Und weshalb nicht?“
0,„Nur so.“
0,„Du magst recht haben.
0,"Alessandra war schon gefährlich genug, als sie versuchte, dich überall auszustechen."
0,"Aber jetzt, da du auf der ganzen Linie siegen wirst, wird sie dich hassen.“"
0,Leonie lachte los.
0,„Ich und auf der ganzen Linie eine Siegerin?
0,"Alessandra hat Julien, sie hat das Schloss, sie hat die Diamanten, den Titel und ihre Schönheit.“"
0,„Und du?
0,"Du hast einen Mann, der kein finanzielles Harakiri begeht, sondern angesehen ist; du versuchst es mit dem Schreiben, du bist im Fernsehen aufgetreten … Wir haben dich übrigens gesehen und die Sendung gut gefunden – und jetzt bekommst du auch noch ein Kind, über das dein Vater vor Freude außer sich sein wird, ganz zu schweigen von Paul."
0,"Wisst ihr schon, ob es ein Junge oder ein Mädchen wird?“"
0,„Mama!
0,"Ich habe gerade erst begriffen, dass ich ein Kind erwarte … Außerdem fände ich es schön, erst bei der Geburt zu erfahren, ob es eine Sie oder ein Er ist."
0,Ich weiß es also nicht.“
0,„Was hältst du von Alexander?
0,Oder Lukas?
0,Oder von Belinda?“
0,„Mama!“
0,„Soll ich wirklich nicht zu dir kommen?“
0,„Nein!“
0,"„Sag Martha, dass ich ihr einen besonderen Speiseplan für werdende Mütter zuschicke.“"
0,"„Mama, bitte!“, flehte Leonie."
0,„Ja?“
0,"„Bitte hör auf, dir Gedanken zu machen."
0,Ich bin keine Mimose und auch keine Prinzessin auf der Erbse.“
0,Aber Fürstin Paola war nicht zu bremsen.
0,"„Wusstest du eigentlich, dass auf Wallmenroth bei der Geburt eines männlichen Erben sieben Schuss Salut mit der großen Kanone abgefeuert werden?“"
0,Leonie musste lachen.
0,"„Nein, das wusste ich nicht."
0,Hoffentlich ist das gute Stück nicht inzwischen eingerostet.“
0,"„Eben deshalb solltest du vielleicht doch zeitig nachforschen, ob es ein Mädchen oder ein Junge ist.“"
1,"Es war ein stürmischer Abend mit so tief hängenden Wolken, dass es schneien würde, wäre es etwas kälter gewesen."
0,"Stattdessen rüttelte der Sturm am ganzen Haus, und der Regen prasselte wie aus Kübeln."
0,Leonie blickte von ihrem Schreibtisch hoch in das ungemütliche Wetter draußen und fühlte sich drinnen umso geborgener.
0,"Sie schrieb gerade über den tatsächlich gelungenen Versuch, Jung und Alt zusammenzubringen."
0,"Die Diplomatenwitwe hatte eine siebzenjährige Mutter mit ihrem Baby in ihrem großen Haus aufgenommen, und wie es aussah, klappte das Zusammenleben zur gegenseitigen Zufriedenheit."
0,"Leonie hatte sich übrigens nur insofern Pauls Wunsch gebeugt, dass sie bei ihren Interviews nicht allein war."
0,Vera oder ihr Bruder begleiteten sie.
0,"Leonie war tatsächlich noch zweimal aus heiterem Himmel in Ohnmacht gefallen, und vielleicht war es deshalb doch gut, wenn sie nicht Auto fuhr."
0,Jetzt blickte sie sich in dem gemütlichen Arbeitszimmer um.
0,"In der rechten Ecke hatte Paul sich einen Arbeitsplatz eingerichtet, damit er nicht so viel von zu Hause weg sein musste."
0,"Um ihr zu zeigen, wie sehr er das Bild „Haus mit Familientafel“ schätzte, hing es über seinem Schreibtisch."
0,"Zur Freude von Scholz junior hatte Paul auch noch die zwei anderen großen Bierow-Gemälde gekauft, die jetzt ebenfalls das gemeinsame Arbeitszimmer verschönten."
0,Heidelandschaft in Konkurrenz zu modernen Computern.
0,Aus Marthas Küche entstiegen die aufregendsten Düfte.
0,"Heute Abend würde Paul zwei Geschäftskollegen mitbringen, mit denen er etwas privat besprechen wollte."
0,"Martha würde sich wieder als die Königin der Köchinnen erweisen, und sie, Leonie, sollte einfach nur nett und dekorativ sein."
0,Deshalb wollte sie baden und sich für Paul und seine Gäste hübsch machen.
0,"Es gefiel ihr, Paul bei seiner Arbeit zu unterstützen, dazu war sie ja erzogen worden."
0,"Obendrein gefiel es ihr, ihren Mann zu betrachten, wenn er diskutierte oder argumentierte."
0,Seine ruhige und bestimmte Art imponierte ihr.
0,"Und dann das kleine Aufblitzen in den Augen, wenn er wusste, dass er die anderen für seine Idee gewonnen hatte."
0,"Wenn er sich dann entspannt zurücklehnte, fasste er jedes Mal an die Krawatte, um das leise Lächeln zu verbergen, das über seine Lippen huschte."
0,"Dieser Mund … Leonie musste inzwischen zugeben, dass sie Pauls Mund sehr anziehend fand."
0,Gemocht und bewundert und geschätzt und geachtet hatte sie Dr. von Bierow eigentlich von Anfang an.
0,"Aber der Funke, der bei Julien in der ersten Sekunde übergesprungen war und sich in der zweiten Sekunde zu einem Feuer ausgebreitet hatte – so war es immer noch nicht zwischen Paul und ihr."
0,"Obwohl … es gab Nächte, da dachte sie, dass alles schon seine Richtigkeit hatte."
0,"Und es gab Tage, an denen sie Julien sogar zu vergessen begann."
0,In diese Betrachtungen hinein klingelte das Telefon.
0,"Schon in der Art wie es läutete, kam es Leonie wie eine Bedrohung vor."
0,Es war Alessandra.
0,"Eine wütende, fast heulende Alessandra."
0,"„Leonie“, überfiel sie ihre Schwester, und ihre Stimme klang, als stände sie mitten auf einer verkehrsreichen Straße."
0,„Siehst du das Wetter draußen?“
0,"„Ja, sicher.“"
0,„Und bei diesem Wetter hat Julien mich einfach aus dem Wagen geworfen.“
0,„Julien?
0,Dich?
0,Aus seinem Wagen?
0,Das glaube ich nicht!“
0,„Du kannst es ruhig glauben!
0,"Wir hatten einen üblen Streit, und da hat er an einer Ampel einfach die Tür aufgemacht und Raus!"
0,gebrüllt.“
0,"„Aber, um des Himmels willen, wo bist du?“"
0,„In Hamburg oder Harburg.
0,An irgendeiner beknackten Durchgangsstraße.
0,"Moment mal, ich versuche, das Straßenschild zu lesen …“ „Aber wieso bist du in Hamburg?"
0,"Ich denke, ihr seid auf Sablemer?“"
0,"„Julien verhandelt hier mit einer deutschen Kosmetikfirma, die vielleicht seine Francoise-Kosmetik mitführen will und … Aber das interessiert mich nicht die Bohne."
0,"Ich bin nur mitgekommen, um endlich mal wieder etwas zu erleben – und was tue ich hier?"
0,"Stehe in Sturm und Regen, und das ohne einen Cent!“"
0,„Du?
0,Wieso ohne einen Cent?“
0,"„Weil ich nach meinem Mantel gegriffen habe statt nach meiner Handtasche!“, heulte Alessandra wütend los."
0,„Und das weiß Julien?
0,Das kann ich mir nicht vorstellen!
0,Ein so ritterlicher Mann!“
0,„Pah!
0,Ritterlich!
0,"Wenn es um seine verdammte Kosmetik geht, verliert er jeden Charme und jede Ritterlichkeit … Idiot!"
0,"Bitte, hol mich hier ab!“"
0,"„Nimm doch ein Taxi, und ich bezahle es hier.“"
0,„Nein.
0,Ich … Komm du!
0,Du hast doch ein Auto!“
0,"„Ja, aber ich glaube …“ „Und du hast auch einen Führerschein, oder?“"
0,„Ja.
0,"Aber … Paul möchte nicht, dass ich in einer so stürmischen Nacht fahre.“"
0,"„Paul möchte das nicht“, äffte Alessandra nach."
0,„Na so was!
0,"Und ich dachte, ich sei allein so dumm gewesen, mich einem Mann anzuvertrauen, der sich als dämlicher Macho entpuppt und mir pausenlos sagt, was ich darf und was ich nicht darf."
0,"Sind das die Männer wert, Leonie?"
0,Dass du zum Beispiel deine Schwester bei diesem Wetter auf der Straße stehen lässt und … Soll ich mir eine Lungenentzündung holen?“
0,"„Natürlich nicht“, stotterte Leonie."
0,"„Ich gehe jetzt und ziehe mich an, bis dahin findest du raus, wo genau du bist.“"
1,"Das Unglück hatte seine Ursache bestimmt darin, dass Leonie nervös war."
0,Oder sich schuldig fühlte.
0,"Anstatt intelligent zu reagieren und mit einem Taxi nach Harburg zu fahren, um ihre Schwester abzuholen, stürzte sie sich in ihr Auto und verfuhr sich erst einmal gnadenlos in der ihr eigentlich fremden Stadt."
0,"Harburg lag vor Hamburg, tagsüber war das keine Schwierigkeit."
0,"Aber die Dunkelheit, der Regen, der Sturm, die glitschigen Straßen – und dann das Gefühl, dass Paul in anderthalb Stunden mit seinen Gästen kommen würde … Aber zuerst einmal musste sie Alessandra finden, die tatsächlich an einer Kreuzung stand und winkte."
0,Alessandras Schönheit hatte gelitten.
0,"Ihre Haut hatte zwar den Côte d’Azur-Teint, aber ihr blondes Haar war nass und zerzaust, Tränen oder Regen hatten das Augen-Make-up verwischt."
0,"„Endlich“, fauchte sie und stieg in den Wagen ein."
0,„Kommst du aus Berlin oder von der Elbchaussee?“
0,"„Entschuldige bitte, ich habe mich verfahren.“"
0,"„Aber wie du jetzt zum Hotel Atlantic kommst, das weißt du, oder?“"
0,„Na… natürlich.
0,Wie geht es dir?“
0,Alessandra kramte in der Manteltasche nach einer Zigarettenpackung und ihrem Feuerzeug.
0,Sie nahm einen tiefen Zug und blickte zum Fenster hinaus.
0,„Wie soll es mir gehen?
0,"Hier regnet es, und im Übrigen habe ich den falschen Mann und das falsche Vermögen geheiratet."
0,"Wie soll es einem da gehen?“, wiederholte sie und pustete den Rauch wütend aus."
0,Den falschen Mann?
0,"Leonie fühlte, wie sie errötete."
0,„Und welcher wäre der Richtige?“
0,"„Einer, dem ein paar Hunderttausende mehr oder weniger nichts ausmachen, wenn man sie ausgibt.“"
0,Sie blickte Leonie von der Seite an.
0,"„Wenn du noch ein bisschen wartest, kriegst du deinen Julien wieder."
0,"So genügsam, wie du bist, würdet ihr jetzt fabelhaft zusammenpassen … Du sagst ja nichts!"
0,Oder nimmst du keine Männer aus zweiter Hand?
0,Du müsstest ihn natürlich erst wieder aufbauen.
0,"Ein bisschen Bewunderung, das täte Julien gut.“"
0,Leonie kurbelte das Fenster hinunter.
0,Der Rauch gefiel ihr nicht.
0,„Und warum schenkst du ihm nicht dieses bisschen Bewunderung?“
0,„Weil es da nichts zu bewundern gibt.
0,"Das Vermögen ist nicht so groß, wie ich dachte, das Schloss ist zugig, Juliens Eltern sind geradezu schwachsinnig in ihrer Bewunderung für diesen schönen Sohn, die Lavendelfelder und ihr süßlicher Duft können mir gestohlen bleiben, ich langweile mich zu Tode – was glaubst du, was da von der rauschenden Hochzeit und all den Versprechungen übrig bleibt?“"
0,"„Ein Mann und eine Frau“, stellte Leonie fest."
0,"„Ein Paar, bis dass der Tod es scheidet.“"
0,„Uns scheidet bald etwas anderes!
0,"Wenn ich vorhin nicht so schnell aus dem Wagen gesprungen wäre und meine Tasche mitgenommen hätte, wäre ich jetzt auf dem Flughafen und morgen auf Martinique."
0,"Meine Freunde sind alle dort und …“ „Also hat Julien dich nicht aus dem Wagen geworfen, sondern du bist ihm weggelaufen?“"
0,„Und wo sollte da ein verdammter Unterschied sein?“
0,Wütend drückte Alessandra ihre Zigarette im Aschenbecher aus.
0,„Aber natürlich!
0,"Ich vergaß, dass die Dame Julien vielleicht noch liebt.“"
0,"„Alessandra, ich bitte dich!“"
0,„Was gibt es denn da zu bitten?
0,Heute würde ich ihn dir lassen.
0,"Es hätte mir gleich zu denken geben sollen, wie leicht es war, dir Julien wegzunehmen."
0,Ein intelligenter Mann hätte mein Spiel nämlich durchschaut.“
0,Inzwischen war Leonie an der Außen-Alster angekommen und fuhr bereits auf das Hotel „Atlantic“ zu.
0,Sie atmete auf.
0,Sie konnte ihre Schwester und deren heimtückische Seitenhiebe nicht mehr ertragen.
0,Und dann der Qualm!
0,"Sie schalt sich einen Feigling, dass sie Alessandra nicht sagte, dass sie ein Kind erwartete."
0,Aber vielleicht hätte Alessandra ihr dann erst recht ins Gesicht gepafft.
0,"Außerdem widerstrebte es ihr, zu jemandem von ihrem Kind zu sprechen, der im Augenblick so voller Hass war."
0,"„Soll ich mit hineinkommen?“, fragte sie deshalb nur, als sie vor dem Hotel vorfuhren."
0,"„Nein, danke.“"
0,Alessandra stieg aus dem Wagen und beugte sich noch einmal hinunter.
0,"„Danke, Kleines."
0,Vielleicht melde ich mich morgen bei dir.
0,Aber jetzt möchte ich erst ein heißes Bad nehmen und ein Glas Champagner auf den Schreck hin trinken.
0,"Julien kommt gegen zehn, wenn du in der Bar auf ihn warten möchtest …“ „Nein, danke.“"
0,Leonie winkte ab.
0,„Wir haben heute Gäste.
0,Gute Nacht.“
1,Leonie brauste aus der Hoteleinfahrt.
0,"Um gegen ein Gefühl großer Traurigkeit anzukämpfen, biss sie sich auf die Lippen."
0,Ihr Bedürfnis nach Harmonie war zerstört.
0,"Ein Sportwagen, den sie von früher kannte, kam auf der anderen Straßenseite an ihr vorbeigefahren."
0,Beim Anblick des silbergrauen Wagens durchfuhr es sie siedend heiß.
0,"Es erinnerte sie an so viel, auch an die Stunden, in denen sie am Fenster gewartet hatte, um diesen Wagen auf der Straße vorbeihuschen zu sehen."
0,"Und dann der Anblick, wenn der Wagen die Allee heraufkam und sie … Jetzt fuhr Julien an ihr vorbei."
0,Ihr Herz raste.
0,"Sie fühlte dieses Sausen in den Ohren und versuchte, rechts heranzufahren."
0,Der Wagen begann zu schliddern und prallte gegen irgendetwas.
0,Vielleicht an einen Laternenpfahl oder eine Parkuhr.
0,"Der Aufprall an sich war relativ harmlos, denn der Airbag ging nicht auf."
0,Dennoch musste sie sich verletzt haben.
0,"All das rekonstruierte man später, als sie ins Krankenhaus gebracht wurde, weil sie im Verhältnis zu dem Aufprallunfall zu große Schmerzen hatte."
0,Sie verlor das Baby noch in dieser Nacht.
0,"Pauls Vorhaltungen, was sie alleine dort draußen in der Nacht gemacht hätte, waren berechtigt."
0,"Leonie wagte es nicht, ihm zu sagen, was wirklich passiert war."
0,"Sie schwindelte, sie sei mit Vera zusammen zu einem Termin gerufen worden und betete, dass Alessandra sich nicht meldete und der Schwindel aufflog."
1,"Als sie zwei Tage später nach Hause zurückkehrte, war Leonie blass und nicht mehr der Mensch, der sie vorher gewesen war."
0,Irgendwie schien sie die Zuversicht in sich selbst verloren zu haben.
0,Sie hatte Paul hintergangen und ihm und sich und ihren beiden Familien einen großen Schmerz zugefügt.
0,Und sie hatte gelogen!
0,Vielleicht hätte Paul ihr verziehen.
0,"Aber sie, sie konnte sich selbst nicht verzeihen."
0,"„Prinzessin, du machst mir Sorgen.“"
0,Vera saß auf der Kante von Pauls Schreibtisch und wippte mit dem rechten Fuß.
0,Leonie erschrak.
0,„Wieso?
0,Ist der Artikel nicht in Ordnung?“
0,„Der Artikel ist bestimmt gut.
0,"Aber dass du wegen allem erschrickst und dein fröhliches Selbstvertrauen verloren hast, das gefällt mir nicht."
0,"Da draußen ist ein schöner März mit den ersten Sonnenstrahlen, und du sitzt hier als kleiner Bleichling und trauerst vor dich hin."
0,Auch Piet sagt …“ Leonie heftete die sechs Seiten über das Haus Elbchaussee Nummer 111 in eine Mappe.
0,"In dieser Villa wohnte ein ehemaliger Kapitän, der ihr gern lustige Anekdoten aus seinem Leben erzählte."
0,„Was meint Piet?“
0,"„Piet meint, dass wir uns um das seelische Befinden unserer Mitarbeiter kümmern sollten.“"
0,„Unserer Mitarbeiter?
0,Sprichst du im Plural?
0,Ihr habt doch nur mich!“
0,„Eben.“
0,Vera hüpfte vom Schreibtisch.
0,"„Und wenn wir dich verlieren, dann können wir mit unserem Käseblättchen wieder von vorne anfangen.“"
0,Vera zog sich Pauls Schreibtischstuhl heran und setzte sich neben Leonie.
0,"„Es ist wegen des Babys, nicht wahr?“"
0,"Leonie schwieg und legte noch zwei Fotos der Villa in den Schnellhefter, die sie von dem Kapitän mitbekommen hatte."
0,„Schweigt man sich in erlauchten Kreisen über echte Probleme aus?
0,Oder spricht man darüber mit einer – Freundin?“
0,Leonie lächelte.
0,„Freundin?
0,Ich danke dir für das Angebot.
0,"Ich dachte, ihr Hanseaten seid so kühl und zugeknöpft.“"
0,"„Wir sind etwas zurückhaltend, haben aber ein goldenes Herz."
0,"Scherz beiseite, Leonie."
0,"Wenn ich mich in den Status einer Freundin erhebe – ob erbeten oder ungebeten – so tue ich es, um das Recht zu haben, mit dir zu reden."
0,"Ich … ich denke nämlich, dass noch etwas anderes an dir nagt als der Verlust des Kindes.“"
0,"Leonie schwieg und schrieb die Adresse des Nienstädter Sonntagsblattes mit Filzstift auf einen Briefumschlag, in den sie den Schnellhefter einschob."
0,Vera ließ sich nicht beirren.
0,"„Da ich damals in den Schwindel mit einbezogen wurde, um dir für jene Nacht ein Alibi zu geben, muss an dem Abend etwas geschehen sein, das dich heute noch bedrückt."
0,"Ich habe das Gefühl, du leidest an einem Schuldkomplex."
0,"Hast du einem Eichhörnchen den Schwanz abgefahren?“, versuchte sie zu scherzen."
0,„Nein.“
0,"„Verdammt, bist du einem Gespenst begegnet?“"
0,„Man könnte es so nennen.“
0,„Aha.
0,"Da du wenige Menschen in Hamburg kennst, die dir nachts über den Weg laufen, war es jemand aus deiner Vergangenheit.“"
0,Leonie überreichte Vera das Kuvert.
0,"„Was warst du eigentlich, bevor du mit deinem Bruder die Druckerei aufgekauft hast?“"
0,„Ich war bei der Polizei.
0,"Ich war eine von diesen flockigen Deerns in Uniform, wie sie in den Fernsehserien herumhüpfen.“"
0,Jetzt war Leonie doch neugierig.
0,„Warum hast du diese Arbeit aufgegeben?“
0,„Weil ich mich mit der Grausamkeit auf den Straßen nicht abfinden konnte und mich außerdem in den falschen Mann verliebt hatte.
0,"Ich habe beidem Ade gesagt, dem Beruf und dem Mann, und mit Piet ein neues Leben angefangen, das sich Dank deiner Mithilfe sogar zu lohnen beginnt."
0,Wenn ich dir einen Rat geben darf…“ Vera blickte Leonie mit ihren schwarzen Augen an.
0,„Darf ich dir einen Rat geben?“
0,Leonie lächelte.
0,„Du darfst.“
0,"„Vergiss diesen Mann und beichte dem deinen, was sich an jenem Abend wirklich abgespielt hat.“"
0,Leonie war blass geworden.
0,„Welcher andere Mann?“
0,"„Ich sagte doch, dass ich bei der Polizei war."
0,Ich habe auch heute noch Verbindungen.
0,"Es gibt die Zeugenaussage der Person, die dich ins Krankenhaus gebracht hat."
0,"Der Mann parkte an jenem Abend kurz am Straßenrand, um seinen Scheinwerfer in Ordnung zu bringen."
0,"Er sagte aus, dass dir ein silbergrauer Sportwagen mit überhöhter Geschwindigkeit entgegenkam und dich wahrscheinlich geblendet hat."
0,"Jedenfalls begann dein Wagen auf der nassen Fahrbahn zu schlingern, und du fuhrst auf den Laternenpfahl."
0,Am nächsten Tag hat er den silbergrauen Wagen durch Zufall auf derselben Straße wiedergesehen.
0,"Er hat sich die Nummer notiert und der Polizei Mitteilung gemacht, falls du dich aus versicherungstechnischen Gründen für den Ablauf des Unfalls interessiert es … Ist das das Gespenst, das du mit dir herumschleppst?"
0,"Der Mann mit dem silbernen Wagen – dein Schwager, der Prinz von Sablemer?“"
0,„Weiß … weiß Paul von diesen Dingen?
0,Hat die Polizei es ihm gesagt?“
0,„Ich glaube nicht.
0,"Aber ich finde, dass du es ihm sagen solltest.“"
0,Vehement schüttelte Leonie den Kopf.
0,„Nein.
0,"Welcher Mann könnte es verzeihen, wenn seine Frau sein Kind aus … Dummheit oder Mutwillen verloren hat?“"
0,Vera legte Leonie die Hand auf die Schulter.
0,„Versuch es.
0,"Und sei es nur, um mit dir selbst ins Reine zu kommen."
0,"Du kommst doch aus einer Familie, in der es sogar tapfere Kreuzritter gegeben hat.“"
0,„Das mit den Kreuzfahrern ist über siebenhundert Jahre her.“
0,Vera lachte gutmütig auf.
0,"„Wenn du in solchen Zeitdimensionen rechnest, dann kannst du dir mit deinem Gespräch natürlich noch Zeit lassen."
0,Ich komme übermorgen wieder.
0,"Wenn du willst, sprechen wir noch einmal über alles.“"
0,Sie nahm das Kuvert entgegen und hob es hoch.
0,"„Ich muss zu Piet, damit er mit seinem Sonntagsblättchen fertig wird.“"
1,"An diesem Abend hätte Leonie fast den Mut aufgebracht, mit ihrem Mann zu sprechen."
0,"Doch der verließ sie, als sie Pauls steinerne Miene sah."
0,"Wohlerzogen, wie sie waren, aßen sie erst Marthas liebevoll zubereitetes Essen, wenn auch keiner von beiden großen Appetit an den Tag legte."
0,"Als Martha sich nach dem Dessert zurückzog, sah Paul seine Frau mit einem Blick an, aus dem Trauer und Enttäuschung sprachen."
0,"„Ich habe heute einen Anruf von Alessandra bekommen“, sagte er bitter."
0,„Oh!“
0,Leonie legte die Hand an den Hals.
0,„Alessandra wollte eigentlich dich sprechen.
0,"Da du aber nicht zu Hause warst, rief sie mich an."
0,"Sie sagte, sie lasse sich von Julien scheiden, du könntest ihn haben.“"
0,Vor Anspannung traten Pauls Kinnmuskeln hervor.
0,„Wie darf ich das verstehen?“
0,„Was verstehen?
0,Da gibt es nichts zu verstehen.
0,"Ich …“ Leonie schwieg und sehnte die Tage herbei, an denen sie in einer solchen Situation einfach vom Stuhl geglitten wäre."
0,„Hat … hat sie sonst noch etwas gesagt?“
0,"Paul ergriff Leonies linke Hand und hielt sie fest, sehr fest."
0,„O ja.
0,Sie wollte mich über dein Treiben nicht im Unklaren lassen.
0,"Sie wisse mit Bestimmtheit, dass du am zehnten Dezember im Hotel Atlantic gewesen seiest und dass Julien zum selben Zeitpunkt ebenfalls in diesem Hotel übernachtet habe.“"
0,„Aber … aber … Was für ein Wahnsinn!
0,Zu diesem Zeitpunkt war Alessandra auch im Atlantic.
0,Sie hat mich doch noch …“ Pauls Augen wurden hart.
0,"„Ich hätte Alessandras Worten keinen Glauben geschenkt, wenn der Ort deines kleinen, für uns so folgenschweren Unfalls nicht praktisch vor dem Atlantic gewesen wäre."
0,Du hast ihn also gesehen und dabei unser Kind …“ Er sprach den Vorwurf nicht aus.
0,"„Ich habe sie gesehen, nicht ihn!"
0,"Alessandra rief mich in jener stürmischen Nacht an und behauptete, sie stünde irgendwo ohne Geld im Regen, weil Julien sie aus dem Wagen geworfen hätte.“"
0,„Ach so.
0,"Alessandra befiehlt, und du gehorchst."
0,"Und ich hatte dir untersagt, dich noch einmal mit ihr zu befassen!"
0,"Für dieses Versprechen von dir habe ich Nächte um Nächte gearbeitet, um diesem leichtsinnigen Paar aus der finanziellen Klemme zu helfen."
0,"Und du …“ „Paul, so versteh mich doch!"
0,Du bist mein Mann – aber sie ist meine Schwester!
0,Was sollte ich denn tun?“
0,„Du?
0,Zu Hause bleiben und mich anrufen!
0,"Ich hätte der Prinzessin von Sablemer ein Taxi geschickt, und wir wären jetzt eine glückliche Familie – wenn deine Version der Geschichte stimmt."
0,"Wenn Alessandras der Wahrheit entspricht, dann …“ Leonie biss sich auf die Lippen."
0,"„Ja, glaubst du mir nicht mehr?“"
0,"„Kann ich das denn?“, entgegnete er gequält."
0,"„Aber siehst du nicht ein, dass unter den damaligen Gegebenheiten …“ „Den damaligen Gegebenheiten“, brauste er auf."
0,"„Haben wir dann jetzt wieder eine neue Gegebenheit, wenn sich das saubere Paar trennt?"
0,"Muss ich befürchten, dass dort draußen Juliens Sportwagen vorfährt und du die Koffer packst?"
0,"Leonie, ich warne dich“, sagte er fast grollend."
0,"„Wenn du diesmal wieder mit fliegenden Fahnen zu einem der beiden übergehst, dann möchte ich dich in diesem Haus nie wieder sehen."
0,"Dann kannst du mit Julien nach Sablemer ziehen und Lavendel pflücken, für mich existierst du dann nicht mehr."
0,Ich …“ Er stockte.
0,"„Ich habe dich wirklich, ja, ich habe dich geliebt, und ich liebe dich noch."
0,Und ich möchte dich weiter beschützen.
0,"Aber ich bin keiner von diesen Softies, die alles hinnehmen und sich in eine Ecke setzen und schluchzen."
0,Ich …“ Aufgeregt pochte Martha an die Tür des Esszimmers.
0,"„Herr Doktor, Durchlaucht!"
0,Sie sollten schnell an den Fernseher kommen.
0,Da ist gerade ein Bericht über den Prinzen und die Prinzessin von Sablemer.
0,Alessandra lässt sich von ihrem Prinzen scheiden!
0,Schauen Sie nur!“
0,Martha riss die Tür auf.
0,Sie hatte den Fernseher im Wohnraum bereits angeschaltet.
