0,"Collision of Worlds 
Invasion
Part 1
By Michael DeBuse"
0,"Eydis found this assumption reasonable if this was an institute of learning, and only a scholar would invest his brief human lifespan to learn the language of the sprites who were an extreme minority even in the Amelian Empire."
0,"After a word of greeting to Justin, the elderly man turned to Eydis."
0,"“I am pleased to meet you,” he said in the familiar tongue of the sprites."
0,“Please sit in the chair beside you.”
0,"Eydis sat down as instructed, but there were only two chairs, so Justin leaned back against the wall beside the door."
0,"His relaxed posture in front of his elder and superior struck Eydis as bizarre, and she feared there might be repercussions, but Shuman did not seem to mind."
0,"Perhaps he was mild-mannered or forgiving of such benign insults, but to be safe, Eydis sat straight with her hands clasped in her lap, legs close together, and her ankles politely crossed."
0,"She was a princess, but in her current situation, Shuman was the highest authority and deserving of respect."
0,Shuman spoke with Justin and asked a few questions to which Justin gave concise replies.
0,"Satisfied, Shuman faced Eydis once again."
0,"“Justin tells me that you do not speak English, but you know other tongues that he has not heard."
0,How many do you speak?”
0,Shuman’s knowledge of the language was what Eydis had expected.
0,He spoke in the slow and simple words of one who knew the language of the sprites but was not fluent.
0,"Although most people spoke multiple languages, those with enough education to speak many languages fluently were few and far between."
0,Telling the truth about how many languages she spoke may raise suspicion against her or at least hint her social status.
0,"However, Justin would not have brought her to this man if he did not trust him at some level."
0,"After careful contemplation, she decided to answer."
0,Being a polyglot did not immediately mean she was royalty.
0,“I speak one hundred and thirteen languages and dialects.”
0,Shuman’s eyes widened and he leaned back in his chair.
0,“Does that mean you speak most of the major tongues in the world?”
0,Shuman’s statement surprised Eydis.
0,The languages and dialects in the Amelian Empire alone numbered nearly one hundred.
0,"If she included the neighboring countries and territories, they increased to multiple thousands, and that was just one of the smaller continents of Whinhlem."
0,"Including the beastkin who populated the rest of Whinhlem, the world had hundreds of thousands of languages if their various dialects were included."
0,"There were, of course, the major political and commerce languages that most people of every country knew or could at least understand, but each race and society strongly held onto the language of their origin, and that practice was widely accepted all over the world."
0,The only way a language would die out would be the extinction of the race that spoke it.
0,"Even the humans, giants, dwarves, and minums had their own separate languages and accompanying dialects with Common Minum being used universally throughout Tolmyur."
0,"Was Shuman not educated after all, or was their education suppressed to include only what was needed within human society?"
0,"If that was the case, having only one hundred languages made sense."
0,Eydis had to make certain.
0,“How many languages are there in the world?”
0,Shuman thought for a moment.
0,"“From what I know, there are about eight thousand.”"
0,"“Do you understand this language,” Eydis asked in the Common Minum dialect she had learned."
0,"“I am sorry,” Shuman replied."
0,“I do not know what you said.”
0,How could a human scholar not even know the common tongue of the humans?
0,"There was an obvious answer, and Eydis felt a fool that she had not realized sooner."
0,“What is the name of this nation?”
0,Shuman looked visibly perplexed.
0,“I do not know how to say it.
0,Please wait.” He pulled a book from a shelf above his desk and flipped through the pages.
0,"After jumping from location to location, page to page, he inserted it back on the shelf and sat down."
0,“I could not find a good way to say it.
0,"In English, we call it ‘The United States of America’.”"
0,“This is not the Tolmyur Kingdom?
0,Can you show me a map?”
0,Shuman did not react to the mention of Tolmyur.
0,He turned around to the large black slate mounted on a stand sitting atop his desk.
0,Moving a small object on the desk lit the slate.
0,It was a larger version of the communication device that all humans carried.
0,Soon what resembled a map appeared.
0,Shuman turned the slate towards Eydis and moved away.
0,"It was then that Eydis realized the chairs in which she and Shuman sat had small wheels attached to the bottom, so she slid her chair in front of the map mimicking the light motions of Shuman’s legs to take caution against any uncouth movements."
0,The land masses and bodies of water looked nothing like anything she had formerly seen on maps at the palace.
0,There was the possibility that these were only small islands that she would not have noticed when looking at the full world map.
0,“Where are these islands located?” she asked.
0,“I do not know what you mean.”
0,“Can you show me the whole world map?”
0,"“This is the world map,” Shuman replied, perplexed."
0,“Where are we?” 
0,Shuman rolled his chair next to Eydis and requested access to the small hand device.
0,Moving it also moved a small white arrow on the slate.
0,Shuman motioned the arrow in a circle around the center of the northwestern landmass.
0,“Here.”
0,The map then expanded to focus on the area Shuman had circled.
0,Map details were added and became more visible.
0,Eydis gasped in astonishment despite herself.
0,"Rivers, lakes, and mountains formed."
0,"What looked like cities dotted the landscape, and their size was easily visible."
0,These were not small islands but small continents.
0,The entire Amelian Empire would almost fit inside the continent Shuman highlighted.
0,"Out the window behind the desk, Eydis noticed that the sun was already setting when it should still be midday."
0,"She sat slack in her chair, too dumbstruck to worry about keeping appearances."
0,Is this real?
0,Is this world not Whinhlem?
0,Where am I?
0,"Seeing Eydis’s reaction, Shuman spoke with Justin."
0,Their conversation lasted for some time.
0,“Justin says there is a lot about you that is not…”
0,Shuman paused for a moment like he was trying to find the right way to express what he wanted to say.
0,Justin intervened.
0,"He made the motions of removing her woven cap, suggesting that Eydis should be up front to Shuman about who she was."
0,Eydis was apprehensive.
0,Justin knew she was an elf and had taken precautions so that this truth would not be revealed.
0,Was it safe to reveal the truth to Shuman as well?
0,"Again, Eydis’s training told her to abstain from any action that could endanger her, and again Eydis had to suppress its impulse."
0,"She was taught to survive in many varying situations, but in all her training, she had never been told how to act when brought to another world."
0,"How could Evhial, Symra, or Emer ever predict such an event occurring?"
0,"Although, Emer was the one who sent her to this world."
0,"If he had such ability, he should have taught her how to interact with the natives of a new world."
0,"In the end, she had little choice but to trust Justin, and therefore trust Shuman."
0,She removed her woven hat.
0,Her pointed ears sprung outwards flicking out strands of hair with them.
0,This time it was Shuman who sat back in his chair dumbstruck.
0,He asked some worried question to Justin who in turn replied with a serious answer.
0,"Justin pointed at his eyes, ears, and lower back in his explanation and then held out his arms as if carrying something."
0,"After hearing Justin’s explanation, Shuman leaned forward to get a better look at Eydis’s eyes and ears."
0,“Are you an elf?” He asked.
0,Eydis held back her answer.
0,"If these humans were as hostile to elves as those in the Tolmyur Kingdom, even if they were not at war, or especially if they had connections with the Tolmyur Kingdom, confessing herself a High Elf would be the end of her freedom and possibly result in execution."
0,"Then again, Shuman did not react to her mention of Tolmyur."
0,Eydis looked back at Justin with worry pained in her face.
0,Justin replied with a reassuring smile and nodding head.
0,Eydis lowered her head and tensed.
0,Every emotion within her was telling her to remain silent or lie.
0,"Humans killed her family, a reality that she was constantly trying to push to the back of her mind to focus on what was happening at this moment."
0,Everything Shuman had shown her could have been fabricated.
0,She may still be in danger.
0,But… Justin would not have taken her here if he did not trust Shuman.
0,"He had already done so much for her, too much to reason off as a means to some convoluted deception ploy to earn her trust to capture her."
0,"If it was all a lie, then she could not fault herself for believing it."
0,"Taking a deep breath, Eydis spoke."
0,“I am a High Elf of the Amelian Empire.” Eydis’s ears drooped slightly after her confession.
0,She readied an emergency teleportation formula in case the worst occurred.
0,She set the destination to the far side of one of the mountains she could see in the distance from the small room’s window.
0,Shuman exhaled loudly and leaned back in his chair.
0,"“Now I know why you speak Anglo-Saxon,” he said with his hand still covering his mouth as if it had somehow grown attached."
0,"Sitting upright, he continued."
0,“Elves are from old Germanic stories and were known as the white spirits of the forests.
0,You said you were from the Amelian Empire.
0,I do not know it.
0,How did you come here?”
0,Eydis could sense no deception in Shuman’s words.
0,Perhaps these humans had no connection with the Tolmyur Kingdom.
0,"The fear welling up within her abated, albeit only slightly, but she felt safe enough to explain what happened the night before."
0,“I escaped an assassin.” 
1,"Shuman and Justin listened awestruck as Eydis recited the calamity that had befallen her family, but she left out the details about humans being the perpetrators, fearing that it might cause some misunderstanding or make them think there was a condemning reason the humans of her world were hostile towards elfkind."
0,"Shuman translated each statement for Justin as she spoke, looking up words in his book that he was unsure of and filling in guesses where no translation could be found."
0,"By the end, Justin sat on the floor."
0,Her tale overwhelmed him.
0,“So…” Shuman spoke up after a moment of silence.
0,"“If this is all true, you are the princess and next queen of the Amelian Empire?”"
0,"“Next empress, yes,” Eydis replied."
0,"“I do not want to doubt you, but things like magic and elves do not exist in this world."
0,They are only stories.
0,"If it is not too much to ask, could you show your story is true by using some magic?"
0,True magic?”
0,Eydis understood that Shuman’s emphasis on the word “true” meant he desired proof that could not be seen as a trick or illusion or explained through other means.
0,"The request was trivial, and she was more than willing to comply."
0,"“It is more difficult for me to use the ven here, but I can.”"
0,"Shuman had a very small, leafy plant in a pot in the windowsill behind his desk."
0,"It was in the peak of health, suggesting that Shuman took great care of it."
0,“May I see that plant?”
0,Shuman handed Eydis the small ceramic planter.
0,“Do not hurt it.” 
0,Eydis gathered life ven in her hand and touched the stem of the small plant between her thumb and forefinger.
0,Fresh branches and leaves grew before their eyes.
0,The growth was small but very noticeable.
0,Eydis stopped at the point where going further might endanger the plant with its current nutrient levels.
0,She then handed back the planter.
0,Shuman examined and touched the fresh leaves.
0,"“In all my fifty-eight years, I never thought I would see true magic.”"
0,Eydis was stunned.
0,Shuman looked no older than five.
0,"Humans had a lifespan of about five to six years, but some lived to seven."
0,Members of elfkind lived to be about 80 with High Elves commonly reaching 90 to 100 years of age.
0,How could a human live so long?
0,“Can you ask Justin his age?”
0,"After a brief exchange, Shuman responded."
0,“He is 23.”
0,This broke all knowledge Eydis had on human biology.
0,"Eydis was only halfway through her fourth year of life, yet Justin looked no older than she."
0,Were these people not human?
0,"This was another world, so humans might be different here."
0,Eydis reached another realization.
0,This world was different.
0,This was no better proven than by the map she had seen.
0,The map suggested that this world was smaller than hers.
0,"Her first instructor, Evhial, had taught her that the larger the body, the larger the gravitational pull."
0,The opposite would then be true.
0,"The reason she felt lighter, and possibly why the air was thinner, was because this world was small."
0,The days were also about half the length of those from her world.
0,None of the knowledge about her world would apply here.
0,"If the measurement of years was also different, then the ages of Justin and Shuman could be explained."
0,They might still be human.
0,“How many days are in your year?” Eydis asked.
0,"“365 and one fourth part,” Shuman replied."
0,Eydis was puzzled about the fraction of a day that was included but thought it best to ignore.
0,"However, the number alone meant little."
0,Eydis could no longer make any assumptions.
0,“How do you measure your numbers?”
0,"Shuman looked puzzled and then asked Justin, possibly for clarification or an idea of what she meant."
0,"Coming to a conclusion, Justin held up all ten digits of his hands."
0,"Eydis understood that this meant their number system was likely base ten, something she felt was rather primitive, but she could understand the ease it made simple calculations although at the cost of complicating division due to the lack of divisors the base allowed."
0,The common folk of Whinhlem often measured their numbers the same.
0,Eydis requested something to write on.
0,Shuman handed her a high-quality piece of parchment and an odd-looking writing instrument.
0,"It was transparent, and the ink appeared to be held in a tube inside of it removing the need for an inkwell."
0,Or perhaps it could be better stated that the inkwell was inside the pen.
0,It was fascinating.
0,She worked out the conversion of 365 from base ten.
0,She then used her observed length of the day in this world to estimate how many days their year would be in hers.
0,"Finishing the math, she was ready to report her findings, or rough estimates at least."
0,“A year in my world would be just under twelve in yours.
0,This would make me about fifty-five in your years.”
0,"“You age well,” Shuman jested, visibly trying to hold back his surprise."
0,"“Elves do age much slower than humans in my world, so perhaps it is the same here."
0,"I am physically an adult, but I am also still considered to be in my youth because I have not become independent."
0,"High Elves like myself live to be…” Eydis paused to mentally calculate the years, having already grown accustomed to the simple base conversion, “We live for about one thousand years in your time.”"
0,"Shuman explained to Justin the reason for Eydis’s out-of-place questions along with her age, but Justin did not appear surprised."
0,"Instead, he spoke some serious words back at Shuman who nodded in agreement."
0,“Justin wants us to return to topic.”
0,"Eydis realized that she had moved their conversation in an unimportant direction, overcome by her curiosity."
0,"“Your family was killed, and your teacher sent you to this world, correct?” Shuman asked."
0,Eydis nodded.
0,“Do you think there is a way to send you back to your world?”
0,“I do not know.
0,I am an amateur in that school of magic and nowhere close to the abilities of Emer.
0,Sending someone to another world is magic I cannot begin to understand.
0,Emer must have done it because my assassin was another mage of equal or higher ability.
0,He had easily traced our attempted escapes until this one.
0,I did not even know Emer was capable of such grand magic.”
0,Shuman grew troubled.
0,“You said your assassin was the same or stronger than Emer.
0,Is there a chance that he could still come for you?”
0,"“My destination was randomized, and Emer stayed behind to scramble the trace… the remnants of the magic left behind after its casting,” she explained quickly."
0,"“My assassin has not followed, so I want to believe that Emer succeeded."
0,"I cannot say for certain, but I do not think it would be possible for the assassin to follow me.”"
0,“Are you sure?”
0,Eydis considered all the theories and laws of teleportation she had learned from Emer.
0,"Emer would never lie to her about the capabilities of his own magical specialty, especially considering she would become empress."
0,Doing so would be tantamount to occupational suicide leaning on the side of treason.
0,"“Yes, everything I have learned says it is impossible, but… I also thought teleporting to another world was impossible."
0,"The assassin used magic I had never seen before too, so for him… I cannot guess.”"
0,"Chapter 7
“Friends are those with whom you can confide.”
Eydis"
1,Eydis sat at the back of a small lecture hall.
0,She grew fascinated by the angular table that rose from between her seat and the one next to it and folded down over her lap.
0,She spent a few minutes in an inquisitive fever repeating the raising and folding motions and admiring the peculiar hinge that made such movements possible.
0,The few occupants sitting among the tiered seating of the hall watched her in confusion.
0,"Each student in the room was not skilled in the language of this country, English."
0,Eydis received special permission from Dr. Shuman after their meeting yesterday to attend an English course designed for foreign students.
0,"The timing of the course near-perfectly coincided with the time Justin was earning money, making it quite advantageous."
0,"When Eydis asked about Justin’s job, he simply replied, “I answer questions.” Eydis was curious to what kind of occupation such a cryptic answer could apply and landed on the only possibility on Whinhlem, an information broker."
0,The lower class of many large cities was often the priviest to the rumors and secrets of the city.
0,"The most knowledgeable among them would sell this information to others, if the price was good enough."
0,Perhaps Justin leveraged his tutelage within the institution to gain access to broader information channels.
0,It was a dangerous profession that paid poorly for most information but held the potential for great reward for rare and dangerous knowledge.
0,"The more difficult to obtain and dangerous the information, the higher the risk to the broker’s life, especially considering the greatest of rumors were often detrimental to the person who was the topic of the rumor, and so they would want to silence the spread as a matter of course."
0,"If Justin lived with that kind of risk daily, she better understood why he would be willing to house an unknown person who was the target of a very powerful assassin."
0,"After the meeting with Dr. Shuman ended, the topic arose of where Eydis would stay."
0,Dr. Shuman raised concern about having a young woman stay in an apartment with two other men but was unable to provide her shelter himself.
0,"He was willing, but his relationship with his wife was currently strained, and she rejected the idea of him bringing home a younger woman without giving him a chance to explain the situation."
0,"Allegedly, he had affairs in the past."
0,Eydis could understand the feelings of a wife who would easily mistake this act of kindness as taking in a much younger mistress.
0,Their relationship would only worsen if his wife would not accept Eydis’s presence in his home.
0,"In the end, Justin agreed to take care of Eydis until something more permanent could be set up."
0,"The only hurdle was the other resident, Sean."
0,Justin talked to Sean that evening and explained the situation but made sure to leave out the information about Eydis’s origin and the assassin targeting her.
0,"Persuading Sean was difficult, but he agreed under strict terms."
0,"Eydis had to find some way to earn money, and when possible, she would find her own place to live."
0,Their home only had two personal rooms with a single bed each.
0,"For the time being, Justin agreed to sleep on the couch, giving Eydis his bed."
0,"Eydis refused such generosity at first, but Justin would not budge, so she had little choice but to give in to his kindness with an unspoken promise to herself to repay him when able."
0,Finding a way to earn money was difficult for Eydis in her current situation.
0,She was an illegal resident of this country and did not know the language.
0,"Eydis was at least grateful that Sean had not requested her to repay them outright, and she sought every opportunity to gain his favor after seeing how angry he became when Justin saved her."
0,She wanted to find work so that she would not be pressured into unfavorable methods of repayment.
0,Her request to be taught the English language was a means to this end and led to her seat in this lecture.
0,"By the end of the lecture, Eydis was relieved at the similarities between English and the sprite tongue, more so than she previously thought."
0,"Understanding the lecture was extremely difficult, but reading with Justin on her first day helped immensely."
0,Her conversations with Dr. Shuman and this lecture from one of his associates built Eydis’s confidence in her understanding of the basic grammatical structure of the language.
0,"She would only need to learn the vocabulary, their conjugations, and practice as much as possible to grow accustomed to the pragmatics; however, this was the cause for frustration due to the number of conflicting rules and exceptions in English."
0,Eydis understood that many languages absorbed parts of others to develop.
0,She only wished that English had picked the rules of the languages it assimilated and incorporated those rules universally throughout instead of using haphazard combinations of conflicting rules.
1,Eydis closed the small pocket-sized grammar book Dr. Shuman had given her and let out a sigh.
0,"The more she read, the more annoyed she became."
0,"Of all the languages she had studied, this was the first language she felt was not worth learning, and yet it was the only one she needed to learn for the sake of her own survival."
0,Eydis slouched in a padded chair of an empty foyer where Justin had instructed her to wait.
0,It was only about 200 square feet in size and contained a single couch and chair.
0,The double doors between the chair and sofa led to the second-floor balcony seats of an old lecture hall.
0,"When she peaked in the doors out of curiosity, the room almost reminded her of a much, much smaller version of the grand council chamber of the Amelian palace, except everything was fashioned of wood instead of marble."
0,It could fit maybe two hundred students on the first floor and half that on the balcony seats.
0,"The foyer only had two entrances, and Justin chose it for their meetup location due to how few people passed through the connected stairs to the hall’s first floor and the hallway that extended about ten yards opposite the double doors before turning corner out of sight."
0,A little time remained before Justin would return.
0,She tried to keep occupied to prevent herself from mourning the death of her family or drowning in worry over what was happening in the empire with her family gone.
0,"The sight of her brothers severed in half lying in their own gore flashed in her mind the moment she let her mind wander, and the mere thought of her parents, brothers, and Ceil caused her heart to ache with an acute pain."
0,"But, she also felt that any further study into the English language would only lead to frustration."
0,"Tilting her head back, Eydis decided to practice her deep breathing and focus on her ven regeneration to help her body better process the unfamiliar ven of this world."
0,Eydis closed her eyes and fell into a trance.
0,“Do you think I am not aware you were stalking me?”
0,“I wasn’t stalking you.
0,I just wanted to apologize for last night.”
0,Eydis woke abruptly from her trance because of the angry voice of a girl.
0,Eydis quickly corrected her assumption.
0,"It was a woman, not a young girl, though she was quite short."
0,The woman had shoulder-length brown hair with a mild wave that made the ends curl out in random directions.
0,Her face was round but well enough proportioned to accentuate her doll-like cheeks and subtle jawline that would have made Eydis immediately think of young nobility if not for her crass tone of speech.
0,She walked beside another much taller man with hair colored a slightly darker shade of brown.
0,He talked back to her in a stern tone while rubbing the stubble on his chin.
0,"Upon closer inspection, they were not walking together."
0,"When he jumped ahead a pace, she briskly stepped further ahead."
