0,"Collision of Worlds 
Invasion
Part 1
By Michael DeBuse"
0,What do Gods fear?
0,"An unexpected force appeared, a creation of one not divine,
An infestation of worlds."
0,"Some vanquished the plague, but many worlds fell."
0,"Only one world endured and remained infected, Whinhlem."
0,A proposition came from the God of Whinhlem.
0,Interference between worlds was banned.
0,"No God shall harm another God, nor their world."
0,"All agreed, so that none could repeat the disaster."
0,"A law of isolation was passed, a dire punishment affixed,
For a taboo that should never be broken."
0,What caused the Gods such fear?
0,The Lurr.
0,"Chapter 1
“The more complicated the formula, the more unexpected the results.”
Emer"
1,Dim orange light illuminated a cluttered desk covered in wrinkled and torn parchment and intricate brass measuring instruments.
0,"Faintly glowing, polychromatic gemstones showered specks of color on two pocket watches whose times were ever so slightly off from each other."
0,"The only sounds in the room were the scratching of a quill and the low mumbling of the room’s owner, Emer."
0,"Tearing another sheet of vellum in half and tossing it to the side, he exhaled his frustration."
0,"The amount of wasted vellum on the floor was enough to make even the least frugal onlooker angry, especially his personal maid, Dyas, who would have to clean it in the morning."
0,She had already given him a few choice words with a weary yet understanding smile as she delivered a small cup of tea before retiring for the evening.
0,"After pecking him lightly on the cheek, of course."
0,"Emer was used to her flirtatious nature, so he was not startled by the sudden sign of affection, unfitting for a maid."
0,"If anything, she made the cold, gray-marble room feel a bit warmer."
0,"The other palace servants saw Dyas as a necessary contrast to Emer’s habitual pessimism, something she claimed she would remedy one day."
0,"Emer retrieved a large, corked vial from the bottom drawer of his desk."
0,He unstopped the hole and poured the black liquid into the small inkwell that had run low.
0,This was his second refill of the night.
0,"“I am a scholar, not an instructor,” Emer mumbled to himself as he returned the vial to the drawer."
0,"He felt a tightness in his temples each time he looked at a new blank page, gripping ever heavier as the evening drew late."
0,Emer leaned back in his wooden chair intricately carved from the trunk of a tree and took a sip of the sour tea.
0,The herbs used in the brew were a special arrangement created by Dyas to help keep him awake and focused while he worked.
0,Having an apothecary’s daughter for a maid came with simple benefits like this.
0,He looked up at the extravagant etched-glass windows behind his desk as he exhaled his self-doubt with the warmth of the tea.
0,"The etchings depicted the movement of the stars, moons, and planets."
0,"Another exhale passed his thin lips, this time to release his feelings of inadequacy."
0,"The windows were a creation of his superior and former master, Evhial, a High Elf and gravity specialist who served as the court magician for Emperor Yuro Amel until her abrupt passing two years ago."
0,Years on Whinhlem were already long—long enough for an infant to reach adulthood after only experiencing three summers—but those years felt even longer in Evhial’s absence.
0,Every thought of Emer’s superior was another reminder of just how superior she was to him in every conceivable way.
0,"Evhial built the windows as a replacement for the sky that would have otherwise been visible if not for the poorly placed and grandiose bastion obstructing any and all view from her office, now his office."
0,"So long as he periodically recharged the etched glass with raw ven, the natural energy that fueled magic, the etchings would react directly to the minute shifts in the unique gravitational pulls of each heavenly body, tracking and following them as they moved across the sky with utmost precision."
0,It was a complex magical technology that had never existed before Evhial’s time.
0,Superior…
0,Emer observed the etchings on the glass hoping that somehow the brilliance of his late master would inspire a similar brilliance in him.
0,"He often doubted himself, and there were many who shared in those doubts due to his lineage and inexperience."
0,"He recalled when he received candidacy for the position of court magician, the highest magical position in the Amelian Empire."
0,"When his appointment came to council discussion after Evhial’s death, he was not able to raise his voice in defense against the dissenting opinions speaking of tradition and pure heritage, let alone he being sixteen years of age, well into adulthood but still far too young for anyone to see him as experienced in magic, or at least experienced enough to hold such an esteemed position."
0,"Plus, the position of court magician had traditionally been held only by High Elves."
0,"Emer was High Elf in appearance, but only half by blood."
0,He was much shorter.
0,His father was a fairy.
0,"Fairies tended to have a strong affinity to only a single element, which would have eliminated his chance of being court magician, a position that required at least an affinity to the four basic elements and one rare element."
0,"The fortune of his birth gave him the affinities of both his mother and father which when combined totaled not only the four basic elements of water, earth, fire, and wind, but also the rare affinities of spatial and life magic, life magic being a common affinity for High Elves."
0,"His sudden call to candidacy, the only candidate, came as a surprise."
0,"Candidates were always selected after years of investigation and assessment, but Emperor Yuro ordered the selection be made immediately after Evhial’s death."
0,His reason?
0,"He did not want to delay the magic education of First Princess Eydis FeAmel, a task given to none other than the court magician."
0,Emer recalled the unspoken urgency hidden behind his emperor’s eyes.
0,"Emperor Yuro’s reasoning felt shallow to the royal council, and many demanded the call be postponed for another four years at the least until a more suitable body of candidates could be cultivated."
0,“Appoint him.”
0,A crisp but young voice echoed across the hall of Emer’s memory.
0,"Eydis FeAmel, who would eventually become the empress of the Amelian Empire, then only an adolescent of two and a half years old but far enough in her education to sit in council, silenced the dissenters."
0,Emer’s appointment was ratified by only a slight margin.
0,"Slight, but slight was enough."
0,"He would spend his life serving her, so her blessing was all the convincing that the council needed."
0,"Shortly after his appointment was ratified, Emer learned that the first princess had an affinity to spatial magic, his specialization."
0,"Evhial had made the discovery shortly before her passing during a clandestine trip on the princess’s order to visit Evhial’s associate, a trow geneticist, on some matter of secrecy."
0,"Princess Eydis’s spatial affinity had been kept secret from the council, including that it was Emperor Yuro himself who had given Emer the candidacy while rejecting all others."
0,"Even now, the number of people who knew was few."
0,"In Emer’s opinion, such a discovery should be celebrated."
0,Spatial magic was a rare affinity.
0,"Much of Emer’s time over the following two years until this evening was devoted to teaching Eydis, more out of gratitude for her support in his appointment than any obligation of his position."
0,Eydis was a bright youth whose intelligence shone even more brilliantly as she grew to adulthood over those two years.
0,She had mastered both wind and life magic under Evhial.
0,"She finished her academics in one year, half the expected time."
0,"All the while, she was forced by Emperor Yuro to train with the palace guards until her martial instructor, Symra, demanded that the grueling conditioning end."
0,"No longer required to train with the soldiers, Eydis spent her meager free time learning every language and dialect of the empire, numbering over one hundred in total, solely out of boredom."
0,Now she was learning spatial magic faster than Emer could create lessons for her.
0,The lesson he gave her earlier that morning was insufficient.
0,"Although she did not voice a complaint, her face spoke volumes."
0,Boredom.
0,Her thoughts were elsewhere.
0,His lessons were not challenging enough for her.
0,The first few lessons caused Eydis to bubble with joy.
0,Her face radiated in cheery youthful beauty with each new discovery.
0,She would grab him by his hands and plead for him to teach her more.
0,Emer tore another sheet of vellum and tossed it to the floor; another lesson plan Emer felt was inadequate.
0,"She was the first person who ever made Emer feel adequate, and he chased that fleeting feeling every day."
0,That was why he struggled so.
0,"So long as he had something to teach her, he could spend time with her."
0,"So long as she found him useful, he could support her."
0,"Everything that Emer was, he wanted to give to Eydis FeAmel."
1,CRASH!
0,A pane of glass shattered in Emer’s mind and the recoil of ven numbed his body.
0,This feeling… 
0,Something or someone had forcefully broken the anti-teleportation barrier Emer set around the palace.
0,"Springing to his feet with enough force to knock his heavy chair prone, Emer readied a warm thermal energy in his hand."
0,"Feeding it two separate yet similar compositions of fire ven, his hand burst into two distinct flames."
0,"Once the two flames were formulated to alternate in intensities, Emer flipped the latch, opened the window, and launched the flare into the sky."
0,The combined flames pulsated between subdued yellow and vibrant orange: the signal that there was an intruder in the palace.
0,"Before the flare could reach the apex of its climb, another flare ascended pulsating red and purple."
0,“Protect the royal family.” 
0,This was an assassination.
0,The red and purple flare was only used when danger directly targeting Emperor Yuro or his family was discovered.
0,There was a high likelihood that someone in the palace had already died.
0,The door to Emer’s office burst open.
0,"“Hostile intruder,” the guard yelled."
0,“Go to the emperor!”
0,Spatial magic was a purely defensive and powerful support element.
0,"From barriers to escape, the school of magic was vital to the protection of the royal family, and those within the palace who were charged with providing this protection were the Namie, an order of spatial magic specialists."
0,Emer’s position as the court magician and being a spatial magic expert made him not only a Namie but also their leader and magic instructor.
0,His role was to head directly to the emperor and evacuate him at the first sign of threat.
0,Emer recalled at lightning speed his memorized teleportation formula targeting the Emperor’s personal chambers.
0,He thrust his fingers into the air in front of him.
0,"The tips vanished, or more accurately penetrated the space in front of him, leaving translucent cracks from where his fingers disappeared."
0,"He pulled his hand to the side, tearing the space away in front of him, and threw himself into the rift-like portal cracking vertically through the air."
1,He landed in an extravagant but dimly lit lounge.
0,A sword rested its edge against his throat but was promptly removed.
0,"“You’re too late,” the captain of the royal guard growled."
0,“Too late?” Emer repeated.
0,Only a few seconds had passed between the destruction of the barrier surrounding the palace and Emer’s arrival in the emperor’s chambers.
0,The captain’s teeth squeaked under grinding pressure that could crack them at any moment.
0,"The glare of the captain’s grey, bloodshot eyes drew Emer to attention, their intimidation worsening the worming tension Emer felt coiling in his stomach."
0,“We are dealing with a spatial mage.
0,There was no break-in.
0,He must have teleported directly here.”
0,"The captain ordered his men to rally the Namie and hasten to ensure the safety of the remaining two wives of the emperor, the first princess, and the two young princes."
1,He then pulled Emer by the arm through a long corridor towards the emperor’s bedchamber.
0,“No physical weapon could do this.
0,What do you make of it?”
0,On the bed rested the severed bodies of Emperor Yuro and his first and second wife braided together in what had been a passionate evening.
0,There was no spray of blood from the strike of any weapon.
0,What blood flowed from their bodies avoided a thin line running through the severed trio.
0,"Emer’s stomach knotted, not from the brutality of the scene but because he had failed in the most important task demanded of him by his position."
0,He reached for the space between the severed bodies and felt solid resistance although no obstruction was visible in the dark.
0,"Drawing ven into his hand, he made it resonate at a high frequency."
0,Touching the invisible object again weakened and dissipated it.
0,“A barrier?
0,Impossible.” 
0,Barriers made from spatial magic prevented passage or entry.
0,"They could move and push and potentially bludgeon if the mage was skilled enough, but they could never hold a form sharp enough to cut."
0,"Even if placed through someone, the barrier would only hold them bound."
0,Emer had never heard of such magic.
0,"Cold sweat ran down past Emer's thin brow, stinging his eyes."
0,His heart raced and threatened to beat out of his chest.
0,Emer was the strongest spatial mage in the Amelian Empire.
0,"Once he became court magician, his first task was to replace the outdated encryption methods to strengthen the palace’s anti-teleportation barrier."
0,"It had taken him a large portion of his first year as court magician to complete, and the resulting barrier became multiple magnitudes harder to breach."
0,"Brute forcing the encryption would take centuries, yet someone had managed it in less than a year."
0,"Now having seen a barrier used as a weapon, there was no doubt in Emer’s mind."
0,This mage had a mastery of spatial magic incomparably superior to his.
0,"Ignoring the captain’s questions about what weapon killed the emperor or how barriers were involved, Emer strung together another teleportation formula in his mind and tore open a portal to the first princess’s chambers."
0,He had to make sure she was safe.
0,He had to protect her.
0,"Instead of the portal creating a direct window to the location, the destination clouded over."
0,"Emer tried to enter the rift, but it forced him back."
0,The first princess’s bedchamber was surrounded by a teleportation barrier.
0,The signature of the ven was different than what he would recognize as hers.
0,Emer placed his hand on the rift to read the flow of the foreign ven for clues about the barrier’s nature.
0,"Constructing a strong teleportation barrier took a long time, so one created in seconds should be weak."
0,At least he hoped it would be weak.
0,Superior.
0,The haunting thought would not leave his mind.
0,"Sure enough, the encryption was one Emer could decrypt in a minute at most, but it was not one an average Namie could break easily."
0,Emer was the only one who could reach her.
0,"“Princess Eydis is in trouble,” he told the captain."
0,“Guards should be there.”
0,“They will not be able to enter.” 
0,"Working the decryption in his mind, Emer forced spatial ven of the correct intensity and frequency pattern to disrupt the barrier."
0,"The barrier was too complex to remove, but he only needed to weaken it enough to allow passage."
0,"Even so, it would still take time."
0,He could only pray for Eydis’s safety as he worked.
0,What madness would drive someone to directly target the Amelian royal family?
0,"They were personally favored by the titan Bydrofe, the Guardian of Whinhlem."
0,"Emperor Yuro had yet to present his heir to Bydrofe--traditionally done when the heir reached three years of age, becoming an adult, wherein Bydrofe would impart his wisdom and a blessing--but a delay in the first princess’s presentation would not remove his favor."
0,To attack the royal line was the same as making an enemy of the greatest entity on Whinhlem.
1,"As the barrier waned, the struggle on the other side grew visible."
0,The first princess’s room crumbled as near-invisible planar projectiles struck the white-marble walls and exquisite wooden furniture.
0,"They cut through with no resistance and sent broken shrapnel falling to the white, wool-carpeted floor."
0,"Not a single piece of furniture remained undamaged, and the outward-facing wall had already fallen revealing the cold night sky."
0,At the center of the destruction stood First Princess Eydis FeAmel.
0,"She wore only her night skirt, now tattered from her frantic defense against an assailant not visible from the portal’s angle."
0,"Heavy bruising coated her torso, arms, and legs."
0,A cloudy film was amassed on her arms and legs and blurred the details of her body.
0,The princess understood the nature of her assailant’s attacks and coated her body in spatial magic vibrating at high frequencies.
0,"She punched and kicked the planar projectiles that she could not avoid, the perfect combination of Emer’s spatial magic instruction and Symra’s martial training in full display."
0,"The barriers her unseen assailant flung at her weakened from contact with her vibrating spatial defenses, but her magic only removed the edge."
0,"The impact still had a visible effect, knocking her back and adding to her countless welts and bruises."
0,"Emer felt great pride in his pupil’s ingenuity and insight, but if he did not hurry, she would not last."
0,The princess was on defense doing all she could to keep herself from being cut.
0,"Having seen the effect these barrier weapons had on the emperor and now the stone walls cut through effortlessly, Emer knew only one would be enough to end her life."
1,“That should be enough.” 
0,The captain drew his sword with Emer’s consent and charged into the rift.
0,Emer followed behind.
0,The sensation of passing through the weakened barrier was akin to trudging through thick mud that clung to his robe as if trying to hold him back when he exited the portal into the princess’s chambers.
0,A human dressed in a simple brown robe tied with a thin black sash stood in the air.
0,"He looked more like a monk or scholar than an assassin, but having already seen the effects of this assassin’s magic, Emer knew he was a master of his craft."
0,The captain charged the assassin while Emer ran for the princess.
0,"Surprised by their sudden appearance, that someone had infiltrated his barrier so quickly, the assassin’s barrage ended."
0,The princess quickly utilized the small moment of opportunity to release a wind spear at the intruder with a swing of her arm.
0,Emer felt the distinct sensation of spatial magic use just before the wind spear hit.
0,It dissipated before reaching its target.
0,The assassin set up a defensive barrier around himself.
0,"Even with his help, Emer knew they would be unable to fight the assassin."
0,He lacked confidence that he could penetrate any defensive barrier created by this human.
0,"“Princess, this way!” "
0,Emer grabbed the princess’s arm and ran towards the collapsed wall.
0,The captain stood between them and their attacker to delay the assassin as much as was possible.
0,"With a swipe of the attacker’s hand, a barrier cut through the captain’s sword and severed him in half diagonally from shoulder to hip."
0,It continued towards Emer and the princess unobstructed.
0,Emer pulled the princess through the rubble and out her bedchamber into a freefall.
0,"Quickly formulating a simple, short-distance teleportation formula, Emer tore open the air below them."
1,They landed hard on the lightly domed roof of the Temple of the Gods across the east courtyard from the princess’s chambers.
0,"The princess rubbed her side and shoulder, aching terribly from the hard impact on her many bruises, but her attention quickly drew away from her own injuries."
0,“Your arm!”
0,“Ignore it.” 
0,Crimson ran in a constant stream from what had been Emer’s left arm.
0,He gripped the bloody stub with his hand just above where his elbow once attached and forced life magic into it.
0,"The veins fused closed, stopping the deep red fountain, and the searing pain numbed until it became bearable."
0,The brief seconds of rapid blood loss made his head light and his body cold.
0,He blinked a few times to fight past the pain but noticed the princess shivering in the cold winter air.
0,He removed his robe and placed it on the princess’s shoulders.
0,"Eydis was a whole head and a half taller than Emer, so the robe was not long enough to reach any further than her knees, about the length of her shimmering brown, silken night skirt, but it would provide some warmth."
0,“We must seek time for me to prepare the long-distance teleportation for your escape.”
0,"The emergency escape teleportation formula was deliberately overcomplicated to prevent others from following the ven trace left behind by the portal, and he needed time to ensure whether his memory of the complicated formula, recalled while fighting back the haunting ache of his missing arm and the onset of shock, had any errors."
0,Mistakes in teleportation could be fatal.
0,"While Emer recalled the formula, a portal opened behind them, and the assassin appeared."
0,"Instead of casting the escape spell as he recalled it, he formulated another quick, short-distance teleportation and pulled the princess through before their assailant could attack."
1,"After landing on the grounds on the opposite side of the temple annex, Emer grasped her wrist."
0,They bolted into a sprint over the tightly cobbled path as fast as their legs could carry them.
0,Emer had no destination in mind.
0,He only needed a short window of time.
0,The palace guards who saw them ran to catch up and aid in the princess’s protection.
0,"Emer once again began checking over the escape formula and already found one mistake that he promptly remedied, but he made little further progress when another portal opened in front of them."
0,“Slow him down!” Emer shouted to the guards.
0,"He stomped his heel into the ground, and a wall of rock and earth shot up between him and the portal to stall their pursuer, if stalling was even possible against such a mage."
1,He then created another short-distance teleportation formula and pulled the princess through to the central courtyard of the palace.
0,Eydis shrieked.
0,"Her younger twin brothers lay severed in half in their own gore, murdered while still in the prime of their childhood."
0,"Eydis’s hardened expression from her martial training vanished, replaced by creeping fear."
0,"She had never witnessed the death of a loved family member, especially a death so violent."
0,"As hard as her conditioning under Symra was, little could prepare her for such a sight."
0,Emer chastised himself internally for his lack of forethought.
0,"The twin princes always dueled in the courtyard in the evening, and there would certainly have been a chance that the assassin would notice them."
0,"They may have been the first to die, being out in the open."
0,The emergency flare that was launched shortly after his came from the direction of this courtyard.
0,Numerous guards and servants observed the bodies while medical staff futilely investigated them.
0,"Nothing could be done for the dead in such a state, even with life magic."
0,Emer continued checking over his escape formula and almost finished before a portal opened right where they had exited.
0,"The assassin appeared to the astonishment and screams of those in the courtyard, so Emer pulled the princess through another portal."
1,They exited inside the palace’s great hall.
0,Emer pulled Eydis in the direction of one of the many entryways lining its breadth.
0,"Once again, the stationed guards joined them in their flight."
0,The patter of bare feet and clacking of hardened boots echoed over the carved marbled walls where the deep redwood accents did little to dampen the sound.
0,"Emer now knew he could no longer use his escape formula, not as he had memorized it."
0,"“He said I brought this upon myself… that I was the last one,” Princess Eydis said in shock."
0,“My brothers… Are… You are supposed to evacuate my father.
0,How is my father?
0,My mother?”
0,The swiftness and lethality of the offensive barrier magic meant there was a high chance that the assassin could have finished off the remaining wives of the emperor in the time it took for Emer to investigate the emperor’s corpse.
0,"“Your father and his first two wives, your mother… are dead."
0,"If that is what he said, we can trust the others are as well.”"
0,Color slowly drained from Eydis’s face.
0,“What about Ceil?
0,Her marriage to my father has not been made public.
0,He could not have known about her.”
0,Emer did not know.
0,Ceil’s maid was a Namie.
0,"She was the only member of the royal family ordered to have a Namie in her presence at all times, so perhaps she alone escaped."
0,"Just as they exited the hall, a portal appeared, and the assassin saw the direction of their flight."
1,"Emer pulled the princess through another quickly formed portal, leaving the guards of the hall to sacrifice themselves as the others likely had."
0,Emer’s fears were correct.
