0,"Collision of Worlds 
Invasion
Part 1
By Michael DeBuse"
0,"Either way, if Eydis wanted any peace, she had to eliminate the smell and silence the creature."
0,Eydis removed the blankets and turned to place her feet on the cold woolen carpet.
0,"After stretching her arms behind her back and breathing a great yawn, she retrieved the cup with one hand covering her nose."
0,"The closer she got to the crate, the louder the creature became."
0,"When she slowly poured the blood into the funnel on the corner, the noises of the creature ceased."
0,All that could be heard was the lapping of a small tongue that had not been there previously.
0,"Over the next few days, the high-pitched yips became deep barks and howls."
0,"To Eydis’s keen ears, it sounded no different than the hounds that she used to hear around the palace."
0,The creature stopped crying for the blood that Eydis gave it each morning and instead waited patiently.
0,Her days of seclusion in her room would have been peaceful if not for the howling at night that prevented any deep sleep.
1,"On the fifteenth day, the smell of the blood changed."
0,It assaulted her nose with a rotten odor that jolted her awake before the sun had the chance.
0,"Eydis rushed out of bed, grabbed the cup, and poured its contents into the crate, but try as she might, Eydis could not rid her sinuses of the smell of rotten food and spoiled milk that squeezed tears from the corners of her eyes."
0,"She was grateful the cup disappeared as soon as she returned it to the bedside table, but the smell still lingered in her sinuses for most of the morning."
0,"For the next four days, Eydis was woken by the rotten odor."
0,"The hound-like howls ceased, and the barks grew high in pitch back to the yips they once were and then closer to a squeal."
0,The silencing of the howls did not improve Eydis’s sleep.
0,The creature slept during the day and was awake and scratching at the walls of the crate each night.
0,The effects of Eydis’s lack of sleep over the past fifteen days began to show.
0,"Try as she might, she could not get her body to change its sleep schedule and let her sleep during the day."
0,Hours were spent lying in bed staring up at the canopy.
0,"She used simple life magic to keep the shadows under her eyes from showing and to keep her skin on her face from sagging, but with each day she grew more and more tired, more and more frustrated."
0,Why has Jethro not appeared?
0,What am I to learn from raising this thing in a metal box?
0,How long am I to continue this?
0,"Eydis grabbed a piece of parchment from the desk in the corner of the room, wrote her questions, and placed it on the table."
0,"The parchment disappeared immediately, seemingly falling through the polished wood into the table, and was replaced with a reply appearing in a flash of light like a spark."
0,“We are entering the final stages.
0,Only a few more days.”
0,Eydis tore the tough parchment in her hand and let it drift to the floor.
0,"She was too tired to be angry, too tired to think."
0,"She spent the rest of the day in a daze, letting her mind draw her into whatever action took its fancy, which only amounted to pacing around the room, playing with her tail, or lying in bed."
1,The next day the blood changed once again.
0,This time the smell was benign compared to the other two but still unsettling.
0,Eydis breathed a sigh of relief and prayed that this time the creature would become more tolerable.
0,"She was unsure, but the actions of the creature seemed to change with the blood she gave it, and because the blood was not pungent, perhaps the creature would mellow out."
0,Eydis’s dazed mind found herself staring at the blood in the cup as she carried it over.
0,She wondered what it came from.
0,"The smell of iron still hung thick in her nose, but at the same time, she was not averse to it."
0,"Compared to the moldy scent of the first and the rotten odor of the second, the blood in the cup smelled of herbs."
0,"When she brought it over to the crate, she found herself hesitating to pour it in."
0,She stared at it with blank eyes as red slowly filled her vision.
0,A sudden clang from inside the crate returned Eydis to her senses.
0,She realized what she was doing.
0,"In fear, she quickly dumped it into the funnel, nearly spilling it over the edges."
0,Something was wrong with her.
0,She did not want to give it to the creature.
0,She wanted it instead.
0,This alien thought combined with her lack of sleep dropped Eydis to her knees.
0,Her ears could hear the creature drink the blood inside the crate.
0,The sound was deafening.
0,"She covered her ears quickly with twitching, anxious fingers, but her mind could still hear the sound."
0,She screamed out.
0,“What is wrong with me!?”
0,"Eydis ran to the desk and pulled out the drawer containing the parchment, snapping off the handle in her haste."
0,She penned out a complaint of the torturous treatment she had been receiving and demanded it to end.
0,"When she placed her message on the table, the only reply she received was, “Keep feeding it.”"
0,This was an order.
0,This had to be some long-term torture Jethro devised to break her mentally.
0,The Amelian Empire lost the war.
0,It was no more.
0,"She was the sole survivor of the royal family, and she was in the hands of the enemy’s general."
0,Was he toying with her for his amusement?
0,For what purpose was she being subjected to this torture?
0,What was so important that she had to suffer this in order to learn?
0,Was it only to show his dominance over her?
0,Was it because of her defiance during their former daily meetings?
0,"If that was his purpose, Eydis refused to give in."
0,She would not become Jethro’s broken pet.
1,"In protest, the next morning Eydis did not feed the creature."
0,She left the cup on the table and sat in the furthest corner from both the crate and the cup of blood.
0,The aroma of the blood attacked her senses.
0,"She found it unpleasant, but her heart still raced."
0,"She bit the inside of her cheek until it bled to keep her mind off the smell, masking it in the taste of her own blood."
0,"When steam no longer rose from the cup, it was replaced by another fresh cup."
0,"After the cup was replaced for the third time, the unfed creature began to whimper, but the sound was unlike any noise the creature had previously made."
0,The cries had tonal changes to them and were more babble than the shrill cries of the past days.
0,They were otherworldly and only grew in intensity as time went by.
0,Eydis cried in her corner but did not want to give in.
0,"The longer she held off feeding the creature, the louder it became."
0,I will not give in.
0,I will not!
0,A shrill screech from the creature sent chills through her body.
0,She ran and jumped completely over her large bed to the table.
0,"Cup in hand, she cleared the long distance from her bed to the crate in only three strides, spilling drops of blood onto the pristine white carpet."
0,"Once the blood was poured into the crate, the horrid sounding cries ceased and were replaced by the wet slurping of the creature drinking its meal."
0,Eydis walked slowly back to the table.
0,"She watched the cup vanish as all the others had, but this time, the vanishing cup was agonizing rather than relieving."
0,She curled up against the side of her bed and cried.
0,She had given in.
0,"She didn’t want to, but she had succumbed to her own weakness."
0,She stayed in that position for the remainder of the day and through the night wondering what more Jethro would make her do now that he knew she would become obedient if pressured enough.
0,She held the tip of her tail at her side like a safety blanket and waited out the torturous night.
1,"The next morning before the cup appeared, Eydis heard mumbling from the crate."
0,It was high pitched and mixed with coughs and snarls.
0,"When the sun peaked over the purple horizon, the cup appeared, and immediately the creature screamed."
0,"It thrashed inside the crate, and from the sound, there was little room for the creature to move."
0,This further infuriated it.
0,"With a deep breath and another shrill cry, a bulge grew on the crate from an impact within."
0,Eydis rushed the cup over to the crate and poured in the blood.
0,She no longer had the will to resist Jethro’s demands.
0,She would feed the creature as ordered.
0,"The cries ceased, but the creature continued hitting the walls of the crate, although without the same force or ferocity."
0,"To prevent a repeat of the previous day’s drama, Eydis waited at the table for the appearance of the cup."
0,"The moment it appeared, Eydis rushed it to the crate and poured it in."
0,"The cries stopped and the room fell silent, but later that day the creature began speaking."
0,"It babbled nonsensical sounds, but they were distinctly sapient."
0,"As the incoherent speech continued, it grew angrier and angrier until the creature assaulted the walls of its small enclosure."
0,The next day the assault did not stop once the creature was fed.
0,The number of bulges in the crate grew.
0,Eydis did everything within her power to appease the creature.
0,She tried talking to it.
0,She tried singing to it.
0,But it was not enough.
0,It only grew angrier.
0,“What more do you want?!”
0,Eydis screamed.
0,The creature responded by hitting the very center of the side of the crate facing her.
0,"The bulge it created was far larger than any previous impact, buckling the seam in the center of both the top and bottom edge."
0,Eydis immediately went silent.
0,A second impact created a similarly large bulge on the top of the crate.
0,The former opening that had been welded shut grew a small crack.
0,Eydis held her breath.
0,"Much to her relief, the creature did not notice."
0,How long will the crate hold?
0,What happens if it breaks?
0,Only a monster of terrible power could bend and stretch metal with so little room for movement.
0,"Eydis huddled back in the furthest corner of the room and watched with wide, sleep-deprived eyes through the night."
0,She could not find the courage to blink for fear of something happening when her eyes closed.
0,"Her eyes burned from lack of moisture, but still she watched."
1,"By morning, the cries had not stopped nor had the internal attack on the crate."
0,"When the cup appeared, Eydis ran with all haste to give it to the creature, but when she reached the crate, the creature hit the corner with the funnel."
0,"The funnel snapped off, bouncing once on the white carpet."
0,The corner seam split open where the funnel attached.
0,This did not go unnoticed by the creature.
0,"It hit the same location again, and the tear in the seam grew."
0,"Fingers shot out the opening, long, slender, hairy fingers with knotted knuckles."
0,"Eydis dropped the cup, spilling the creature’s meal on the floor."
0,The smell from the inside of the crate was so foul it made Eydis gag.
0,She staggered back.
0,"The fingers spasmed and thrashed at the opening in the metal amidst shrill rambling cries, and the tear slowly grew."
0,Eydis ran panicked to the desk for the quill.
0,The parchment tore in her hand as she penned a plea for help so hard that the quill split and marred the polished finish of the desk.
0,"She placed it on the table, her eyes glued to the hand protruding from the metal."
0,"The message disappeared, but no reply came."
0,"Another strong impact, and the corner of the crate bent further."
0,A long slender arm with matted hair on the outer side extended through the opening.
0,The odor of the arm that swung wildly and clawed at the air stung her eyes and nose.
0,Eydis hid in the small gap between her bed and side table.
0,She could not control her shaking body and pulled a blanket off her bed for what meager cover or comfort--she was not sure which she wanted more--it might provide.
0,"In its swinging, the arm struck the wall behind the crate."
0,"The creature jammed its claws into the marble with impossible strength, chipping off part of the wall."
0,This created a hold that the creature used to pull up that side of the crate.
0,"With enough leverage, the crate tipped on its end, standing vertical."
0,A push off the wall sent the crate careening forward onto the ground.
0,The stain of blood on the carpet was now near the opening.
0,Eydis shrieked.
0,A face appeared in the opening.
0,It had clearly elven features but was hairy with fangs and a long tongue.
0,"Its tongue lashed out of the opening, but despite its length it could not reach the bloodstained carpet."
0,This infuriated the creature.
0,"The monster thrashed, clawed, and kicked at the opening amid shrill, angry cries."
0,"Slowly the opening widened, and the monster stuck its head out of the crate."
0,A matted mane ran from the top of its head down its neck.
0,"Its pointed ears sitting high on the sides of its head could belong to an elf, but there was something distinctly rodent about them."
0,The monster extended itself as far as possible out of the opening but was stopped by its shoulders.
0,Its long tongue could just barely touch the bloodstain.
0,"Instead of growing angry, the creature grabbed the opening with its hand and pushed."
0,Little by little the metal bent outwards.
0,Its arm and shoulder slid through.
0,"Grabbing the other side with its other hand, it bent the metal further."
0,Eydis could not speak.
0,She could not breathe.
0,Any action she took she feared would make the creature notice her.
0,The only sound was the rapid beating of her terrified heart.
0,"Tears grew in her eyes, and she even feared their fall would attract its attention."
0,Someone… please…
0,The monster bent the metal enough to pull its other arm and shoulder out.
0,"It shifted its body back and forth, sliding out the opening until it was free."
0,"There stood a man, naked and covered in patches of matted, light-brown fur on his back from his head to his long, slender tail."
0,"He had the gruesome appearance of an elf fused with a hound, but his hands, feet, and tail were like a rodent."
0,Fecal matter was smeared on his body.
0,"Not only did her eyes sting, but she could also taste it in the air."
0,"Free from his prison, the monster attacked the blood on the carpet with his teeth and tongue, sucking up what it could."
0,Eydis watched in fearful silence as the hair on his arms and legs lessened and the digits on his hands and feet shrunk slightly.
0,Light flashed beside Eydis.
0,The tears Eydis had been struggling to hold back fell at the sight of Jethro.
0,She pleaded in silence for him to save her.
0,"“He grew nice and big,” Jethro said, glancing down at Eydis, completely unfazed by Eydis’s distress and the smell in the room."
0,"Seeing that Jethro’s voice did not draw the monster’s attention, Eydis found the courage to speak."
0,“What… what is th-that thing?”
0,"“An Alukah, or as close as I could get to making one."
0,"Looks similar to a lycon, does it not?”"
0,“Did that w-w-worm… that th-thing… it turned in-into th-this?” Eydis’s jaw shook uncontrollably.
0,“The peculiar little creature is called a Lurr.
0,"I had you feed it blood from the hounds in the palace, a rodent of unusual size found in the northern highland swamps of the Tolmyur Kingdom, and some High Elves."
0,"Of course, I was also placing food in the crate."
0,It could not have gotten that big on blood alone.” Jethro chuckled.
0,"“Although, I was rather busy of late playing with the fairies, so I neglected to feed it over the past few days.”"
0,Eydis stared at Jethro in horror.
0,The anger the Alukah had exhibited was from starvation.
0,"She looked back at the monster that was licking the carpet but could no longer find any blood, or at least enough to satisfy it."
0,"It turned to Jethro and Eydis, now noticing their presence, and charged."
0,Eydis screamed and climbed over the bed as the Alukah dove at Jethro.
0,"Jethro waved his hand, and the beast was hurled back into the crate which buckled from the impact."
0,"Unfazed, the Alukah charged again."
0,"This time, the beast could not get close."
0,An invisible wall blocked its way.
0,The Alukah snarled and screamed in a futile attempt to claw away the barrier.
0,Jethro peered down at Eydis peaking from behind the far side of the bed.
0,“Your lesson starts now.”
0,The Alukah clawed at the barrier but quickly lost interest.
0,"Looking around, it spotted Eydis hiding behind the bed."
0,It found a new target and lunged.
0,"Eydis expected Jethro’s barrier to stop it, but the Alukah approached unhindered."
0,"It slid on the bed, got caught on a blanket, and rolled off on top of Eydis."
0,Eydis screamed and pushed the beast away.
0,She ran to the other side of the room and pleaded to Jethro.
0,“Do something!”
0,"The Alukah scrambled to right itself, but its erratic movements only served to further entangle it in the blanket."
0,"Jethro flashed a crooked, dimpled smile."
0,"“The palace hounds are highly aggressive, and it takes a lot of training to curb their violent tendencies."
0,Elves are highly intelligent.
0,The rodents… I simply used them to help attain the look I was hoping for.
0,"And to be honest, I did not want it to look too much like a lycon."
0,Personal reasons.
0,I hope you understand.”
0,Understand what?!
0,Eydis wanted to scream.
0,"With the sound of tearing, the beast reduced the blanket to scraps of fabric."
0,"“When Lurr evolve, more than just their appearance changes."
0,"They not only take on the natures of what they feed on, but those natures are also enhanced.”"
0,"Now free of the blanket, the Alukah ran towards Eydis."
0,"She tried to flee, but it caught her arms and pinned her on the ground."
0,"Its mouth watered, dripping saliva on her neck."
0,Jethro sat cross-legged on the bedside table and chuckled wryly.
0,“He looks hungry.”
0,Why is he doing this?
0,What would he gain?
0,Is this just crude entertainment for him?
0,Jethro’s statement when he first gave Eydis the creature came to mind like a wraith whispering in her ear.
0,“The real entertainment is yet to come.”
0,Eydis wrenched her right arm free and pushed against the Alukah’s face.
0,"In frustration, the Alukah glared at Eydis with its blood-red eyes and bit down on her wrist."
0,She channeled wind magic into her hand in the jaws of the beast and expelled it with all the force she could.
0,The blades of wind lacerated the side of the beast’s head.
0,It released its hold and staggered back.
0,"Now free, Eydis scrambled to her feet, her legs weak and shaking from fear."
0,Jethro chuckled.
0,“Realized now that you could fight?
0,Your flight instincts are far too strong.” 
0,"The Alukah wiped his hand down the side of his face, and the bleeding stopped."
0,"“Oh, and Lurr can instinctively use the magic of the species from which it feeds.” "
0,"“And life magic is common to High Elves,” Eydis mumbled."
0,She channeled life ven into her left hand and rubbed her wrist to stop the bleeding and kill any infection that might have come from the bite.
0,The Alukah charged with a snarl.
0,Eydis rushed to erect a makeshift barrier in front of her.
0,"The force of the Alukah’s impact into the barrier pushed Eydis, and she stumbled and fell to her back."
0,"The Alukah tried to pin her again, but Eydis had wind ven ready and thrust a wind spear through the beast’s side."
0,She then used a barrier to push the beast off her and scrambled back to her feet.
0,Eydis was breathing heavily.
0,She was exhausted from lack of sleep and could feel her ven levels running low.
0,"Again, the Alukah stopped the bleeding in its side."
0,"He stared at Eydis with bloodshot, red eyes and bellowed an earsplitting, almost elven scream."
0,He picked up the heavy wooden chair at the desk and hurled it with all his strength.
0,"Eydis barely managed to erect a barrier in time, and the one she created with the little ven she had was insufficient to stop the chair."
0,"The impact knocked Eydis back against the wall, but she was unharmed."
0,"Seeing the chair have no effect, the Alukah picked up the entire desk and hurled it next."
0,Eydis dove to the side and threw another wind spear at the beast.
0,The spear hit its mark but did no more than create a minor puncture in the Alukah’s stomach.
0,It lacked any force.
0,She was out of usable ven.
0,Eydis could not draw upon enough for another spell.
0,She had not trained to use ven below dangerous levels.
0,"Panic rose in Eydis’s chest, but the feeling was interrupted by a familiar, unpleasant metallic aroma."
0,In Jethro’s hand was another cup of blood.
0,"“If you want some ven back, feel free.”"
0,Eydis’s heart raced with a new sensation different than panic.
0,"Biting her cheek, she ignored the feeling and faced the Alukah."
0,The Alukah took notice of the cup but continued to focus on the larger prey.
0,It knew that Eydis could no longer cast any magic.
0,It charged.
0,"Eydis dodged to the side, but the beast was faster."
0,It swung its arm and hit Eydis in the stomach.
0,The impact threw her back against the far wall.
0,The marble cracked from the force.
0,Eydis retched air and blood as she fell to the ground.
0,"Very shaken with her lower ribs broken, she stood back on her feet."
0,"“That hit alone probably would have killed me instantly, let alone the impact on the wall.” Jethro poured himself a cup of the bitter brown tea."
0,“You are fairly resilient.
0,I am rather jealous.
0,Oh!
0,Did I mention that Lurr also have superior physical ability compared to the prey they feed on?
0,You probably do not want to get hit like that…”
0,"The Alukah ran at Eydis and kicked her back into the wall, splitting cracks across the wall’s full length."
0,“…again…” Jethro sighed.
0,The Alukah grabbed Eydis by the neck and lifted her.
0,He slammed her into the wall.
0,Small chunks of marble fell from the widening cracks.
0,The Alukah’s face twisted from the frustration that the wall was breaking faster than his prey.
0,"Eydis could not breathe, and in her shaken mind, she knew that she would not survive another impact or two."
0,She grabbed the beast’s arm with both hands and dug her fingers in as tight as she could.
0,Her fingers penetrated its skin and dug into flesh with relative ease.
0,Eydis gripped harder and twisted.
0,"With two cracks, the Alukah’s arm broke, releasing his grip on Eydis’s throat."
0,Eydis dropped to the ground and dove into the beast while screaming in anger.
0,They both tumbled backwards to the ground.
0,Eydis balled her fists and pummeled the Alukah’s face with a flurry of ill-formed punches.
0,"Her fingers grew rigid, and she scraped and clawed in frantic motions."
0,The Alukah grabbed Eydis by her hair and threw her off.
0,She landed on her back next to the large metal crate.
0,"The beast staggered to his feet, his jaw shattered and bent into itself."
0,Most of the flesh was missing from his face.
0,"He turned to Eydis to retaliate, but his gaze slowly rose above her."
0,She held the crate high by the torn opening in the corner.
0,"Screaming with all her might, she swung the crate down."
0,The impact flattened the Alukah to the ground.
0,"When the Alukah tried to stand, Eydis swung the crate down with all her strength."
0,She swung it down again and again.
0,Again.
0,Again.
0,Again.
0,Eydis continued until the sky outside the windows grew red from the sunset and she had no more strength to lift the heavy metal.
0,The flattened crate fell to the floor with a clang.
0,"She still held onto it with one hand, her fingers having gripped so tight that they bent the metal to match their form."
0,"She was panting and shaking, staring at the remains of the beast."
0,"In place of the monster was mangled, bloody gore."
0,No part of the splattered mound resembled the creature it once was.
0,"Coming to her senses, she remembered Jethro."
0,She found him sitting cross-legged on her bed enjoying his dinner of steak with wine.
0,"“GAAAAAHHHHH!” Anger welled, and Eydis charged."
0,But she did not reach him.
1,Eydis found herself looking up at the ceiling of a different room.
0,"Her chest burned, and she vomited blood."
0,"Around her, broken marble scattered from the remains of a wall."
0,“The control is much better than expected now.” Jethro examined the destroyed wall as he stepped through.
0,“I should reward Emer for explaining the trick to stabilize the force.
0,"If I had this when fighting the first princess, my job would have been finished that night.”"
0,Jethro stood over Eydis.
0,"His face expressed honest concern, which struck Eydis as odd given the harrowing experience he had just put her through."
0,“There is something I want you to see.” 
0,Jethro created a portal that opened to itself above Eydis.
0,"When she looked into it, she could see herself."
0,Eydis began to hyperventilate.
0,Tears ran down her face.
0,What she saw had to be a lie.
0,That was not her face.
0,Those were not her eyes.
0,The watery eyes that looked back at her no longer resembled a polished blue-green sapphire.
0,"They glowed a deep blood-red, the same blood-red she had seen in that monster."
0,"“So, what did we learn from this lesson?"
0,Take your time.”
0,"In a raspy, winded voice that bubbled from the blood in her lungs, Eydis mustered a few words."
0,“Am I… What am I?”
0,“You certainly are not a High Elf.”
0,Truth.
0,Eydis’s eyes slowly returned to their natural color as she watched her reflection.
