0,"Collision of Worlds 
Invasion
Part 1
By Michael DeBuse"
0,The best she could do for them was to take him away.
0,"“Seriously, though."
0,"English is one of the hardest languages of our world to learn, and you mastered it in a couple weeks.” Austin continued speaking jovially without a care towards the mournful faces of the women."
0,“Then I will tell Jethro we are ready to leave for your world.”
0,Eydis stood from her chair and walked to the large double doors.
0,"While waiting for the guards to open them, she glanced back at the small fairy being fondled in Austin’s lap while the fairy futilely attempted to serve him his ale."
0,The man laughed at the sounds and expressions he could force out of the poor woman.
0,"“Humans are repulsive, all of them.”"
1,"* * *
The next day."
0,Jethro called Eydis and Austin to the grand council chamber where he met them sitting casually atop the arm of the emperor’s throne.
0,"Two humans, a dwarf, and a giant stood beside him."
0,They dressed in warm clothes similar in make to Austin’s aside from the giant who wore a large cloak of crude Tolmyurin fabric.
0,"In the otherworld city where only general humans lived, finding clothing that could fit one of his stature would be impossible."
0,Jethro prepared this special task force to both assist and monitor Eydis.
0,She knew the dwarf was a magician that had mastered his single affinity.
0,One if not both humans could likely use magic.
0,"The giant, taller and larger built than any of the giants Eydis had seen in the palace, was probably weaker than her in strength, but due to his military training that Eydis lacked, she did not doubt he could overpower her and pin her down if she was weakened."
0,The dark eyes of the giant followed Eydis as she approached but wandered to the head poking out from behind her.
0,Eydis brought Rynn against Jethro’s orders.
0,Jethro scratched under his ear and shook his head lightly.
0,“I reluctantly caved to your request to allow our valuable English instructor to accompany you.
0,I cannot permit another.
0,This is no vacation.
0,I am sure you understand that.
0,I can give my word that the girl will not be harmed while you are away.”
0,"Eydis expected resistance, so she planned what she felt was a justifiable excuse."
0,“I need someone to replenish my ven and I refuse to use Austin or your men.
0,And I cannot believe Rynn will be safe until I return.
0,"You may give your word, but did you not tell me your men are disobedient?"
0,There is nothing you can say on this matter that I can trust.”
0,"“Watch your tongue,” the dwarf reprimanded calmly while the two humans drew their swords in anger."
0,The giant was unfazed by Eydis’s defiance and kept staring at Rynn.
0,"“Fine, fine,” Jethro sighed."
0,"After calming his angered men with an unamused wave of his hand, he opened a strange black portal."
0,"He felt no need to argue against Eydis’s reasoning, much to her relief."
0,The dwarf entered the portal first followed by the massive giant who had to duck and carefully shift his way in to not touch the edges of the portal.
0,"Austin moved to line up for the portal, but as he passed, Eydis caught a faint whiff."
0,"She grabbed his arm, pulled him back, and retrieved the sachet of deshalu from his pocket."
0,“Are you mad?” she reprimanded.
0,“What if the princess smells an herb from her world?” Eydis tore the sachet and dumped the dried grass with bubbled growths onto the floor.
0,Jethro glared.
0,He had also prohibited the herb.
0,Austin could say nothing in his defense.
0,He silently entered the portal behind the taskforce.
0,"Eydis looked into the deep void that failed to show the destination, and it filled her with trepidation."
0,"“Thank you for noticing the deshalu,” Jethro said once everyone else had left."
0,“Lurr senses are better than ours.
0,"If Austin happened to find the princess first, that would have been an immense risk.” "
0,Eydis did not move.
0,"She stared at the portal and tried to understand its construction, why the destination was not visible."
0,"The destination of every portal was visible, or should be."
0,This portal was aberrant.
0,It was unnatural.
0,Something was horribly wrong about it.
0,“The portal is not dangerous despite appearances.” he assured after a pause.
0,"“Don’t let a meager portal ruin your conviction,” he said with a dimpled smirk."
0,Eydis doubted Jethro would let her investigate the trace to get a better understanding of the formula.
0,She tightened her grip on Rynn’s hand and pulled her through the void.
1,"The portal felt like trying to step through a thin membrane that once penetrated, became a cold and viscous fluid."
0,"It pushed back against her like a current, but at the same time it pulled her through by some unknown force."
0,The sensation churned her stomach.
0,The other side of the portal was no better than the traumatizing passage through it.
0,The air of the small residence was cold and thin like the top of an exceedingly high mountain.
0,She found breathing painful and grew dizzy.
0,She had to wonder how the princess was able to survive in such a place.
0,Rynn also felt the effects of the atmosphere and held her head.
0,"The petite girl’s legs grew weak, so Eydis quickly lifted her."
0,"A simple wooden chair with a glossy polish sat next to a dark, hardwood table."
0,"She sat Rynn down in the chair to let the dizziness pass, if it would."
0,"Eydis worried that it would linger indefinitely, and they would be forced to grow accustomed to it."
0,Strange objects Eydis had never seen before filled the room around her.
0,The wash basin and what she assumed was a range suggested that the room was meant for preparing and eating meals.
0,"The make and quality of the appliances was exquisite, despite the obvious wear of time."
0,She walked to the counter and prodded an appliance with a large metal bowl and whisk.
0,"It had to be for mixing ingredients, but there was no way to use the whisk."
0,It was attached at the top to the strange appliance.
0,"As she groped around the object out of curiosity, her hand bumped something, and the whisk immediately spun at an incredible speed."
0,She yelped in surprise and panicked to find a way to stop it.
0,The dwarf pushed a set of clothes into Eydis’s arms and deactivated the machine.
0,"“Change,” the dwarf ordered in Elven."
0,“You will draw attention in that dress.”
0,Eydis looked around.
0,"Certainly, they could not expect her to change here."
0,"While wondering how she would manage to change clothes in front of all these men, a stubby dwarf hand pushed her towards a hallway."
0,“There is a room down the hall.
0,I will guarantee your privacy.
0,Return when you are finished.
0,We have much to discuss.”
1,Eydis carried Rynn with her to the hall but took a moment to glance back at the machine that had spun the whisk on its own.
0,They said this world had no magic.
0,"The room at the end of the hallway was adorned simply with a bed, side table with a lamp, a dresser, and a vanity stand with a perfectly reflective oval mirror."
0,"The small size of the room made it feel awfully cramped, at least compared to the large rooms of the palace."
0,"Like the dining room before, everything inside bore the weathering of age and poor maintenance but remained of incredibly fine quality."
0,The former resident was either an elderly human of this world or had inherited the furniture.
0,Eydis asked Rynn to sit on the bed while she dressed.
0,Rynn found it just as soft if not softer than the bed they had in the palace.
0,She pressed her hands into the pillowed fabric and bounced lightly a few times.
0,"Even though the girl showed no emotion, Eydis knew she was surprised."
0,"“I wonder if all humans of this world live in such luxury or if the owner saved enough to afford such luxuries,” Eydis thought aloud to Rynn, hoping to elicit some emotive response, but as usual the girl neither answered nor showed any outward emotion."
0,Eydis sat the clothes on the bed next to Rynn.
0,"After removing her sandals, she unfastened the back ties of her dress and sash about her waist to let the dress fall to her ankles."
0,"The Dwarf provided her with a pair of blue pants similar in fabric to those worn by Austin, a simple white shirt, and a thick brown coat that was torn in a few places."
0,"Upon closer inspection, there were small, thin slits in the back."
0,The coat formally belonged to someone Jethro’s men had killed from behind.
0,"After inspecting the pants and finding they lacked similar markings, Eydis realized that her underskirt would not pair with the pants, so she removed it as well."
0,"The room was not heated, so she shivered lightly while she dressed."
0,"The blue pants hung loose on her waist, rubbing against her tail whenever she moved."
0,"The sensation was unpleasant, but there were no ties on the waistband of the pants, leaving a single button as the sole fastener."
0,Eydis had to question the design of only having one button and leaving no means to loosen or tighten the waist.
0,There was also a large hole below the button that exposed her if she was careless in how she moved or walked.
0,Wouldn’t such a method of fastening be better suited on the back or side instead of the front?
0,Eydis felt inside the hole for any means to seal it and noticed fine metal teeth.
0,She ran her fingers up and down and located a small tab on the bottom where the teeth joined.
0,"While fiddling with the tab, the teeth clamped together when it rose."
0,"Fascinated by the fine craftsmanship, Eydis repeated the motion over and over, feeling the teeth enter the tab separate but leave the tab conjoined."
0,It was incredible technology that felt just as much like magic as the whisk in the kitchen but was used on something so small and seemingly insignificant.
0,"Ties would accomplish the same task, but instead this world used a magic tab on simple clothing."
0,"The pants still hung loose and low on her hips, but there was little she could do."
0,She would have to endure the rubbing on her tail.
0,"The white shirt was also loose, and the coat was made for someone much wider than her, but at least the sleeves were long enough."
1,"Now dressed, Eydis returned to the dining room, leaving Rynn in the bedroom."
0,“What’s the plan?” Austin’s eyes scrutinized Eydis’s baggy apparel.
0,“Do as I say.
0,That is all.” 
0,Eydis ignored his gaze.
0,She spoke to Jethro’s men in Elven to keep Austin out of the conversation so he wouldn’t say anything unnecessary.
0,She did not trust him to keep silent nor did she know who of Jethro’s men spoke any English.
0,"The dwarf briefed Eydis on their current coverage of the city, but she paid little attention."
0,"All reports Jethro received from this world he forwarded to her, including the city coverage."
0,"Jethro’s men followed a high level of secrecy, so she doubted the thoroughness of their search."
0,"If Austin’s supposed leads came up empty, she would likely have to begin her own search from the beginning anyway."
0,Eydis returned her attention to the briefing when the dwarf began mention of a public transportation system that was not included in the reports.
0,"She could use a large, automated carriage called a bus to move around the city quickly to prevent the princess from being alerted to any use of spatial magic."
0,He handed her a small card with the explanation that it should give her free access if she tapped it on the pedestal inside the carriage.
0,His final orders were to return at sundown and gave Eydis freedom to investigate as she pleased so long as she did not confront the princess should she locate her.
1,"* * *
Austin followed a few steps behind Eydis as they walked off the large property."
0,"Eydis left Rynn behind in the bedroom with a warning to the humans that if any of them so much as looked at her, she would slaughter them all."
0,The dwarf’s assurance that he had no interest in children only slightly eased her worry.
0,She gave Rynn a knife from the kitchen to defend herself in an emergency because she did not think the girl knew offensive magic.
0,Eydis did not even know if Rynn could use magic.
0,"Being a Forest Elf, she should at least have an affinity to wind or water, maybe earth, but that was far rarer."
0,“Anything important I should know?” Austin called from five full paces behind Eydis.
0,“Nothing.
0,They are useless.
0,We will work without them.
0,Anything I need to know about this world I can hear from you.”
0,"After an hour of walking, Eydis and Austin arrived at the edge of the city proper."
0,Eydis breathed heavy due to the thin air and had to take a break.
0,She pulled Austin away from the road and asked him to fill her in on everything he knew about her sister.
0,“Not much to be honest.
0,She is living with a man who is awfully controlling of her.
0,"She has another friend, Sammy, who she frequently hangs out with."
0,I know Sammy and should be able to find her again if we go to the university.
0,"We can find your sister that way, or--”"
0,"Eydis sensed that everything Austin said was true, at least to his knowledge, so that was enough."
0,“You said you can find her friend at this university place?
0,"Go there, and say nothing of me to anyone."
0,I will search the city.
0,We will meet back here before sunset.
0,Do you have access to the bus?”
0,“That bus pass you have was mine from back when they first took me from Gullivan.” 
0,Eydis returned Austin his bus pass.
0,"Austin was relieved that he would not have to stay with Eydis the entire time, and Eydis was just as relieved to be rid of him."
0,"At the nearest bus stop, he happily boarded the first bus that arrived after Eydis confirmed one last time he had no more deshalu on him."
0,Eydis worried that Austin might run but thought better of it.
0,He would not abandon the slaves Jethro provided for him.
0,And the deshalu; all Austin’s favorite vices were on Whinhlem.
1,Eydis wanted a better look at the city now that she was alone but noticed many people casting strange looks her direction.
0,“Mommy!
0,"It’s an elf!” A mother pulled her daughter along, and the young child’s inquisitive eyes stared at Eydis’s ears."
0,These humans knew about elves.
0,"The documents stated that only humans lived in this city, but perhaps elves existed elsewhere in the world."
0,Or maybe they were rare?
0,"The reports lacked any explanation of how the populace treated foreign races, and her ears were a banner announcing her as an outsider."
0,There was even a possibility that the man with whom the princess was staying hid her race and identity.
0,"If humans of this world were anything like those in hers, walking alone on the streets was dangerous for an elf."
0,"While Eydis feared nothing from weak humans, attracting unneeded attention, especially hostility, was a problem."
0,Eydis walked between two buildings into a secluded alleyway.
0,"She lacked the means to hide her ears, so she chose instead to avoid people where possible."
0,"This also meant she could not use the public transportation of this world, especially in the busier inner city, but she never planned on using it anyway."
0,"Eydis looked up at the tops of the two-story, red-brick buildings sandwiching the alleyway and gauged the distance to the roof."
0,Lurr are far stronger than elves.
0,This should be possible.
0,Eydis crouched down.
0,"Looking at the edge of the roof, she jumped."
0,Biting cold struck her face in her upward climb.
0,"She overestimated her strength, but something else felt off."
0,"Once she reached the apex of her jump, about the height of a third floor had there been one, her descent felt slow."
0,She did not accelerate as fast as she felt she should.
0,She was much lighter in this world than in Whinhlem.
0,The sensation was bizarre and unnerving.
0,Eydis landed on the flat roof with little impact.
0,Most the buildings near her had one or two floors.
0,There were no nearby towers she could use as a vantage point.
0,A city without walls or towers.
0,Was this world a peaceful place that had no need of such things?
0,Or were these humans so powerful that they feared nothing?
1,Eydis ran and jumped to the next building.
0,"When she landed, her pants slipped down."
0,She grabbed them and quickly pulled them back up.
0,"Her loose pants drastically hindered her movement, but she had no means to fasten them."
0,She searched the roof and found a thin wire connected to what looked like a metal sculpture that poorly resembled a tree or perhaps a feather.
0,"She tore up the wire that attached to the base of the sculpture like a root, wrapped it around her hands, and with a swift tug snapped it with a pop."
0,She uprooted more of it along the roof until she felt it was long enough to tie a knot and broke it from the rest of the wire with another swift tug.
0,She slipped the wire a few times through two loops on the waistline of the side of her pants.
0,"After tying a knot that pulled the loops as close together as they could reach, the pants hugged snugly against her waist."
0,"Perhaps this was the purpose of the loops, although she had never seen Austin use them this way, but Austin’s pants fit him perfectly without ties."
0,Eydis ran and jumped to the next building.
0,"Using the rooftops, she avoided the streets until she reached a wide road she would have to cross on the ground."
0,Her breath shot out in heavy white puffs from her lung’s fight for air.
0,"The lightness of her body meant that she was not even the slightest bit exhausted from jumping across the buildings, but the air was far too thin."
0,"Her already light head felt like it was drifting away in the wind, so she sat down and took the opportunity to inspect what she could see of the city."
0,"In the distance, there were larger buildings of multiple floors, but reaching them would be difficult without drawing attention either on the ground or jumping along the rooftops."
0,"A tree-lined river bisected the city, dividing the larger buildings on the far side from the smaller homes and businesses on this side."
0,Eydis understood why finding the princess would be so difficult in such a place.
0,The city was twice the size of Amel.
0,Capturing Austin who had met the princess was quite the stroke of luck.
0,Jethro had found the link to the princess without even knowing.
0,Eydis laughed to herself.
0,His ignorance was her blessing.
0,"The dwarf warned Eydis not to use her spatial magic, but seeing the size of the city, she felt she could risk it."
0,The chances of the princess being close enough to her at this moment to sense her spatial magic were low.
0,The chances the princess would be near her destination would be even less.
0,Very few people were sensitive enough to detect magic from a great distance.
0,"Eydis did not have that ability, and although she was not yet a perfect duplicate of the princess, she doubted the princess was highly sensitive either."
0,Eydis worked out the formula to Jethro’s complicated but lower-cost transmission spell.
0,"She was still unfamiliar with it, so this took time, but Eydis’s inability to regenerate ven naturally meant she had to reserve ven as much as possible."
0,"She had Rynn, but Rynn’s ven regeneration rate was slow, and Eydis felt bad using her for that reason even though Rynn was willing."
0,"Transmission used a quarter the cost of regular teleportation, which made it indisputably beneficial for her, but when thinking over the formula, she felt there was an excessive amount of meaningless bloat that increased the ven cost, and she did not know enough about spatial magic to determine if the excess was needed."
1,"Eydis disappeared with a loud crack, and with a flash of light, strong wind blew in her face."
0,The view from the tallest building of the city was grand.
0,Flat fields surrounded the city on three sides with hills or mountains far in the distance.
0,"Many of the fields had single residences for the landowners, just like the house Jethro’s men occupied."
0,The fields on the final side of the city ran up along a hill that quickly grew into mountains.
0,"A large highway left the city in three directions, one of which led up the hills and into a valley between the mountains."
0,"As far as Eydis could see, the highways did not immediately connect to another city or village."
0,This city was isolated.
0,Perhaps it was a sovereignty of its own.
0,"Her ven was limited, so she could not teleport around the city."
0,"By her estimates, holding Rynn throughout the night would only recover enough ven for three uses."
0,"To prevent a net negative, Eydis figured she could only check one section of the city each day."
0,She began to wish she brought her slave along with Rynn.
0,"The High Elf’s ven regeneration was about five times Rynn’s, but there was nothing she could do about that now."
0,The question then became where to start her search.
0,"Far to the southwest bordering a light forest, many of the structures appeared older or slightly dilapidated, but she could not see perfectly from her distance."
0,"If the buildings were older, finding one unused was possible."
0,Starting her search there was as good of a location as any.
0,Eydis worked out a transmission formula while shivering in the frigid wind.
1,"She appeared in a small, wooded grove near an old residential district on the southwest edge of the city."
0,No one walked the streets in the snow.
0,"None of the automated metal carriages traveled the roads, and only a few wheel tracks drew lines in the wet powder."
0,"Although the houses looked old and the neighborhood abandoned or at least scarcely populated compared to the rest of the city, there was plenty of life within the structures."
0,"Her sensitive ears picked up light conversations, arguments, and people making noise while going about their daily lives."
0,Eydis gritted her teeth in frustration.
0,"This was only the poor district, and she wasted precious ven to teleport here."
0,Eydis wondered if finding an abandoned house was not possible in such a populated city.
0,"To not waste the ven she expended, Eydis continued walking alongside the road inspecting every house from a distance, listening to every minute noise, and peering into every window where possible with the hope that fate might shine on her and provide her what she was searching for."
0,"The sun moved fast in the sky, and Eydis knew that the day would soon be spent."
0,"She read in the reports that days were far shorter in this world, but experiencing it herself felt surreal."
0,"She was about to head back to meet Austin when a small, isolated home at the dead end of a street caught her eye."
0,"It was on the edge of the residential district, and a large, wooded land sat at its back."
0,"Unlike many of the other houses, this one appeared unkempt."
0,"Some form of dead ivy grew up the walls in various places, and the shrubs surrounding the back perimeter of the small property stood tall and overgrown."
0,Eydis walked through the untouched snow of the yard and peered between the auburn curtains of the front window.
0,"She saw and heard no one, but the furniture and décor gave the house a pulse."
0,"It was lived in, but there were no tracks in the snow leading to or from the door."
0,Either the owner was traveling or never left.
0,"Deciding to take the risk, Eydis walked to the front step and tried the door handle."
0,It was unlocked.
1,The inside of the house was dusty and not all too dissimilar from the house that Jethro’s men had secured.
0,"Many absurdly realistic paintings of people lined the walls of the entryway, and small decorations and trinkets sat on every shelf, table, and mantle of the living space."
0,Whoever owned the home had lived here for a time and had gathered many relics in their long life.
0,"“Ara, who is this?”"
0,A sudden hoarse voice called from down the hallway.
0,"Like a specter, a short and smiling elderly lady hobbled over to Eydis."
0,Her light feet moved in perfect silence over the thick carpeted floor.
0,She had wispy hair that had thinned enough to show her scalp.
0,Brown patches peppered her wrinkled skin.
0,The sunken eyes on her heavily creased face smiled through the thin slits of her eyelids.
0,"This woman looked to Eydis to be seven years old if not older, quite a ripe age for a human."
0,"“My, you are beautiful."
0,It’s so nice having visitors.
0,Make yourself at home.
0,I’ll make something warm.” The elderly lady weaved past Eydis to the range and put on a kettle of water with shaking hands.
0,"“Go on, dear."
0,Take a seat.”
0,“I apologize for entering.
0,I will leave.”
0,"“No, no."
0,I do not care if you came here to steal something or for any other reason.
0,"Your eyes show desperation, not malice."
0,You are my guest now.
0,Stay a while.
0,I never get visitors.” The lady flashed a toothy smile that had a gap in the top row just off from the center.
0,“Never?” Eydis sat on the cushion of a threadbare chair in the living room.
0,“How long ago was your last visitor?”
0,"“Oh, two years ago just after my husband died."
0,God bless him.”
0,“How do you live?
0,Do you have family to watch over you?” Eydis thought it impossible for such a feeble old woman to survive on her own for such a length of time.
0,"In the empire, she would be in the care of the community."
0,Humans were truly despicable if they left their elderly to survive their withered years alone.
0,"“Oh, I never had children."
0,"My late husband was infertile, you see."
