1,1.
0,"Ich weiß nicht, was die Gruft bedeutet, aber sie birgt Geheimnisse, die nicht für gewöhnliche Menschen sind.«"
0,Er sah sie nachdenklich an.
0,"»Du willst, dass ich sie mir ansehe?«"
0,"»Du nicht?«, entgegnete sie."
0,»Und deines Vaters Wachen?«
0,»Wir werden einen Weg finden.«
0,»Wir?«
0,»Ich werde dich begleiten.
0,Und keine Angst.
0,Wie die Marnfrauen weiß auch ich mit einer Klinge umzugehen.«
0,Sie sah ihn fragend an.
0,"»Wann reiten wir?«, fragte er entschlossen."
0,Sie atmete auf.
0,»Sobald du bei Kräften bist und deine Wunden verheilt sind.«
0,»Dann können wir sofort aufbrechen.«
0,"»Nein, das ist zu früh."
0,In einigen Tagen ...«
0,"Sie hielt inne, als die Schritte einer Wache erklangen und vor ihrer Tür hielten."
0,"»Lady, Hauptmann Felzt ist geflohen.«"
0,"»Ihr habt ihn entkommen lassen?«, rief sie."
0,"»Er wehrte sich wie ein Dämon, Lady."
0,"Er hätte uns alle erschlagen, oder wir ihn."
0,"Es ist schwer, einen Mann zu töten, mit dem man manche gute Schlacht geschlagen hat ...«"
0,"»Und manche Nacht durchgezecht hat«, fügte Nyala grimmig hinzu."
0,Der Mann wand sich.
0,"»Mit den Caer vor den Toren zählt jeder Mann, Lady ...«"
0,"»Was bedeutet das, wenn du sagst, vor den Toren?«, fragte Mythor."
0,»Ist die Stadt schon belagert?«
0,"»Nein, Fremder."
0,"Aber einer unserer Wachtrupps hat ein Caer-Schiff in einer Bucht entdeckt, gut getarnt."
0,Es mögen noch mehr sein.
0,"Jedenfalls haben Caer-Krieger und vielleicht auch einige ihrer verdammten Priester die Straße der Nebel überquert, und wir müssen auf der Hut sein ...«"
0,»Weiß mein Vater Bescheid?«
0,"»Ja, Lady.«"
0,Sie nickte gedankenvoll.
0,»Das sind keine guten Neuigkeiten.«
0,"»Nein, Lady.«"
0,"»Es ist gut, du kannst gehen.«"
0,"Als er sich umwandte, rief sie ihm nach: »Welche Anordnungen hat mein Vater daraufhin getroffen?«"
0,»Dass die Ausgänge der Stadt gut bewacht werden.
0,Überall sind die Wachen verstärkt worden.
0,"Deshalb ist es auch unwahrscheinlich, dass Hauptmann Felzt weit kommen kann ...«"
0,»Haltet trotzdem die Augen nach ihm offen.«
0,"»Ja, Lady.«"
0,"»Das erschwert unseren Plan«, sagte sie zu Mythor, als die Wache gegangen war."
0,"»Und es bedeutet, dass wir rasch handeln müssen«, ergänzte Mythor."
0,»Am besten heute noch.«
0,Sie schüttelte entschieden den Kopf.
0,"»Nein, heute nicht."
0,Du hast heute noch eine wichtige Abendaudienz.«
0,"Auf seinen fragenden Blick erklärte sie: »Bei meinem Vater, dem Herzog von Elvinon, der sich genau ansehen will, wie mein rettender Held aussieht und welche Chancen er mit deiner Hilfe hat, den bevorstehenden Kampf zu gewinnen.«"
1,"* Vor der Audienz hatte Mythor noch Gelegenheit, ein wenig von der Stadt zu sehen."
0,"Nyala wies zwei ihrer Wachen an, ihn zu begleiten."
0,"Sie selbst wollte mit ihrem Vater sprechen, um nicht nur die Erlaubnis zu bekommen, die Gruft zu besuchen, sondern auch ausreichenden Begleitschutz für den Fall, dass wirklich bereits Caer in der Nähe der Stadt waren."
0,"Mythor ertappte sich immer wieder dabei, wie er Churkuuhl mit Elvinon verglich und in allen kleinen Dingen feststellte, wie verschieden das Leben hier war."
0,"Selbst die schmalsten Gassen unten am Hafen waren breiter, als die breitesten Durchgänge in Churkuuhl gewesen waren; selbst die einfachsten Kleider waren bunter als die faserfarbenen Gewänder der Marn; die Menschen hier trugen viel weniger Leder, mehr Gewebe."
0,"Es gab Straßen, die waren gepflastert, damit Wagen auf zwei oder vier hölzernen Rädern bequem rollen konnten, gezogen von Pferden und Ochsen."
0,"Dann sah er Läden mit Kostbarkeiten aus Metall und Ton, Leder und Holz; Waffen und Gefäße, Gürtel und Helme und Schilde."
0,"Die Wachen, die bald Spaß an diesem Rundgang hatten, als sie merkten, wie unwissend und leicht zu beeindrucken ihr Begleiter war, nahmen es mit der Wahrheit nicht immer sehr genau."
0,Und sie machten sich den einen oder anderen Scherz mit ihm.
0,"So schoben sie ihn durch die schmale Gasse der Dirnen, die sich recht handgreiflich um ihn bemühten."
0,"Dann nahmen sie ihn mit in eine Taverne und machten ihn vertraut damit, welche Art Vergnügen ihresgleichen in einer Weltstadt fand und dass sie eher sterben, als Elvinon den Caer überlassen würden."
0,Der einfache Wein in der Taverne ließ Mythors Sinne bald ein wenig schwimmen.
0,"Es trieb ihn aber nach kurzer Zeit wieder hinaus auf die Straßen, was auch die Wachen ein wenig brummig wieder auf die Beine brachte."
1,Für den Weg zur Hafeneinfahrt hinab reichte die Zeit nicht mehr.
0,Es wurde rasch dunkel und kühl.
0,"Da und dort brannten die ersten Fackeln und Lampen, doch Soldaten löschten sie, und Mythor erfuhr, dass Herzog Krude die Anordnung gegeben hatte, die Stadt in den dunklen Mantel der Nacht zu hüllen, was es den Caer, wenn sie nachts über das Meer kamen, erschweren würde, sie zu finden."
0,"Da und dort flammten Lichter auf, wurden jedoch rasch abgeschirmt und ausgelöscht."
0,"Die einzigen Feuer, die sie auf dem Rückweg sahen, waren jene in den Essen der Schmieden."
0,"Die engen Gassen waren so dunkel, dass sie die Hände nicht vor den Augen sehen konnten."
0,"Mythor war dankbar für die Begleitung der Wachen, die ihren Weg mit schlafwandlerischer Sicherheit fanden."
0,Die Menschen hatten sich in die Häuser zurückgezogen.
0,Nebel zogen vom Meer herauf und krochen durch die steinernen Straßen wie Gespenster.
0,Manchmal hörten sie Schreie.
0,"Auf seine Fragen bekam Mythor jedoch nur zur Antwort, dass das nicht viel zu bedeuten habe."
0,"Wenn Caer in die Stadt kämen, würde sich das anders anhören."
0,"Schließlich wurde ihm auf seine bohrenden Fragen klargemacht, dass wohl Diebsgesindel die Straßen unsicher machte, besonders in einer dunklen Nacht wie dieser, und dass es nicht zu selten in Elvinon war, dass einer solcherart sein Leben ließ."
0,"Es war schließlich eine große Stadt, und jeder wollte irgendwie leben."
0,"Bevor sich Mythor über diesen Widerspruch klarwerden konnte, hatten sie den unteren Teil der Stadt verlassen und die offenen Straßen erreicht, die zwischen den letzten und beeindruckenden Häusern und ihren mächtigen Verbindungsmauern hindurch zur Burg des Herzogs hinaufführten."
0,"Dunkel und in weißliche Nebelschleier gehüllt, lag der Hafen Elvinons unter ihnen."
0,"Wolken hatten den größten Teil des Himmels bedeckt, dass kaum ein Stern zu sehen war."
0,Nur undeutlich hob sich der dunkle Koloss der Burg gegen diesen Himmel ab.
0,Unwillkürlich blickte Mythor nach Süden.
0,"Doch da waren Berge am Horizont und verbargen das Schimmern des Himmels, das Churkuuhl so viele Jahre begleitet hatte – der Abglanz des feurigen Kampfes zwischen Himmel und Erde."
0,"Hier in Tainnia wussten sie nichts von den unirdischen Mächten, denen die Menschen im Süden ausgeliefert waren – wo die wirklichen Horte der Schatten lagen, wo das Böse hervorkroch in vielerlei Gestalt, um die Menschen zu vernichten."
0,"Aber auch er wusste es nur aus den Erzählungen der Marn – Erzählungen, die durch so viele Münder und Generationen gegangen waren, dass sie längst mit Legenden vergleichbar waren."
0,"Aber darin lag ein Widerspruch, der ihn beschäftigte."
0,"Denn wenn so tief im Süden die Horte der Schattenwelt waren, weshalb sollte dann ein Held des Lichtes so weitab vom Feind erscheinen?"
1,"Er kam nicht dazu, diesem Gedanken gründlicher nachzuhängen."
0,Mehrere Männer glitten aus der Dunkelheit einer Mauer auf ihn zu.
0,Fackeln wurden aufgedeckt und blendeten ihn und seine Begleiter.
0,Undeutlich sah er Klingen blitzen.
0,"Dann hörte er die Flüche seiner Begleiter und das Klirren von Eisen, als die Klingen aufeinandertrafen."
0,"»Lasst die anderen am Leben!«, vernahm er einen halblauten Befehl."
0,»Nur der Fremde ist wichtig!«
0,"Er duckte sich, als sie auf ihn einhieben."
0,"Ein Schlag traf ihn an der Hüfte, und der Schmerz lähmte ihn fast."
0,Er hatte keine Waffe.
0,"Aber einer seiner Begleiter war plötzlich neben ihm und ein zweiter Mann auf ihm, der eben zum Stoß mit der Klinge ansetzte."
0,Mythor rollte herum und verbiss sich den Schmerz seiner frisch verheilten Armwunde.
0,"Er entwand dem Angreifer das Schwert, bevor er zustoßen konnte."
0,"Dann war er auf den Beinen und wehrte eine Fackel ab, die jemand nach seinem Gesicht zu stoßen versuchte."
0,"Die Klinge fand den Arm, und ein Aufschrei und Wimmern folgte, und die Fackel fiel zu Boden und erlosch."
0,"Sein Schwert fand ein zweites Mal Fleisch, als etwas Dunkles auf ihn zustieß."
0,"Der Gegner japste, unterdrückte ein Stöhnen, und das Rascheln kündete davon, dass er sich eilig aus dem Staub machte."
0,Neben ihm waren seine Begleiter erfolgreich und brachten die übrigen drei Fackeln zu Fall.
0,"Schreien begleitete dies, und in der folgenden Dunkelheit war nur noch das sich rasch entfernende Geräusch von hastigen Schritten zu vernehmen."
0,"»Das war ein kurzes Vergnügen«, brummte eine der Wachen."
0,»Hat einer von euch was abgekriegt?«
0,"»Nicht der Rede wert«, knurrte der andere."
0,"»Und du, Fremder?«"
0,»Ich muss mich erst vergewissern.
0,Der erste Schlag ...«
0,Er betastete seine Hüfte.
0,Aber der Schmerz rührte nur von der Wucht des Hiebes selbst her.
0,Das raue Leder hatte die Waffe aufgehalten.
0,"Da war ein tiefer Schnitt im Gewand, ein Kratzer darunter, nicht mehr."
0,"»Nein, es ist alles in Ordnung.«"
0,"»Da bin ich froh, Fremder."
0,"Lady Nyala hätte uns streng zur Rechenschaft gezogen, wenn dir etwas geschehen wäre."
0,Wir hätten uns am besten gleich selbst das Messer gegeben.«
0,Anerkennend meinte der zweite: »Du führst eine gute Klinge.
0,Man hat schon davon gesprochen ... die draußen in den Klippen dabei waren.«
0,"»Es gab nicht viel anderes, was man bei den Marn lernen konnte«, erwiderte er."
0,Aber er schämte sich seiner Worte innerlich.
0,"»Möchte wissen, wer es auf ihn abgesehen hat."
0,Von uns wollten sie gar nichts.«
0,"Bevor der andere etwas erwidern konnte, erklärte Mythor: »Das war ein Gruß von eurem feinen Hauptmann Zohmer Felzt.«"
0,"»Du hast einen Zwist mit dem Hauptmann?«, sagte der eine grinsend und nickte."
0,"»Ja, ja, die Gunst der Lady hat ihre Vor- und Nachteile."
0,Er ist ein feiner Hauptmann und recht beliebt bei der Garde.
0,"Aber er ist recht eigen, was die Prinzessin betrifft."
0,Wenn er sich bei anderen Weibern ein wenig Entspannung holen würde ... aber dazu ist er sich zu gut.«
0,Er seufzte.
0,"»Wir haben immer gewusst, dass es kein gutes Ende nehmen wird.«"
0,"»Tut mir einen Gefallen«, bat Mythor."
0,"»Gern, Freund.«"
0,"»Da nichts weiter geschehen ist, bitte ich euch, nicht über diesen Vorfall zu reden.«"
0,»Wenn du es so willst.
0,Und wie willst du das hier erklären?«
0,Er deutete auf das Schwert in Mythors Hand.
0,"»Gar nicht«, sagte Mythor und hob die Klinge, um sie in die Dunkelheit der Nacht zu werfen."
0,"»Nein, warte."
0,Es scheint eine gute Waffe zu sein.
0,"Es wäre schlecht, sie irgendeinem Schurken zu überlassen."
0,Gib sie uns.
0,"Es ist leicht erklärt, dass wir sie einem Burschen abgenommen haben, der damit Ärger machte.«"
0,"»Ja, ihr habt recht."
0,"Es tut mir in der Seele weh, sie herzugeben.«"
0,"»Kannst sie dir wiederholen, wenn du Sehnsucht danach hast«, meinte der eine und steckte sie in seinen Gürtel."
0,»Aber wir sollten jetzt eilen.
0,"Wenn du noch eine Audienz beim Herzog hast, wie du sagst, dann müssen wir zusehen, dass wir in die Burg kommen.«"
0,Er lachte unterdrückt.
0,"»Zohmer scheint dich zu unterschätzen, wenn er dir solche Tölpel auf den Hals hetzt.«"
1,"* Herzog Krude saß müde in seinem kleinen Audienzraum und grübelte über die Auswirkungen nach, die es haben mochte, wenn die Nachricht seiner Männer stimmte – dass nämlich Scharen von Caer sich bereits auf dem Festland herumtrieben."
0,"Es gab keine Hinweise, wie viele es waren."
0,"Es mochten hundert sein, der Größe des Schiffes nach zu schließen, das seine Patrouillen entdeckt hatten, oder tausend, wenn es Schiffe gab, die seine Patrouillen nicht entdeckt hatten."
0,Oder ein ganzes Heer!
0,Die Götter mochten es wissen.
0,Ihre Zahl und ihre Pläne.
0,Es musste Zauberei gewesen sein.
0,Wie sonst hatten sie seinen Patrouillen entgehen können?
0,"»Zu den Schatten mit ihnen!«, rief er halblaut."
0,"In diesem trüben, grüblerischen Augenblick meldete die Leibwache die Ankunft des Fremden."
0,"»Ah, Nyalas Held, der uns alle retten wird«, rief der Herzog ironisch."
0,»Herein mit ihm.
0,"Ich bin gespannt auf den Burschen, wenn ich ihn auch schon halb tot gesehen habe, weil ich mir alles ansehe, was meine Tochter heimbringt.«"
0,Er lachte und vergaß für einen Augenblick die drohenden Caer.
0,"Als Mythor hereinkam und sich verneigte, wie er es von den Wachen gesehen hatte, wenn auch längst nicht so tief, sagte der Herzog: »Junger Mann, ich habe alles über deine Taten gehört."
0,"Meine Männer sagen, dass du ein guter Kämpfer bist."
0,Das schätze ich.
0,"Auch wenn der Fürst von Callowy wenig erbaut sein wird davon, schlage ich dir vor ... ehe du dich von meiner Tochter zum Narren machen lässt, dass du in meine Dienste trittst."
0,"Na, was meinst du?«"
0,"»Um mir noch mehr Feinde zu machen?«, erwiderte Mythor."
0,"»Hm«, meinte Krude nachdenklich."
0,"»Klug bist du auch, scheint es."
0,Wenn du einen Wunsch frei hättest?«
0,"»Würde ich dich bitten, mich des Weges ziehen zu lassen.«"
0,»Hm.«
0,Eine Weile war Stille.
0,"Der Herzog dachte nach, und Mythor hielt es für das beste, ihn nicht zu unterbrechen."
0,»Hat meine Tochter schon mit dir gesprochen?«
0,»Ja.«
0,"»Auch über diese kindlichen Vorstellungen, die sie da hat?«"
0,»Auch über die.«
0,»Wie denkst du darüber?«
0,"»Ein alter Mann lehrte mich, dass Legenden nur eine Form der Wahrheit sind.«"
0,"»Dann denkst auch du, dass es ihn gibt, diesen ... Helden der Lichtwelt?«, fragte der Herzog enttäuscht."
0,"»Ich würde jedenfalls nicht so einfach behaupten, dass es ihn nicht gibt, Herzog Krude.«"
0,"»Würdest du nicht, hm?"
0,Und möchtest wohl auch gern dieser Held sein ...?«
0,"»Um für andere das gare Fleisch aus dem Feuer zu holen?«, bemerkte Mythor beiläufig ablehnend."
0,»Und die Träume anderer wahr zu machen?
0,In meinem Alter hat man eigene Träume.«
0,"»Bei den Göttern, du gefällst mir von Augenblick zu Augenblick mehr."
0,"Ich wünschte, du würdest mein Angebot annehmen, aber das würde wohl auch bedeuten, deine eigenen Träume zu opfern ...«"
0,"»Ich glaube, das würde es.«"
0,"»Bedenke aber, dass eine gute Stellung auch ein guter Ausgangspunkt zur Verwirklichung von Träumen ist.«"
0,»Ich bin nicht besonders vertraut mit eurer Art zu leben.
0,"Aber nun, da du es sagst, leuchtet es mir ein.«"
0,Krude grinste.
0,»Da ist eine Stellung als Hauptmann der Leibgarde frei geworden.
0,"Ich könnte mir denken, dass du hoch genug in der Gunst meiner Tochter stehst ...«"
0,Mythor lächelte.
0,»Ein verlockendes Angebot.«
0,"»Inzwischen wäre es mir eine Beruhigung, eine gute Klinge, wie du sie führst, an meiner Seite zu wissen in den Stunden, die vor uns liegen.«"
0,»Du brauchst es nur zu befehlen.«
0,Krude nickte.
0,»Ich habe so viel befohlen.
0,Aber manche Befehle taugen nichts.«
0,"»Ja«, stimmte Mythor zu."
0,"»Wie jener, der deine Krieger auf die wenigen Überlebenden meines Stammes hetzte ...«"
0,"»Und der vielen meiner Krieger den Tod brachte«, ergänzte der Herzog bitter."
0,"»Ich habe diesen Befehl nicht gegeben, Junge."
0,"Aber welche Höhe und Macht ein Reich auch immer erreichen mag und wie sehr es auf andere Völker als Barbaren hinabsieht, es hat immer noch einen guten Teil Barbarisches selbst in sich."
0,Thorwil von Callowy ist solch einer.
0,"In ihm sind die alten Ängste, die alten Kräfte und die alten Leidenschaften lebendig."
0,Ihr schient ihm eine leichte Beute zu sein.
0,Und die schwarzhäutigen Menschen deines Volkes flößten ihm Furcht ein ...«
0,"»Furcht vor drei oder vier Dutzend Überlebenden, die vor Grauen über den Untergang ihrer Welt wie gelähmt waren?«, fragte Mythor ungläubig."
0,»Die Urangst der Menschen vor der Schwärze und Dunkelheit.
0,Ich habe deinen alten Freund gesehen.
0,Ein wenig verstehe ich Thorwils Furcht.
0,"Die Umstände ... diese riesigen dämonischen Kreaturen, auf denen ihr eure Häuser bautet, und das dämonische Heulen, als sie sich in die Tiefe stürzten."
0,"Ich habe es nicht selbst gesehen oder gehört, aber ich habe die Männer reden hören."
0,"Und nun steht uns ein Geschick bevor, das nicht weniger barbarisch sein wird."
0,Vernichtung um der Vernichtung willen.«
0,Er blickte Mythor starr an.
0,"»Dein Stamm ist nicht bedauernswerter als jedes andere Volk, dessen Zeit abgelaufen ist."
0,"Deine Vorwürfe entspringen dem quälenden Geist der Jugend, der tausend Fragen stellt und immer nach dem Warum sucht."
0,"Ich hatte keinen Anteil am Untergang deines Volkes – das nicht einmal dein Volk ist, wenn ich Nyala recht verstanden habe."
0,Ich fühle auch keine Schuld.
0,"Du überschätzt deine Wichtigkeit, wenn du denkst, dass ich dir um den Bart streiche."
0,Und an den verrückten Ideen meiner Tochter habe ich keinen Anteil.
0,Sie ist launisch.
0,Sie hebt dich heute in den Himmel und lässt dich morgen fallen.
0,"Wäre sie nicht im Grunde ihres Wesens gut und gerecht, ließe ich ihr nicht diese Freiheit in so vielen Dingen."
0,"Aber es mag alles nur der Einfluss dieses unseligen Hauptmanns gewesen sein, mit dem sie herumspielte."
0,Und jetzt bist du an der Reihe ... ein himmlischer Held.
0,Mit Geringerem tut sie's nicht mehr.
0,Ihre Mutter war nicht anders.«
1,"* Es war fast Mitternacht, als Mythor endlich aus der Gesellschaft des gesprächigen alten Mannes entlassen wurde."
0,"Mythor lernte eine ganze Menge über Tainnia, und er bekam den Eindruck, dass es ein großartiges Land war, in dem sich gut leben ließe – wären die Caer nicht dieser gleichen Ansicht gewesen."
0,"Mythor berichtete ihm über Churkuuhl und die Marn, über das einfache Leben in der Wanderstadt, die Yarls, die sich seit Generationen nicht mehr lenken ließen und schließlich wie von Dämonen besessen ins Meer sprangen."
0,"Er erwähnte nichts von seiner nebelhaften Herkunft oder den Legenden der Marn, die Nyala so in Aufregung versetzt hatten."
0,"Er hatte vorgehabt, den Herzog zu bitten, ihm Zugang zur Gruft zu gewähren."
0,"Aber er bekam keine Gelegenheit dazu, und schließlich kam er auch wieder ab von dem Gedanken."
0,"Nyala würde sich übergangen fühlen, und er stand zu tief in ihrer Schuld, um sie zu hintergehen."
0,Und er wollte ihre Gunst nicht verlieren.
0,"Es war, als ob er die kurze Berührung ihrer Hände noch immer spürte."
0,Es war mehr als nur Gunst.
0,"Und nach all den Schrecknissen war die Zuneigung dieses wunderschönen Mädchens wie Balsam auf der Seele und ließ ihn die schmerzlichen Erinnerungen vergessen, die ihn immer wieder überfielen."
0,Krude erschien Mythor als ein seltsamer Mann.
0,"Er wusste nie genau, wann der Herzog scherzte oder ernst war."
0,"Er mochte lächeln mit grimmigem Blick, und er mochte fluchen mit lachenden Augen."
0,"Aber er war ein verträglicher Mann, der gern ein wenig Ruhe gehabt hätte, anstatt noch einmal in die Schlacht zu ziehen."
0,"Er hatte keine Furcht, nicht vor dem Kampf, nur diese Urangst vor dem Bösen, vor der Magie der Caer-Priester, die ihn mutlos zu machen drohte und die ihm immer wieder einflüsterte, dass Elvinon fallen würde."
0,"Er war ein alter, starker Mann, der angefangen hatte, mit dem Schicksal zu hadern."
1,"Als Mythor schließlich, geläutert von dieser Vielfalt tainnianischer Ansichten und Vorstellungen, den Audienzraum verließ und in jenen Teil der Burg zurückging, in dem seine Kammer lag, hatte er das Gefühl, dass jemand ihm nachschlich."
0,Die abgedunkelte Lampe erhellte kaum die Steinwände des Korridors neben ihm.
0,"Er spürte Unbehagen und Unsicherheit in dieser steinernen, hallenden Dunkelheit, wie er sie nachts in Churkuuhl nie gekannt hatte."
0,"Hier waren so viele Menschen, und sie waren alle fremd."
0,In Churkuuhl war ihm jeder vertraut gewesen.
0,Die grandiose Welt der Stadt hatte auch ihre düsteren Seiten.
0,"Er fand gleich darauf erleichtert die runde Treppe, die den Turm nach unten in das langgestreckte Haus der Burg führte."
0,Er fröstelte in der zugigen Kälte.
0,"Er hätte das Schwert behalten sollen, statt es den Wachen zu geben."
0,Er brauchte eine Waffe in dieser unsicheren Welt.
0,Dieser Zohmer Felzt mochte in jedem Winkel dieser Schwärze auf ihn lauern.
0,In der verdunkelten Stadt konnte sich jeder Schurke frei bewegen.
0,"Als er sich seiner Kammer näherte, glaubte er eine erstickte Stimme aus Nyalas Räumen zu hören, wie ein unterdrücktes Rufen."
0,Er hielt an und lauschte.
0,"Der Laut wiederholte sich nicht, aber hinter ihm erklang ein verräterisches Knirschen von kleinen Steinen unter festem Schuhwerk."
0,Er hatte sich also nicht getäuscht.
0,Jemand verfolgte ihn.
0,"Er hielt die Lampe hoch, in dem Augenblick, als eine Klinge aus der Schwärze herabkam."
0,Mythor ließ sich fallen und warf die Lampe.
0,Das Schwert verfehlte ihn um Fingerbreite.
0,Die lange Kette der Lampe behinderte den Angreifer einen Augenblick.
0,"Er fluchte etwas, was Mythor nicht verstand."
0,"Mythor rollte am Boden herum, erst aus dem Schein der Lampe, dann auf den Angreifer zu und zwischen seine Beine."
0,Der Unbekannte fiel und begrub die Lampe unter sich.
0,Er kam jedoch rasch wieder auf die Beine und fluchte erneut in unverständlicher Weise.
0,"Das Öl der Lampe war ausgelaufen, und der Boden des Korridors und das Wams des Mannes loderten auf."
0,Die Furcht vor dem Feuer war größer als die vor einem Angriff seines Opfers.
0,"Während er versuchte, das Feuer an seinem Wams zu löschen, entglitt das Schwert seiner Hand."
0,"Bevor er sich bücken konnte, sprang Mythor durch das Feuer, das über die ganze Breite des Korridors brannte, und stieß den Angreifer zur Seite."
0,"Dann hatte er die Klinge in der Faust und stach zu, bevor der andere auf die Beine kommen konnte."
0,"Der fiel mit einem lautlosen Schrei auf den Lippen und war bereits tot, als Mythor die Klinge wieder aus dem Körper riss."
0,Heftig atmend sah er sich um.
0,Der Korridor war taghell erleuchtet.
0,Der Angreifer schien allein gewesen zu sein.
0,"Wieder ein Meuchelmörder, den Zohmer Felzt ihm schickte, dachte Mythor grimmig."
0,"Und er wusste, er würde nicht immer soviel Glück haben."
0,"Aber als er den Mann näher betrachtete, sah er, dass es kein Tainnianer war, wie er sie bisher in Elvinon gesehen hatte."
0,"Der Umhang mochte den flüchtigen Beobachter täuschen, doch darunter trug er Wams und Rock aus Fellen."
0,"Sein Gesicht war von einer grimmigen Wildheit gezeichnet, soweit es unter dicht wucherndem Bart zu erkennen war."
0,"In seinen gebrochenen Augen war ein dunkler Schatten, der wie eine schwarze Flamme wogte und schließlich erlosch."
0,Mythor schauderte.
0,Aber dann war nichts Dämonisches mehr an dem Toten.
0,"Es war wohl das flackernde Feuer, das nun langsam niederbrannte, das ihm Gespenster vorgaukelte."
1,"Obwohl das Feuer den ganzen Korridor entlang und sein heller Schein wohl auch noch weit um die Krümmung zu sehen sein musste, erschien keine von den Wachen, die gewöhnlich vor Nyalas Gemächern standen."
0,"Vorsichtig schritt Mythor den Korridor entlang, das Schwert halb erhoben, zum Stoß bereit."
0,"Als er um die Krümmung kam, sah er, dass Nyalas Tür unbewacht war."
0,Und im gleichen Augenblick hörte er wieder den erstickten Laut.
0,"Er beschleunigte den Schritt, verhielt an der Tür und lauschte."
0,"Als er sein Keuchen unterdrückte, vernahm er leise Stimmen, die fremdartig klangen."
0,Es waren männliche Stimmen.
0,"Er verstand nicht, was sie sprachen, so fremdartig klang ihr Dialekt."
0,"Er widerstand dem Drang, die Tür aufzureißen und hineinzustürmen."
0,"Er wusste nicht, wie viele sie waren."
0,Das Feuer war fast niedergebrannt und der Korridor dunkel.
0,Unentschlossen horchte er.
0,"Dann vernahm er wieder das erstickte Stöhnen, und diesmal wusste er, dass es Nyalas Stimme war."
0,Gleichzeitig näherten sich Schritte der Tür.
0,Mythor wich zurück in die Dunkelheit des Korridors gegenüber.
0,Eine Stimme sagte etwas halblaut.
0,"Dann wurde die Tür vorsichtig geöffnet, und ein bärtiges Gesicht starrte heraus."
0,Wie der Tote im Korridor war der Mann in Fellkleidern.
0,"Er hatte eine Axt im Gürtel, aber einen Dolch in der Faust."
0,"Er entdeckte Mythor nicht sofort, da seine Augen sich erst an die Dunkelheit gewöhnen mussten."
0,"Aber Mythor sah hinter ihm deutlich ein Bild, das ihn keinen Augenblick zögern ließ."
0,Nyala stand zwischen zweien dieser fremdartigen Krieger.
0,"Sie wehrte sich, als die beiden sie auf die Tür zuschoben, doch ihre Hände waren gefesselt, und ein Tuch vor dem Mund hinderte sie am Schreien."
0,"Mythor sprang mit vorgestreckter Klinge, und der Mann an der Tür starb, bevor er seinen Gegner wahrgenommen hatte."
0,Mythor stieß ihn mit der Klinge zur Seite und schob sich durch den Eingang.
0,"Bevor er die Tür schließen konnte, kamen ihm drei dieser fellgekleideten Männer entgegen."
0,"Sie hatten ihre Waffen bereits in den Fäusten, Äxte und Schwerter."
0,"Und ein vierter winkte den beiden mit der gefangenen Nyala, aus Mythors Reichweite zu gehen."
0,Nyala blickte ihm mit Wut und Verzweiflung entgegen und versuchte sich von ihren Gegnern loszureißen.
0,Aber einer nahm sie an dem langen Zopf dunklen Haares und riss sie zu Boden.
