0,CHAPTER I.
0,is himself as poor and as forlorn as any that be sheltered here this
0,"day, or ever shall be.”"
0,"He was soon in the midst of a crowd of boys who were running, jumping,"
0,"playing at ball and leap-frog, and otherwise disporting themselves, and"
0,"right noisily, too."
0,"They were all dressed alike, and in the fashion"
0,which in that day prevailed among serving-men and ‘prentices{1}--that
0,"is to say, each had on the crown of his head a flat black cap about the"
0,"size of a saucer, which was not useful as a covering, it being of such"
0,"scanty dimensions, neither was it ornamental; from beneath it the hair"
0,"fell, unparted, to the middle of the forehead, and was cropped straight"
0,around; a clerical band at the neck; a blue gown that fitted closely
0,and hung as low as the knees or lower; full sleeves; a broad red belt;
0,"bright yellow stockings, gartered above the knees; low shoes with large"
0,metal buckles.
0,It was a sufficiently ugly costume.
0,"The boys stopped their play and flocked about the prince, who said with"
0,native dignity--
0,"“Good lads, say to your master that Edward Prince of Wales desireth"
0,speech with him.”
0,"A great shout went up at this, and one rude fellow said--"
0,"“Marry, art thou his grace’s messenger, beggar?”"
0,"The prince’s face flushed with anger, and his ready hand flew to his"
0,"hip, but there was nothing there."
0,"There was a storm of laughter, and"
0,one boy said--
0,“Didst mark that?
0,He fancied he had a sword--belike he is the prince
0,himself.”
0,This sally brought more laughter.
0,Poor Edward drew himself up proudly
0,and said--
0,“I am the prince; and it ill beseemeth you that feed upon the king my
0,father’s bounty to use me so.”
0,"This was vastly enjoyed, as the laughter testified."
0,The youth who had
0,"first spoken, shouted to his comrades--"
0,"“Ho, swine, slaves, pensioners of his grace’s princely father, where be"
0,your manners?
0,"Down on your marrow bones, all of ye, and do reverence to"
0,his kingly port and royal rags!”
0,With boisterous mirth they dropped upon their knees in a body and did
0,mock homage to their prey.
0,The prince spurned the nearest boy with his
0,"foot, and said fiercely--"
0,"“Take thou that, till the morrow come and I build thee a gibbet!”"
0,"Ah, but this was not a joke--this was going beyond fun."
0,The laughter
0,"ceased on the instant, and fury took its place."
0,A dozen shouted--
0,“Hale him forth!
0,"To the horse-pond, to the horse-pond!"
0,Where be the
0,dogs?
0,"Ho, there, Lion!"
0,"ho, Fangs!”"
0,Then followed such a thing as England had never seen before--the sacred
0,"person of the heir to the throne rudely buffeted by plebeian hands, and"
0,set upon and torn by dogs.
1,"As night drew to a close that day, the prince found himself far down in"
0,the close-built portion of the city.
0,"His body was bruised, his hands"
0,"were bleeding, and his rags were all besmirched with mud."
0,He wandered
0,"on and on, and grew more and more bewildered, and so tired and faint"
0,he could hardly drag one foot after the other.
0,He had ceased to ask
0,"questions of anyone, since they brought him only insult instead of"
0,information.
0,"He kept muttering to himself, “Offal Court--that is the"
0,name; if I can but find it before my strength is wholly spent and I
0,"drop, then am I saved--for his people will take me to the palace and"
0,"prove that I am none of theirs, but the true prince, and I shall have"
0,mine own again.” And now and then his mind reverted to his treatment
0,"by those rude Christ’s Hospital boys, and he said, “When I am king, they"
0,"shall not have bread and shelter only, but also teachings out of books;"
0,"for a full belly is little worth where the mind is starved, and the"
0,heart.
0,"I will keep this diligently in my remembrance, that this day’s"
0,"lesson be not lost upon me, and my people suffer thereby; for learning"
0,softeneth the heart and breedeth gentleness and charity.” {1}
0,"The lights began to twinkle, it came on to rain, the wind rose, and a"
0,raw and gusty night set in.
0,"The houseless prince, the homeless heir to"
0,"the throne of England, still moved on, drifting deeper into the maze"
0,of squalid alleys where the swarming hives of poverty and misery were
0,massed together.
0,Suddenly a great drunken ruffian collared him and said--
0,"“Out to this time of night again, and hast not brought a farthing home,"
0,I warrant me!
0,"If it be so, an’ I do not break all the bones in thy lean"
0,"body, then am I not John Canty, but some other.”"
0,"The prince twisted himself loose, unconsciously brushed his profaned"
0,"shoulder, and eagerly said--"
0,"“Oh, art _his_ father, truly?"
0,Sweet heaven grant it be so--then wilt
0,thou fetch him away and restore me!”
0,“_His_ father?
0,I know not what thou mean’st; I but know I am _thy_
0,"father, as thou shalt soon have cause to--”"
0,"“Oh, jest not, palter not, delay not!--I am worn, I am wounded, I can"
0,bear no more.
0,"Take me to the king my father, and he will make thee rich"
0,beyond thy wildest dreams.
0,"Believe me, man, believe me!--I speak no"
0,"lie, but only the truth!--put forth thy hand and save me!"
0,I am indeed
0,the Prince of Wales!”
0,"The man stared down, stupefied, upon the lad, then shook his head and"
0,muttered--
0,"“Gone stark mad as any Tom o’ Bedlam!”--then collared him once more,"
0,"and said with a coarse laugh and an oath, “But mad or no mad, I and thy"
0,"Gammer Canty will soon find where the soft places in thy bones lie, or"
0,I’m no true man!”
0,"With this he dragged the frantic and struggling prince away, and"
0,disappeared up a front court followed by a delighted and noisy swarm of
0,human vermin.
0,CHAPTER V. Tom as a Patrician.
1,"Tom Canty, left alone in the prince’s cabinet, made good use of his"
0,opportunity.
0,He turned himself this way and that before the great
0,"mirror, admiring his finery; then walked away, imitating the prince’s"
0,"high-bred carriage, and still observing results in the glass."
0,Next he
0,"drew the beautiful sword, and bowed, kissing the blade, and laying it"
0,"across his breast, as he had seen a noble knight do, by way of salute to"
0,"the lieutenant of the Tower, five or six weeks before, when delivering"
0,the great lords of Norfolk and Surrey into his hands for captivity.
0,Tom
0,played with the jewelled dagger that hung upon his thigh; he examined
0,the costly and exquisite ornaments of the room; he tried each of the
0,"sumptuous chairs, and thought how proud he would be if the Offal Court"
0,herd could only peep in and see him in his grandeur.
0,He wondered if
0,"they would believe the marvellous tale he should tell when he got home,"
0,"or if they would shake their heads, and say his overtaxed imagination"
0,had at last upset his reason.
0,At the end of half an hour it suddenly occurred to him that the prince
0,was gone a long time; then right away he began to feel lonely; very
0,"soon he fell to listening and longing, and ceased to toy with the"
0,"pretty things about him; he grew uneasy, then restless, then distressed."
0,"Suppose some one should come, and catch him in the prince’s clothes, and"
0,the prince not there to explain.
0,"Might they not hang him at once,"
0,and inquire into his case afterward?
0,He had heard that the great
0,were prompt about small matters.
0,His fear rose higher and higher; and
0,"trembling he softly opened the door to the antechamber, resolved to"
0,"fly and seek the prince, and, through him, protection and release."
0,Six
0,"gorgeous gentlemen-servants and two young pages of high degree, clothed"
0,"like butterflies, sprang to their feet and bowed low before him."
0,He
0,stepped quickly back and shut the door.
0,He said--
0,"“Oh, they mock at me!"
0,They will go and tell.
0,Oh!
0,why came I here to
0,cast away my life?”
0,"He walked up and down the floor, filled with nameless fears, listening,"
0,starting at every trifling sound.
0,"Presently the door swung open, and a"
0,silken page said--
0,“The Lady Jane Grey.”
0,"The door closed and a sweet young girl, richly clad, bounded toward him."
0,"But she stopped suddenly, and said in a distressed voice--"
0,"“Oh, what aileth thee, my lord?”"
0,Tom’s breath was nearly failing him; but he made shift to stammer out--
0,"“Ah, be merciful, thou!"
0,"In sooth I am no lord, but only poor Tom Canty"
0,of Offal Court in the city.
0,"Prithee let me see the prince, and he will"
0,"of his grace restore to me my rags, and let me hence unhurt."
0,"Oh, be"
0,"thou merciful, and save me!”"
0,"By this time the boy was on his knees, and supplicating with his eyes"
0,and uplifted hands as well as with his tongue.
0,The young girl seemed
0,horror-stricken.
0,She cried out--
0,"“O my lord, on thy knees?--and to _me_!”"
0,"Then she fled away in fright; and Tom, smitten with despair, sank down,"
0,murmuring--
0,"“There is no help, there is no hope."
0,Now will they come and take me.”
0,"Whilst he lay there benumbed with terror, dreadful tidings were speeding"
0,through the palace.
0,The whisper--for it was whispered always--flew from
0,"menial to menial, from lord to lady, down all the long corridors, from"
0,"story to story, from saloon to saloon, “The prince hath gone mad, the"
1,"prince hath gone mad!” Soon every saloon, every marble hall, had its"
0,"groups of glittering lords and ladies, and other groups of dazzling"
0,"lesser folk, talking earnestly together in whispers, and every face"
0,had in it dismay.
0,Presently a splendid official came marching by these
0,"groups, making solemn proclamation--"
0,“IN THE NAME OF THE KING!
0,"Let none list to this false and foolish matter, upon pain of death, nor"
0,"discuss the same, nor carry it abroad."
0,In the name of the King!”
0,The whisperings ceased as suddenly as if the whisperers had been
0,stricken dumb.
0,"Soon there was a general buzz along the corridors, of “The prince!"
0,"See,"
0,the prince comes!”
1,"Poor Tom came slowly walking past the low-bowing groups, trying to"
0,"bow in return, and meekly gazing upon his strange surroundings with"
0,bewildered and pathetic eyes.
0,Great nobles walked upon each side of
0,"him, making him lean upon them, and so steady his steps."
0,Behind him
0,followed the court-physicians and some servants.
0,Presently Tom found himself in a noble apartment of the palace and heard
0,the door close behind him.
0,Around him stood those who had come with
0,him.
0,"Before him, at a little distance, reclined a very large and very"
0,"fat man, with a wide, pulpy face, and a stern expression."
0,His large
0,"head was very grey; and his whiskers, which he wore only around his"
0,"face, like a frame, were grey also."
0,"His clothing was of rich stuff,"
0,"but old, and slightly frayed in places."
0,One of his swollen legs had a
0,"pillow under it, and was wrapped in bandages."
0,There was silence now;
0,"and there was no head there but was bent in reverence, except this"
0,man’s.
0,This stern-countenanced invalid was the dread Henry VIII.
0,He
0,said--and his face grew gentle as he began to speak--
0,"“How now, my lord Edward, my prince?"
0,"Hast been minded to cozen me, the"
0,"good King thy father, who loveth thee, and kindly useth thee, with a"
0,sorry jest?”
0,"Poor Tom was listening, as well as his dazed faculties would let him,"
0,"fell upon his ear, his face blanched, and he dropped as instantly upon"
0,his knees as if a shot had brought him there.
0,"Lifting up his hands, he"
0,exclaimed--
0,“Thou the _King_?
0,Then am I undone indeed!”
0,This speech seemed to stun the King.
0,His eyes wandered from face to
0,"face aimlessly, then rested, bewildered, upon the boy before him."
0,Then
0,he said in a tone of deep disappointment--
0,"“Alack, I had believed the rumour disproportioned to the truth; but I"
0,"fear me ’tis not so.” He breathed a heavy sigh, and said in a gentle"
0,"voice, “Come to thy father, child: thou art not well.”"
0,"Tom was assisted to his feet, and approached the Majesty of England,"
0,humble and trembling.
0,The King took the frightened face between his
0,"hands, and gazed earnestly and lovingly into it awhile, as if seeking"
0,"some grateful sign of returning reason there, then pressed the curly"
0,"head against his breast, and patted it tenderly."
0,Presently he said--
0,"“Dost not know thy father, child?"
0,Break not mine old heart; say thou
0,know’st me.
0,"Thou _dost_ know me, dost thou not?”"
0,"“Yea: thou art my dread lord the King, whom God preserve!”"
0,"“True, true--that is well--be comforted, tremble not so; there is none"
0,here would hurt thee; there is none here but loves thee.
0,Thou art better
0,now; thy ill dream passeth--is’t not so?
0,Thou wilt not miscall thyself
0,"again, as they say thou didst a little while agone?”"
0,"“I pray thee of thy grace believe me, I did but speak the truth, most"
0,"dread lord; for I am the meanest among thy subjects, being a pauper"
0,"born, and ’tis by a sore mischance and accident I am here, albeit I was"
0,therein nothing blameful.
0,"I am but young to die, and thou canst save me"
0,with one little word.
0,"Oh speak it, sir!”"
0,“Die?
0,"Talk not so, sweet prince--peace, peace, to thy troubled"
0,heart--thou shalt not die!”
0,Tom dropped upon his knees with a glad cry--
0,"“God requite thy mercy, O my King, and save thee long to bless thy"
0,"land!” Then springing up, he turned a joyful face toward the two lords"
0,"in waiting, and exclaimed, “Thou heard’st it!"
0,I am not to die:  the
0,"King hath said it!” There was no movement, save that all bowed with"
0,grave respect; but no one spoke.
0,"He hesitated, a little confused, then"
0,"turned timidly toward the King, saying, “I may go now?”"
0,“Go?
0,"Surely, if thou desirest."
0,But why not tarry yet a little?
0,Whither
0,would’st go?”
0,"Tom dropped his eyes, and answered humbly--"
0,"“Peradventure I mistook; but I did think me free, and so was I moved"
0,"to seek again the kennel where I was born and bred to misery, yet which"
0,"harboureth my mother and my sisters, and so is home to me; whereas these"
0,"pomps and splendours whereunto I am not used--oh, please you, sir, to"
0,let me go!”
0,"The King was silent and thoughtful a while, and his face betrayed a"
0,growing distress and uneasiness.
0,"Presently he said, with something of"
0,hope in his voice--
0,"“Perchance he is but mad upon this one strain, and hath his wits"
0,unmarred as toucheth other matter.
0,God send it may be so!
0,We will make
0,trial.”
0,"Then he asked Tom a question in Latin, and Tom answered him lamely in"
0,the same tongue.
0,The lords and doctors manifested their gratification
0,also.
0,The King said--
0,"“‘Twas not according to his schooling and ability, but showeth that his"
0,"mind is but diseased, not stricken fatally."
0,"How say you, sir?”"
0,"The physician addressed bowed low, and replied--"
0,"“It jumpeth with my own conviction, sire, that thou hast divined"
0,aright.”
0,"The King looked pleased with this encouragement, coming as it did from"
0,"so excellent authority, and continued with good heart--"
0,“Now mark ye all: we will try him further.”
0,He put a question to Tom in French.
0,"Tom stood silent a moment,"
0,"embarrassed by having so many eyes centred upon him, then said"
0,diffidently--
0,"“I have no knowledge of this tongue, so please your majesty.”"
0,The King fell back upon his couch.
0,The attendants flew to his
0,"assistance; but he put them aside, and said--"
0,“Trouble me not--it is nothing but a scurvy faintness.
0,Raise me!
0,"There,"
0,‘tis sufficient.
0,"Come hither, child; there, rest thy poor troubled head"
0,"upon thy father’s heart, and be at peace."
0,Thou’lt soon be well:  ’tis
0,but a passing fantasy.
0,Fear thou not; thou’lt soon be well.”  Then
0,"he turned toward the company: his gentle manner changed, and baleful"
0,lightnings began to play from his eyes.
0,He said--
0,“List ye all!
0,This my son is mad; but it is not permanent.
0,Over-study
0,"hath done this, and somewhat too much of confinement."
0,Away with his
0,books and teachers!
0,see ye to it.
0,"Pleasure him with sports, beguile him"
0,"in wholesome ways, so that his health come again.” He raised himself"
0,"higher still, and went on with energy, “He is mad; but he is my son,"
0,"and England’s heir; and, mad or sane, still shall he reign!"
0,And hear ye
0,"further, and proclaim it: whoso speaketh of this his distemper worketh"
0,"against the peace and order of these realms, and shall to the gallows!"
0,Give me to drink--I burn:  this sorrow sappeth my strength.
0,"There, take away the cup."
0,Support me.
0,"There, that is well."
0,"Mad,"
0,is he?
0,"Were he a thousand times mad, yet is he Prince of Wales, and I"
0,the King will confirm it.
0,This very morrow shall he be installed in his
0,princely dignity in due and ancient form.
0,"Take instant order for it, my"
0,lord Hertford.”
0,"One of the nobles knelt at the royal couch, and said--"
0,“The King’s majesty knoweth that the Hereditary Great Marshal of England
0,lieth attainted in the Tower.
0,It were not meet that one attainted--”
0,“Peace!
0,Insult not mine ears with his hated name.
0,Is this man to
0,live for ever?
0,Am I to be baulked of my will?
0,Is the prince to tarry
0,"uninstalled, because, forsooth, the realm lacketh an Earl Marshal"
0,free of treasonable taint to invest him with his honours?
0,"No, by the"
0,splendour of God!
0,Warn my Parliament to bring me Norfolk’s doom before
0,"the sun rise again, else shall they answer for it grievously!” {1}"
0,Lord Hertford said--
0,"“The King’s will is law;” and, rising, returned to his former place."
0,"Gradually the wrath faded out of the old King’s face, and he said--"
0,"“Kiss me, my prince."
0,There .
0,what fearest thou?
0,Am I not thy
0,loving father?”
0,"“Thou art good to me that am unworthy, O mighty and gracious lord: that"
0,in truth I know.
0,But--but--it grieveth me to think of him that is to
0,"die, and--”"
0,"“Ah, ’tis like thee, ’tis like thee!"
0,I know thy heart is still the
0,"same, even though thy mind hath suffered hurt, for thou wert ever of a"
0,gentle spirit.
0,But this duke standeth between thee and thine honours:
0,I will have another in his stead that shall bring no taint to his great
0,office.
0,"Comfort thee, my prince:  trouble not thy poor head with this"
0,matter.”
0,"“But is it not I that speed him hence, my liege?"
0,How long might he not
0,"live, but for me?”"
0,"“Take no thought of him, my prince: he is not worthy."
0,Kiss me once
0,"again, and go to thy trifles and amusements; for my malady distresseth"
0,me.
0,"I am aweary, and would rest."
0,Go with thine uncle Hertford and thy
0,"people, and come again when my body is refreshed.”"
0,"Tom, heavy-hearted, was conducted from the presence, for this last"
0,sentence was a death-blow to the hope he had cherished that now he would
0,be set free.
0,"Once more he heard the buzz of low voices exclaiming, “The"
0,"prince, the prince comes!”"
0,His spirits sank lower and lower as he moved between the glittering
0,files of bowing courtiers; for he recognised that he was indeed a
0,"captive now, and might remain for ever shut up in this gilded cage, a"
0,"forlorn and friendless prince, except God in his mercy take pity on him"
0,and set him free.
0,"And, turn where he would, he seemed to see floating in the air the"
0,"severed head and the remembered face of the great Duke of Norfolk, the"
0,eyes fixed on him reproachfully.
0,His old dreams had been so pleasant; but this reality was so dreary!
0,CHAPTER VI.
0,Tom receives instructions.
1,"Tom was conducted to the principal apartment of a noble suite, and made"
0,"to sit down--a thing which he was loth to do, since there were elderly"
0,men and men of high degree about him.
0,He begged them to be seated
0,"also, but they only bowed their thanks or murmured them, and remained"
0,standing.
0,"He would have insisted, but his ‘uncle’ the Earl of Hertford"
0,whispered in his ear--
0,"“Prithee, insist not, my lord; it is not meet that they sit in thy"
0,presence.”
0,"The Lord St. John was announced, and after making obeisance to Tom, he"
0,said--
0,"“I come upon the King’s errand, concerning a matter which requireth"
0,privacy.
0,Will it please your royal highness to dismiss all that attend
0,"you here, save my lord the Earl of Hertford?”"
0,"Observing that Tom did not seem to know how to proceed, Hertford"
0,"whispered him to make a sign with his hand, and not trouble himself to"
0,speak unless he chose.
0,"When the waiting gentlemen had retired, Lord St."
0,John said--
0,"“His majesty commandeth, that for due and weighty reasons of state, the"
0,prince’s grace shall hide his infirmity in all ways that be within his
0,"power, till it be passed and he be as he was before."
0,"To wit, that he"
0,"shall deny to none that he is the true prince, and heir to England’s"
0,"greatness; that he shall uphold his princely dignity, and shall receive,"
0,"without word or sign of protest, that reverence and observance which"
0,unto it do appertain of right and ancient usage; that he shall cease to
0,speak to any of that lowly birth and life his malady hath conjured
0,out of the unwholesome imaginings of o’er-wrought fancy; that he shall
0,strive with diligence to bring unto his memory again those faces which
0,"he was wont to know--and where he faileth he shall hold his peace,"
0,neither betraying by semblance of surprise or other sign that he hath
0,"forgot; that upon occasions of state, whensoever any matter shall"
0,perplex him as to the thing he should do or the utterance he should
0,"make, he shall show nought of unrest to the curious that look on, but"
0,"take advice in that matter of the Lord Hertford, or my humble self,"
0,which are commanded of the King to be upon this service and close at
0,"call, till this commandment be dissolved."
0,"Thus saith the King’s majesty,"
0,"who sendeth greeting to your royal highness, and prayeth that God will"
0,of His mercy quickly heal you and have you now and ever in His holy
0,keeping.”
0,The Lord St. John made reverence and stood aside.
0,Tom replied
0,resignedly--
0,“The King hath said it.
0,"None may palter with the King’s command, or fit"
0,"it to his ease, where it doth chafe, with deft evasions."
0,The King shall
0,be obeyed.”
0,Lord Hertford said--
0,“Touching the King’s majesty’s ordainment concerning books and such like
0,"serious matters, it may peradventure please your highness to ease your"
0,"time with lightsome entertainment, lest you go wearied to the banquet"
0,and suffer harm thereby.”
0,Tom’s face showed inquiring surprise; and a blush followed when he saw
0,Lord St. John’s eyes bent sorrowfully upon him.
0,His lordship said--
0,"“Thy memory still wrongeth thee, and thou hast shown surprise--but"
0,"suffer it not to trouble thee, for ’tis a matter that will not bide,"
0,but depart with thy mending malady.
0,My Lord of Hertford speaketh of
0,"the city’s banquet which the King’s majesty did promise, some two months"
0,"flown, your highness should attend."
0,Thou recallest it now?”
0,"“It grieves me to confess it had indeed escaped me,” said Tom, in a"
0,hesitating voice; and blushed again.
0,At this moment the Lady Elizabeth and the Lady Jane Grey were announced.
0,"The two lords exchanged significant glances, and Hertford stepped"
0,quickly toward the door.
0,"As the young girls passed him, he said in a"
0,low voice--
0,"“I pray ye, ladies, seem not to observe his humours, nor show surprise"
0,when his memory doth lapse--it will grieve you to note how it doth stick
0,at every trifle.”
0,Meantime Lord St. John was saying in Tom’s ear--
0,"“Please you, sir, keep diligently in mind his majesty’s desire."
0,Remember
0,all thou canst--_seem_ to remember all else.
0,Let them not perceive that
0,"thou art much changed from thy wont, for thou knowest how tenderly thy"
0,old play-fellows bear thee in their hearts and how ’twould grieve them.
0,"Art willing, sir, that I remain?--and thine uncle?”"
0,"Tom signified assent with a gesture and a murmured word, for he was"
0,"already learning, and in his simple heart was resolved to acquit himself"
0,"as best he might, according to the King’s command."
0,"In spite of every precaution, the conversation among the young people"
0,became a little embarrassing at times.
0,"More than once, in truth,"
0,Tom was near to breaking down and confessing himself unequal to his
0,"tremendous part; but the tact of the Princess Elizabeth saved him, or a"
0,"word from one or the other of the vigilant lords, thrown in apparently"
0,"by chance, had the same happy effect."
0,Once the little Lady Jane turned
0,"to Tom and dismayed him with this question,--"
0,"“Hast paid thy duty to the Queen’s majesty to-day, my lord?”"
0,"Tom hesitated, looked distressed, and was about to stammer out something"
0,"at hazard, when Lord St. John took the word and answered for him"
0,with the easy grace of a courtier accustomed to encounter delicate
0,difficulties and to be ready for them--
0,"“He hath indeed, madam, and she did greatly hearten him, as touching his"
0,"majesty’s condition; is it not so, your highness?”"
0,"Tom mumbled something that stood for assent, but felt that he was"
0,getting upon dangerous ground.
0,Somewhat later it was mentioned that
0,"Tom was to study no more at present, whereupon her little ladyship"
0,exclaimed--
0,"“‘Tis a pity, ’tis a pity!"
0,Thou wert proceeding bravely.
0,But bide thy
0,time in patience: it will not be for long.
0,Thou’lt yet be graced
0,"with learning like thy father, and make thy tongue master of as many"
