0,CHAPTER I.
0,"languages as his, good my prince.”"
0,"“My father!” cried Tom, off his guard for the moment."
0,“I trow he cannot
0,speak his own so that any but the swine that kennel in the styes may
0,tell his meaning; and as for learning of any sort soever--”
0,He looked up and encountered a solemn warning in my Lord St. John’s
0,eyes.
0,"He stopped, blushed, then continued low and sadly: “Ah, my malady"
0,"persecuteth me again, and my mind wandereth."
0,I meant the King’s grace
0,no irreverence.”
0,"“We know it, sir,” said the Princess Elizabeth, taking her ‘brother’s’"
0,"hand between her two palms, respectfully but caressingly; “trouble not"
0,thyself as to that.
0,"The fault is none of thine, but thy distemper’s.”"
0,"“Thou’rt a gentle comforter, sweet lady,” said Tom, gratefully, “and my"
0,"heart moveth me to thank thee for’t, an’ I may be so bold.”"
0,Once the giddy little Lady Jane fired a simple Greek phrase at Tom.
0,The Princess Elizabeth’s quick eye saw by the serene blankness of the
0,target’s front that the shaft was overshot; so she tranquilly delivered
0,"a return volley of sounding Greek on Tom’s behalf, and then straightway"
0,changed the talk to other matters.
0,"Time wore on pleasantly, and likewise smoothly, on the whole."
0,Snags and
0,"sandbars grew less and less frequent, and Tom grew more and more at"
0,"his ease, seeing that all were so lovingly bent upon helping him and"
0,overlooking his mistakes.
0,When it came out that the little ladies were
0,"to accompany him to the Lord Mayor’s banquet in the evening, his heart"
0,"gave a bound of relief and delight, for he felt that he should not be"
0,"friendless, now, among that multitude of strangers; whereas, an"
0,"hour earlier, the idea of their going with him would have been an"
0,insupportable terror to him.
0,"Tom’s guardian angels, the two lords, had had less comfort in the"
0,interview than the other parties to it.
0,They felt much as if they were
0,piloting a great ship through a dangerous channel; they were on the
0,"alert constantly, and found their office no child’s play."
0,"Wherefore,"
0,"at last, when the ladies’ visit was drawing to a close and the Lord"
0,"Guilford Dudley was announced, they not only felt that their charge had"
0,"been sufficiently taxed for the present, but also that they themselves"
0,were not in the best condition to take their ship back and make their
0,anxious voyage all over again.
0,So they respectfully advised Tom to
0,"excuse himself, which he was very glad to do, although a slight shade"
0,of disappointment might have been observed upon my Lady Jane’s face when
0,she heard the splendid stripling denied admittance.
0,"There was a pause now, a sort of waiting silence which Tom could not"
0,understand.
0,"He glanced at Lord Hertford, who gave him a sign--but he"
0,failed to understand that also.
0,The ready Elizabeth came to the rescue
0,with her usual easy grace.
0,She made reverence and said--
0,“Have we leave of the prince’s grace my brother to go?”
0,Tom said--
0,"“Indeed your ladyships can have whatsoever of me they will, for the"
0,asking; yet would I rather give them any other thing that in my poor
0,"power lieth, than leave to take the light and blessing of their presence"
0,hence.
0,"Give ye good den, and God be with ye!” Then he smiled inwardly"
0,"at the thought, “‘Tis not for nought I have dwelt but among princes in"
0,"my reading, and taught my tongue some slight trick of their broidered"
0,and gracious speech withal!”
0,"When the illustrious maidens were gone, Tom turned wearily to his"
0,keepers and said--
0,“May it please your lordships to grant me leave to go into some corner
0,and rest me?”
0,Lord Hertford said--
0,"“So please your highness, it is for you to command, it is for us to"
0,obey.
0,"That thou should’st rest is indeed a needful thing, since thou"
0,must journey to the city presently.”
0,"He touched a bell, and a page appeared, who was ordered to desire the"
0,presence of Sir William Herbert.
0,"This gentleman came straightway, and"
0,conducted Tom to an inner apartment.
0,Tom’s first movement there was
0,"to reach for a cup of water; but a silk-and-velvet servitor seized it,"
0,"dropped upon one knee, and offered it to him on a golden salver."
0,"Next the tired captive sat down and was going to take off his buskins,"
0,"timidly asking leave with his eye, but another silk-and-velvet"
0,discomforter went down upon his knees and took the office from him.
0,He
0,"made two or three further efforts to help himself, but being promptly"
0,"forestalled each time, he finally gave up, with a sigh of resignation"
0,"and a murmured “Beshrew me, but I marvel they do not require to breathe"
0,"for me also!” Slippered, and wrapped in a sumptuous robe, he laid"
0,"himself down at last to rest, but not to sleep, for his head was too"
0,full of thoughts and the room too full of people.
0,He could not dismiss
0,"the former, so they stayed; he did not know enough to dismiss the"
0,"latter, so they stayed also, to his vast regret--and theirs."
0,Tom’s departure had left his two noble guardians alone.
0,They mused a
0,"while, with much head-shaking and walking the floor, then Lord St. John"
0,said--
0,"“Plainly, what dost thou think?”"
0,"“Plainly, then, this."
0,The King is near his end; my nephew is mad--mad
0,"will mount the throne, and mad remain."
0,"God protect England, since she"
0,will need it!”
0,"“Verily it promiseth so, indeed."
0,But .
0,have you no misgivings as to
0,as to 
0,"The speaker hesitated, and finally stopped."
0,He evidently felt that he
0,was upon delicate ground.
0,"Lord Hertford stopped before him, looked into"
0,"his face with a clear, frank eye, and said--"
0,“Speak on--there is none to hear but me.
0,Misgivings as to what?”
0,"“I am full loth to word the thing that is in my mind, and thou so near"
0,"to him in blood, my lord."
0,"But craving pardon if I do offend, seemeth it"
0,not strange that madness could so change his port and manner?--not but
0,"that his port and speech are princely still, but that they _differ_,"
0,"in one unweighty trifle or another, from what his custom was aforetime."
0,Seemeth it not strange that madness should filch from his memory his
0,father’s very lineaments; the customs and observances that are his due
0,"from such as be about him; and, leaving him his Latin, strip him of his"
0,Greek and French?
0,"My lord, be not offended, but ease my mind of its"
0,disquiet and receive my grateful thanks.
0,"It haunteth me, his saying he"
0,"was not the prince, and so--”"
0,"“Peace, my lord, thou utterest treason!"
0,Hast forgot the King’s command?
0,Remember I am party to thy crime if I but listen.”
0,"St. John paled, and hastened to say--"
0,"“I was in fault, I do confess it."
0,"Betray me not, grant me this grace"
0,"out of thy courtesy, and I will neither think nor speak of this thing"
0,more.
0,"Deal not hardly with me, sir, else am I ruined.”"
0,"“I am content, my lord."
0,"So thou offend not again, here or in the"
0,"ears of others, it shall be as though thou hadst not spoken."
0,But thou
0,need’st not have misgivings.
0,"He is my sister’s son; are not his voice,"
0,"his face, his form, familiar to me from his cradle?"
0,Madness can do all
0,"the odd conflicting things thou seest in him, and more."
0,Dost not recall
0,"how that the old Baron Marley, being mad, forgot the favour of his"
0,"own countenance that he had known for sixty years, and held it was"
0,"another’s; nay, even claimed he was the son of Mary Magdalene, and that"
0,"his head was made of Spanish glass; and, sooth to say, he suffered none"
0,"to touch it, lest by mischance some heedless hand might shiver it?"
0,Give
0,"thy misgivings easement, good my lord."
0,This is the very prince--I know
0,him well--and soon will be thy king; it may advantage thee to bear this
0,"in mind, and more dwell upon it than the other.”"
0,"After some further talk, in which the Lord St. John covered up his"
0,mistake as well as he could by repeated protests that his faith was
0,"thoroughly grounded now, and could not be assailed by doubts again, the"
0,"Lord Hertford relieved his fellow-keeper, and sat down to keep watch and"
0,ward alone.
0,"He was soon deep in meditation, and evidently the longer he"
0,"thought, the more he was bothered."
0,By-and-by he began to pace the floor
0,and mutter.
0,"“Tush, he _must_ be the prince!"
0,Will any be in all the land maintain
0,"there can be two, not of one blood and birth, so marvellously twinned?"
0,"And even were it so, ’twere yet a stranger miracle that chance should"
0,cast the one into the other’s place.
0,"Nay, ’tis folly, folly, folly!”"
0,Presently he said--
0,"“Now were he impostor and called himself prince, look you _that_ would"
0,be natural; that would be reasonable.
0,"But lived ever an impostor yet,"
0,"who, being called prince by the king, prince by the court, prince by"
0,"all, _denied_ his dignity and pleaded against his exaltation?"
0,_No_!
0,By
0,"the soul of St. Swithin, no!"
0,"This is the true prince, gone mad!”"
0,CHAPTER VII.
1,Tom’s first royal dinner.
0,"Somewhat after one in the afternoon, Tom resignedly underwent the ordeal"
0,of being dressed for dinner.
0,He found himself as finely clothed as
0,"before, but everything different, everything changed, from his ruff to"
0,his stockings.
0,He was presently conducted with much state to a spacious
0,"and ornate apartment, where a table was already set for one."
0,Its
0,"furniture was all of massy gold, and beautified with designs which"
0,"well-nigh made it priceless, since they were the work of Benvenuto."
0,The
0,room was half-filled with noble servitors.
0,"A chaplain said grace, and"
0,"Tom was about to fall to, for hunger had long been constitutional with"
0,"him, but was interrupted by my lord the Earl of Berkeley, who fastened a"
0,napkin about his neck; for the great post of Diaperers to the Prince
0,of Wales was hereditary in this nobleman’s family.
0,Tom’s cupbearer was
0,"present, and forestalled all his attempts to help himself to wine."
0,The
0,"Taster to his highness the Prince of Wales was there also, prepared to"
0,"taste any suspicious dish upon requirement, and run the risk of being"
0,poisoned.
0,"He was only an ornamental appendage at this time, and was"
0,"seldom called upon to exercise his function; but there had been times,"
0,"not many generations past, when the office of taster had its perils,"
0,and was not a grandeur to be desired.
0,Why they did not use a dog or a
0,plumber seems strange; but all the ways of royalty are strange.
0,My
0,"Lord d’Arcy, First Groom of the Chamber, was there, to do goodness knows"
0,what; but there he was--let that suffice.
0,The Lord Chief Butler was
0,"there, and stood behind Tom’s chair, overseeing the solemnities, under"
0,"command of the Lord Great Steward and the Lord Head Cook, who stood"
0,near.
0,Tom had three hundred and eighty-four servants beside these;
0,"but they were not all in that room, of course, nor the quarter of them;"
0,neither was Tom aware yet that they existed.
0,All those that were present had been well drilled within the hour to
0,"remember that the prince was temporarily out of his head, and to be"
0,careful to show no surprise at his vagaries.
0,These ‘vagaries’ were
0,soon on exhibition before them; but they only moved their compassion and
0,"their sorrow, not their mirth."
0,It was a heavy affliction to them to see
0,the beloved prince so stricken.
0,"Poor Tom ate with his fingers mainly; but no one smiled at it, or even"
0,seemed to observe it.
0,"He inspected his napkin curiously, and with deep"
0,"interest, for it was of a very dainty and beautiful fabric, then said"
0,with simplicity--
0,"“Prithee, take it away, lest in mine unheedfulness it be soiled.”"
0,"The Hereditary Diaperer took it away with reverent manner, and without"
0,word or protest of any sort.
0,"Tom examined the turnips and the lettuce with interest, and asked what"
0,"they were, and if they were to be eaten; for it was only recently that"
0,men had begun to raise these things in England in place of importing
0,them as luxuries from Holland.
0,{1}  His question was answered with grave
0,"respect, and no surprise manifested."
0,"When he had finished his dessert,"
0,"he filled his pockets with nuts; but nobody appeared to be aware of it,"
0,or disturbed by it.
0,But the next moment he was himself disturbed by
0,"it, and showed discomposure; for this was the only service he had been"
0,"permitted to do with his own hands during the meal, and he did not doubt"
0,that he had done a most improper and unprincely thing.
0,At that moment
0,"the muscles of his nose began to twitch, and the end of that organ to"
0,lift and wrinkle.
0,"This continued, and Tom began to evince a growing"
0,distress.
0,"He looked appealingly, first at one and then another of the"
0,"lords about him, and tears came into his eyes."
0,They sprang forward with
0,"dismay in their faces, and begged to know his trouble."
0,Tom said with
0,genuine anguish--
0,“I crave your indulgence: my nose itcheth cruelly.
0,What is the custom
0,and usage in this emergence?
0,"Prithee, speed, for ’tis but a little time"
0,that I can bear it.”
0,"None smiled; but all were sore perplexed, and looked one to the other"
0,in deep tribulation for counsel.
0,"But behold, here was a dead wall, and"
0,nothing in English history to tell how to get over it.
0,The Master of
0,Ceremonies was not present: there was no one who felt safe to venture
0,"upon this uncharted sea, or risk the attempt to solve this solemn"
0,problem.
0,Alas!
0,there was no Hereditary Scratcher.
0,Meantime the tears
0,"had overflowed their banks, and begun to trickle down Tom’s cheeks."
0,His
0,twitching nose was pleading more urgently than ever for relief.
0,At last
0,nature broke down the barriers of etiquette: Tom lifted up an inward
0,"prayer for pardon if he was doing wrong, and brought relief to the"
0,burdened hearts of his court by scratching his nose himself.
0,"His meal being ended, a lord came and held before him a broad, shallow,"
0,"golden dish with fragrant rosewater in it, to cleanse his mouth and"
0,fingers with; and my lord the Hereditary Diaperer stood by with a napkin
0,for his use.
0,"Tom gazed at the dish a puzzled moment or two, then raised"
0,"it to his lips, and gravely took a draught."
0,Then he returned it to the
0,"waiting lord, and said--"
0,"“Nay, it likes me not, my lord: it hath a pretty flavour, but it"
0,wanteth strength.”
0,This new eccentricity of the prince’s ruined mind made all the hearts
0,about him ache; but the sad sight moved none to merriment.
0,Tom’s next unconscious blunder was to get up and leave the table
0,"just when the chaplain had taken his stand behind his chair, and with"
0,"uplifted hands, and closed, uplifted eyes, was in the act of beginning"
0,the blessing.
0,Still nobody seemed to perceive that the prince had done
0,a thing unusual.
1,By his own request our small friend was now conducted to his private
0,"cabinet, and left there alone to his own devices."
0,Hanging upon hooks in
0,the oaken wainscoting were the several pieces of a suit of shining steel
0,"armour, covered all over with beautiful designs exquisitely inlaid"
0,in gold.
0,This martial panoply belonged to the true prince--a recent
0,present from Madam Parr the Queen.
0,"Tom put on the greaves, the"
0,"gauntlets, the plumed helmet, and such other pieces as he could don"
0,"without assistance, and for a while was minded to call for help and"
0,"complete the matter, but bethought him of the nuts he had brought away"
0,"from dinner, and the joy it would be to eat them with no crowd to eye"
0,"him, and no Grand Hereditaries to pester him with undesired services;"
0,"so he restored the pretty things to their several places, and soon was"
0,"cracking nuts, and feeling almost naturally happy for the first time"
0,since God for his sins had made him a prince.
0,When the nuts were all
0,"gone, he stumbled upon some inviting books in a closet, among them one"
0,about the etiquette of the English court.
0,This was a prize.
0,He lay down
0,"upon a sumptuous divan, and proceeded to instruct himself with honest"
0,zeal.
0,Let us leave him there for the present.
0,CHAPTER VIII.
0,The Question of the Seal.
1,About five o’clock Henry VIII.
0,"awoke out of an unrefreshing nap, and"
0,"muttered to himself, “Troublous dreams, troublous dreams!"
0,Mine end is
0,"now at hand: so say these warnings, and my failing pulses do confirm"
0,"it.” Presently a wicked light flamed up in his eye, and he muttered,"
0,“Yet will not I die till _He_ go before.”
0,"His attendants perceiving that he was awake, one of them asked his"
0,"pleasure concerning the Lord Chancellor, who was waiting without."
0,"“Admit him, admit him!” exclaimed the King eagerly."
0,"The Lord Chancellor entered, and knelt by the King’s couch, saying--"
0,"“I have given order, and, according to the King’s command, the peers of"
0,"the realm, in their robes, do now stand at the bar of the House, where,"
0,"having confirmed the Duke of Norfolk’s doom, they humbly wait his"
0,majesty’s further pleasure in the matter.”
0,The King’s face lit up with a fierce joy.
0,Said he--
0,“Lift me up!
0,"In mine own person will I go before my Parliament, and"
0,with mine own hand will I seal the warrant that rids me of--”
0,His voice failed; an ashen pallor swept the flush from his cheeks; and
0,"the attendants eased him back upon his pillows, and hurriedly assisted"
0,him with restoratives.
0,Presently he said sorrowfully--
0,"“Alack, how have I longed for this sweet hour!"
0,"and lo, too late it"
0,"cometh, and I am robbed of this so coveted chance."
0,"But speed ye, speed"
0,ye!
0,let others do this happy office sith ’tis denied to me.
0,I put my
0,"Great Seal in commission: choose thou the lords that shall compose it,"
0,and get ye to your work.
0,"Speed ye, man!"
0,Before the sun shall rise and
0,"set again, bring me his head that I may see it.”"
0,"“According to the King’s command, so shall it be."
0,Will’t please your
0,"majesty to order that the Seal be now restored to me, so that I may"
0,forth upon the business?”
0,“The Seal?
0,Who keepeth the Seal but thou?”
0,"“Please your majesty, you did take it from me two days since, saying it"
0,should no more do its office till your own royal hand should use it upon
0,the Duke of Norfolk’s warrant.”
0,"“Why, so in sooth I did: I do remember."
0,What did I with it?...
0,I am very feeble.
0,So oft these days doth my memory play the
0,traitor with me.
0,"’tis strange, strange--”"
0,"The King dropped into inarticulate mumblings, shaking his grey head"
0,"weakly from time to time, and gropingly trying to recollect what he"
0,had done with the Seal.
0,At last my Lord Hertford ventured to kneel and
0,offer information--
0,"“Sire, if that I may be so bold, here be several that do remember with"
0,me how that you gave the Great Seal into the hands of his highness the
0,Prince of Wales to keep against the day that--”
0,"“True, most true!” interrupted the King."
0,“Fetch it!
0,Go:  time flieth!”
0,"Lord Hertford flew to Tom, but returned to the King before very long,"
0,troubled and empty-handed.
0,He delivered himself to this effect--
0,"“It grieveth me, my lord the King, to bear so heavy and unwelcome"
0,tidings; but it is the will of God that the prince’s affliction abideth
0,"still, and he cannot recall to mind that he received the Seal."
0,So came
0,"I quickly to report, thinking it were waste of precious time, and"
0,"little worth withal, that any should attempt to search the long array of"
0,chambers and saloons that belong unto his royal high--”
0,A groan from the King interrupted the lord at this point.
0,After a
0,"little while his majesty said, with a deep sadness in his tone--"
0,"“Trouble him no more, poor child."
0,"The hand of God lieth heavy upon him,"
0,"and my heart goeth out in loving compassion for him, and sorrow that I"
0,"may not bear his burden on mine old trouble-weighted shoulders, and so"
0,bring him peace.”
0,"He closed his eyes, fell to mumbling, and presently was silent."
0,After
0,"a time he opened his eyes again, and gazed vacantly around until his"
0,glance rested upon the kneeling Lord Chancellor.
0,Instantly his face
0,flushed with wrath--
0,"“What, thou here yet!"
0,"By the glory of God, an’ thou gettest not about"
0,"that traitor’s business, thy mitre shall have holiday the morrow for"
0,lack of a head to grace withal!”
0,The trembling Chancellor answered--
0,"“Good your Majesty, I cry you mercy!"
0,I but waited for the Seal.”
0,"“Man, hast lost thy wits?"
0,The small Seal which aforetime I was wont
0,to take with me abroad lieth in my treasury.
0,"And, since the Great Seal"
0,"hath flown away, shall not it suffice?"
0,Hast lost thy wits?
0,Begone!
0,And hark ye--come no more till thou do bring his head.”
0,The poor Chancellor was not long in removing himself from this dangerous
0,vicinity; nor did the commission waste time in giving the royal assent
0,"to the work of the slavish Parliament, and appointing the morrow for the"
0,"beheading of the premier peer of England, the luckless Duke of Norfolk."
0,CHAPTER IX.
0,The river pageant.
1,At nine in the evening the whole vast river-front of the palace was
0,blazing with light.
0,"The river itself, as far as the eye could reach"
0,"citywards, was so thickly covered with watermen’s boats and with"
0,"pleasure-barges, all fringed with coloured lanterns, and gently agitated"
0,"by the waves, that it resembled a glowing and limitless garden of"
0,flowers stirred to soft motion by summer winds.
0,The grand terrace of
0,"stone steps leading down to the water, spacious enough to mass the army"
0,"of a German principality upon, was a picture to see, with its ranks"
0,"of royal halberdiers in polished armour, and its troops of brilliantly"
0,"costumed servitors flitting up and down, and to and fro, in the hurry of"
0,preparation.
0,"Presently a command was given, and immediately all living creatures"
0,vanished from the steps.
0,Now the air was heavy with the hush of
0,suspense and expectancy.
0,"As far as one’s vision could carry, he might"
0,"see the myriads of people in the boats rise up, and shade their eyes"
0,"from the glare of lanterns and torches, and gaze toward the palace."
0,A file of forty or fifty state barges drew up to the steps.
0,They were
0,"richly gilt, and their lofty prows and sterns were elaborately carved."
0,Some of them were decorated with banners and streamers; some with
0,cloth-of-gold and arras embroidered with coats-of-arms; others with
0,"silken flags that had numberless little silver bells fastened to them,"
0,which shook out tiny showers of joyous music whenever the breezes
0,"fluttered them; others of yet higher pretensions, since they belonged to"
0,"nobles in the prince’s immediate service, had their sides picturesquely"
0,fenced with shields gorgeously emblazoned with armorial bearings.
0,Each
0,state barge was towed by a tender.
0,"Besides the rowers, these tenders"
0,"carried each a number of men-at-arms in glossy helmet and breastplate,"
0,and a company of musicians.
0,The advance-guard of the expected procession now appeared in the great
0,"gateway, a troop of halberdiers."
0,‘They were dressed in striped hose of
0,"black and tawny, velvet caps graced at the sides with silver roses, and"
0,"doublets of murrey and blue cloth, embroidered on the front and back"
0,"with the three feathers, the prince’s blazon, woven in gold."
0,Their
0,"halberd staves were covered with crimson velvet, fastened with gilt"
0,"nails, and ornamented with gold tassels."
0,Filing off on the right and
0,"left, they formed two long lines, extending from the gateway of the"
0,palace to the water’s edge.
0,A thick rayed cloth or carpet was
0,"then unfolded, and laid down between them by attendants in the"
0,gold-and-crimson liveries of the prince.
0,"This done, a flourish of"
0,trumpets resounded from within.
0,A lively prelude arose from the
0,musicians on the water; and two ushers with white wands marched with a
0,slow and stately pace from the portal.
0,They were followed by an officer
0,"bearing the civic mace, after whom came another carrying the city’s"
0,"sword; then several sergeants of the city guard, in their full"
0,"accoutrements, and with badges on their sleeves; then the Garter"
0,"King-at-arms, in his tabard; then several Knights of the Bath, each with"
0,"a white lace on his sleeve; then their esquires; then the judges, in"
0,their robes of scarlet and coifs; then the Lord High Chancellor of
0,"England, in a robe of scarlet, open before, and purfled with minever;"
0,"then a deputation of aldermen, in their scarlet cloaks; and then the"
0,"heads of the different civic companies, in their robes of state."
0,Now
0,"came twelve French gentlemen, in splendid habiliments, consisting of"
0,"pourpoints of white damask barred with gold, short mantles of"
0,"crimson velvet lined with violet taffeta, and carnation coloured"
0,"hauts-de-chausses, and took their way down the steps."
0,They were of the
0,"suite of the French ambassador, and were followed by twelve cavaliers of"
0,"the suite of the Spanish ambassador, clothed in black velvet, unrelieved"
0,by any ornament.
0,Following these came several great English nobles with
0,their attendants.’
0,"There was a flourish of trumpets within; and the Prince’s uncle, the"
0,"future great Duke of Somerset, emerged from the gateway, arrayed in a"
0,"‘doublet of black cloth-of-gold, and a cloak of crimson satin flowered"
0,"with gold, and ribanded with nets of silver.’ He turned, doffed"
